<?xml version="1.0"?>
<?xml-stylesheet type="text/xsl" href="pdml2html.xsl"?>
<!-- You can find pdml2html.xsl in C:\Program Files\Wireshark or at http://anonsvn.wireshark.org/trunk/wireshark/pdml2html.xsl. -->
<pdml version="0" creator="wireshark/1.12.1" time="Fri Sep 26 10:04:04 2014" capture_file="wireshark_amqp_noauth_connect_close.pcap">
<packet>
  <proto name="geninfo" pos="0" showname="General information" size="161">
    <field name="num" pos="0" show="1" showname="Number" value="1" size="161"/>
    <field name="len" pos="0" show="161" showname="Frame Length" value="a1" size="161"/>
    <field name="caplen" pos="0" show="161" showname="Captured Length" value="a1" size="161"/>
    <field name="timestamp" pos="0" show="Sep 26, 2014 02:57:48.824785000 Pacific Daylight Time" showname="Captured Time" value="1411725468.824785000" size="161"/>
  </proto>
  <proto name="frame" showname="Frame 1: 161 bytes on wire (1288 bits), 161 bytes captured (1288 bits)" size="161" pos="0">
    <field name="frame.encap_type" showname="Encapsulation type: Raw IP (7)" size="0" pos="0" show="7"/>
    <field name="frame.time" showname="Arrival Time: Sep 26, 2014 02:57:48.824785000 Pacific Daylight Time" size="0" pos="0" show="Sep 26, 2014 02:57:48.824785000 Pacific Daylight Time"/>
    <field name="frame.offset_shift" showname="Time shift for this packet: 0.000000000 seconds" size="0" pos="0" show="0.000000000"/>
    <field name="frame.time_epoch" showname="Epoch Time: 1411725468.824785000 seconds" size="0" pos="0" show="1411725468.824785000"/>
    <field name="frame.time_delta" showname="Time delta from previous captured frame: 0.000000000 seconds" size="0" pos="0" show="0.000000000"/>
    <field name="frame.time_delta_displayed" showname="Time delta from previous displayed frame: 0.000000000 seconds" size="0" pos="0" show="0.000000000"/>
    <field name="frame.time_relative" showname="Time since reference or first frame: 0.000000000 seconds" size="0" pos="0" show="0.000000000"/>
    <field name="frame.number" showname="Frame Number: 1" size="0" pos="0" show="1"/>
    <field name="frame.len" showname="Frame Length: 161 bytes (1288 bits)" size="0" pos="0" show="161"/>
    <field name="frame.cap_len" showname="Capture Length: 161 bytes (1288 bits)" size="0" pos="0" show="161"/>
    <field name="frame.marked" showname="Frame is marked: False" size="0" pos="0" show="0"/>
    <field name="frame.ignored" showname="Frame is ignored: False" size="0" pos="0" show="0"/>
    <field name="frame.protocols" showname="Protocols in frame: raw:ip:udp:http" size="0" pos="0" show="raw:ip:udp:http"/>
  </proto>
  <proto name="raw" showname="Raw packet data" size="0" pos="0">
    <field name="" show="No link information available" size="0" pos="0" value=""/>
  </proto>
  <proto name="ip" showname="Internet Protocol Version 4, Src: 127.0.0.1 (127.0.0.1), Dst: 239.255.255.250 (239.255.255.250)" size="20" pos="0">
    <field name="ip.version" showname="Version: 4" size="1" pos="0" show="4" value="45"/>
    <field name="ip.hdr_len" showname="Header Length: 20 bytes" size="1" pos="0" show="20" value="45"/>
    <field name="ip.dsfield" showname="Differentiated Services Field: 0x00 (DSCP 0x00: Default; ECN: 0x00: Not-ECT (Not ECN-Capable Transport))" size="1" pos="1" show="0" value="00">
      <field name="ip.dsfield.dscp" showname="0000 00.. = Differentiated Services Codepoint: Default (0x00)" size="1" pos="1" show="0" value="0" unmaskedvalue="00"/>
      <field name="ip.dsfield.ecn" showname=".... ..00 = Explicit Congestion Notification: Not-ECT (Not ECN-Capable Transport) (0x00)" size="1" pos="1" show="0" value="0" unmaskedvalue="00"/>
    </field>
    <field name="ip.len" showname="Total Length: 161" size="2" pos="2" show="161" value="00a1"/>
    <field name="ip.id" showname="Identification: 0x61a6 (24998)" size="2" pos="4" show="24998" value="61a6"/>
    <field name="ip.flags" showname="Flags: 0x00" size="1" pos="6" show="0" value="00">
      <field name="ip.flags.rb" showname="0... .... = Reserved bit: Not set" size="1" pos="6" show="0" value="00"/>
      <field name="ip.flags.df" showname=".0.. .... = Don&apos;t fragment: Not set" size="1" pos="6" show="0" value="00"/>
      <field name="ip.flags.mf" showname="..0. .... = More fragments: Not set" size="1" pos="6" show="0" value="00"/>
    </field>
    <field name="ip.frag_offset" showname="Fragment offset: 0" size="2" pos="6" show="0" value="0000"/>
    <field name="ip.ttl" showname="Time to live: 1" size="1" pos="8" show="1" value="01"/>
    <field name="ip.proto" showname="Protocol: UDP (17)" size="1" pos="9" show="17" value="11"/>
    <field name="ip.checksum" showname="Header checksum: 0x0000 [validation disabled]" size="2" pos="10" show="0" value="0000">
      <field name="ip.checksum_good" showname="Good: False" size="2" pos="10" show="0" value="0000"/>
      <field name="ip.checksum_bad" showname="Bad: False" size="2" pos="10" show="0" value="0000"/>
    </field>
    <field name="ip.src" showname="Source: 127.0.0.1 (127.0.0.1)" size="4" pos="12" show="127.0.0.1" value="7f000001"/>
    <field name="ip.addr" showname="Source or Destination Address: 127.0.0.1 (127.0.0.1)" hide="yes" size="4" pos="12" show="127.0.0.1" value="7f000001"/>
    <field name="ip.src_host" showname="Source Host: 127.0.0.1" hide="yes" size="4" pos="12" show="127.0.0.1" value="7f000001"/>
    <field name="ip.host" showname="Source or Destination Host: 127.0.0.1" hide="yes" size="4" pos="12" show="127.0.0.1" value="7f000001"/>
    <field name="ip.dst" showname="Destination: 239.255.255.250 (239.255.255.250)" size="4" pos="16" show="239.255.255.250" value="effffffa"/>
    <field name="ip.addr" showname="Source or Destination Address: 239.255.255.250 (239.255.255.250)" hide="yes" size="4" pos="16" show="239.255.255.250" value="effffffa"/>
    <field name="ip.dst_host" showname="Destination Host: 239.255.255.250" hide="yes" size="4" pos="16" show="239.255.255.250" value="effffffa"/>
    <field name="ip.host" showname="Source or Destination Host: 239.255.255.250" hide="yes" size="4" pos="16" show="239.255.255.250" value="effffffa"/>
    <field name="" show="Source GeoIP: Unknown" size="4" pos="12" value="7f000001"/>
    <field name="" show="Destination GeoIP: Unknown" size="4" pos="16" value="effffffa"/>
  </proto>
  <proto name="udp" showname="User Datagram Protocol, Src Port: 58098 (58098), Dst Port: 1900 (1900)" size="8" pos="20">
    <field name="udp.srcport" showname="Source Port: 58098 (58098)" size="2" pos="20" show="58098" value="e2f2"/>
    <field name="udp.dstport" showname="Destination Port: 1900 (1900)" size="2" pos="22" show="1900" value="076c"/>
    <field name="udp.port" showname="Source or Destination Port: 58098" hide="yes" size="2" pos="20" show="58098" value="e2f2"/>
    <field name="udp.port" showname="Source or Destination Port: 1900" hide="yes" size="2" pos="22" show="1900" value="076c"/>
    <field name="udp.length" showname="Length: 141" size="2" pos="24" show="141" value="008d"/>
    <field name="udp.checksum_coverage" showname="Checksum coverage: 141" hide="yes" size="0" pos="24" show="141"/>
    <field name="udp.checksum" showname="Checksum: 0x6f9a [validation disabled]" size="2" pos="26" show="28570" value="6f9a">
      <field name="udp.checksum_good" showname="Good Checksum: False" size="2" pos="26" show="0" value="6f9a"/>
      <field name="udp.checksum_bad" showname="Bad Checksum: False" size="2" pos="26" show="0" value="6f9a"/>
    </field>
    <field name="udp.stream" showname="Stream index: 0" size="0" pos="28" show="0"/>
  </proto>
  <proto name="http" showname="Hypertext Transfer Protocol" size="133" pos="28">
    <field name="" show="M-SEARCH * HTTP/1.1\r\n" size="21" pos="28" value="4d2d534541524348202a20485454502f312e310d0a">
      <field name="_ws.expert" showname="Expert Info (Chat/Sequence): M-SEARCH * HTTP/1.1\r\n" size="0" pos="28">
        <field name="http.chat" showname="M-SEARCH * HTTP/1.1\r\n" size="0" pos="0" show="" value=""/>
        <field name="_ws.expert.message" showname="Message: M-SEARCH * HTTP/1.1\r\n" hide="yes" size="0" pos="0" show="M-SEARCH * HTTP/1.1\r\n"/>
        <field name="_ws.expert.severity" showname="Severity level: Chat" size="0" pos="0" show="2097152"/>
        <field name="_ws.expert.group" showname="Group: Sequence" size="0" pos="0" show="33554432"/>
      </field>
      <field name="http.request.method" showname="Request Method: M-SEARCH" size="8" pos="28" show="M-SEARCH" value="4d2d534541524348"/>
      <field name="http.request.uri" showname="Request URI: *" size="1" pos="37" show="*" value="2a"/>
      <field name="http.request.version" showname="Request Version: HTTP/1.1" size="8" pos="39" show="HTTP/1.1" value="485454502f312e31"/>
    </field>
    <field name="http.host" showname="Host:239.255.255.250:1900\r\n" size="27" pos="49" show="239.255.255.250:1900" value="486f73743a3233392e3235352e3235352e3235303a313930300d0a"/>
    <field name="http.request.line" showname="Host:239.255.255.250:1900\r\n" hide="yes" size="27" pos="49" show="Host:239.255.255.250:1900\xd\xa" value="486f73743a3233392e3235352e3235352e3235303a313930300d0a"/>
    <field name="http.request.line" showname="ST:urn:schemas-upnp-org:device:InternetGatewayDevice:1\r\n" size="56" pos="76" show="ST:urn:schemas-upnp-org:device:InternetGatewayDevice:1\xd\xa" value="53543a75726e3a736368656d61732d75706e702d6f72673a6465766963653a496e7465726e6574476174657761794465766963653a310d0a"/>
    <field name="http.request.line" showname="Man:&quot;ssdp:discover&quot;\r\n" size="21" pos="132" show="Man:&quot;ssdp:discover&quot;\xd\xa" value="4d616e3a22737364703a646973636f766572220d0a"/>
    <field name="http.request.line" showname="MX:3\r\n" size="6" pos="153" show="MX:3\xd\xa" value="4d583a330d0a"/>
    <field name="" show="\r\n" size="2" pos="159" value="0d0a"/>
    <field name="http.request.full_uri" showname="Full request URI: http://239.255.255.250:1900*" size="0" pos="28" show="http://239.255.255.250:1900*"/>
    <field name="http.request" showname="Request: True" hide="yes" size="0" pos="28" show="1"/>
    <field name="" show="HTTP request 1/1" size="0" pos="28" value=""/>
  </proto>
</packet>


<packet>
  <proto name="geninfo" pos="0" showname="General information" size="161">
    <field name="num" pos="0" show="2" showname="Number" value="2" size="161"/>
    <field name="len" pos="0" show="161" showname="Frame Length" value="a1" size="161"/>
    <field name="caplen" pos="0" show="161" showname="Captured Length" value="a1" size="161"/>
    <field name="timestamp" pos="0" show="Sep 26, 2014 02:57:48.826785000 Pacific Daylight Time" showname="Captured Time" value="1411725468.826785000" size="161"/>
  </proto>
  <proto name="frame" showname="Frame 2: 161 bytes on wire (1288 bits), 161 bytes captured (1288 bits)" size="161" pos="0">
    <field name="frame.encap_type" showname="Encapsulation type: Raw IP (7)" size="0" pos="0" show="7"/>
    <field name="frame.time" showname="Arrival Time: Sep 26, 2014 02:57:48.826785000 Pacific Daylight Time" size="0" pos="0" show="Sep 26, 2014 02:57:48.826785000 Pacific Daylight Time"/>
    <field name="frame.offset_shift" showname="Time shift for this packet: 0.000000000 seconds" size="0" pos="0" show="0.000000000"/>
    <field name="frame.time_epoch" showname="Epoch Time: 1411725468.826785000 seconds" size="0" pos="0" show="1411725468.826785000"/>
    <field name="frame.time_delta" showname="Time delta from previous captured frame: 0.002000000 seconds" size="0" pos="0" show="0.002000000"/>
    <field name="frame.time_delta_displayed" showname="Time delta from previous displayed frame: 0.002000000 seconds" size="0" pos="0" show="0.002000000"/>
    <field name="frame.time_relative" showname="Time since reference or first frame: 0.002000000 seconds" size="0" pos="0" show="0.002000000"/>
    <field name="frame.number" showname="Frame Number: 2" size="0" pos="0" show="2"/>
    <field name="frame.len" showname="Frame Length: 161 bytes (1288 bits)" size="0" pos="0" show="161"/>
    <field name="frame.cap_len" showname="Capture Length: 161 bytes (1288 bits)" size="0" pos="0" show="161"/>
    <field name="frame.marked" showname="Frame is marked: False" size="0" pos="0" show="0"/>
    <field name="frame.ignored" showname="Frame is ignored: False" size="0" pos="0" show="0"/>
    <field name="frame.protocols" showname="Protocols in frame: raw:ip:udp:http" size="0" pos="0" show="raw:ip:udp:http"/>
  </proto>
  <proto name="raw" showname="Raw packet data" size="0" pos="0">
    <field name="" show="No link information available" size="0" pos="0" value=""/>
  </proto>
  <proto name="ip" showname="Internet Protocol Version 4, Src: 127.0.0.1 (127.0.0.1), Dst: 239.255.255.250 (239.255.255.250)" size="20" pos="0">
    <field name="ip.version" showname="Version: 4" size="1" pos="0" show="4" value="45"/>
    <field name="ip.hdr_len" showname="Header Length: 20 bytes" size="1" pos="0" show="20" value="45"/>
    <field name="ip.dsfield" showname="Differentiated Services Field: 0x00 (DSCP 0x00: Default; ECN: 0x00: Not-ECT (Not ECN-Capable Transport))" size="1" pos="1" show="0" value="00">
      <field name="ip.dsfield.dscp" showname="0000 00.. = Differentiated Services Codepoint: Default (0x00)" size="1" pos="1" show="0" value="0" unmaskedvalue="00"/>
      <field name="ip.dsfield.ecn" showname=".... ..00 = Explicit Congestion Notification: Not-ECT (Not ECN-Capable Transport) (0x00)" size="1" pos="1" show="0" value="0" unmaskedvalue="00"/>
    </field>
    <field name="ip.len" showname="Total Length: 161" size="2" pos="2" show="161" value="00a1"/>
    <field name="ip.id" showname="Identification: 0x61a6 (24998)" size="2" pos="4" show="24998" value="61a6"/>
    <field name="ip.flags" showname="Flags: 0x00" size="1" pos="6" show="0" value="00">
      <field name="ip.flags.rb" showname="0... .... = Reserved bit: Not set" size="1" pos="6" show="0" value="00"/>
      <field name="ip.flags.df" showname=".0.. .... = Don&apos;t fragment: Not set" size="1" pos="6" show="0" value="00"/>
      <field name="ip.flags.mf" showname="..0. .... = More fragments: Not set" size="1" pos="6" show="0" value="00"/>
    </field>
    <field name="ip.frag_offset" showname="Fragment offset: 0" size="2" pos="6" show="0" value="0000"/>
    <field name="ip.ttl" showname="Time to live: 1" size="1" pos="8" show="1" value="01"/>
    <field name="ip.proto" showname="Protocol: UDP (17)" size="1" pos="9" show="17" value="11"/>
    <field name="ip.checksum" showname="Header checksum: 0xe8aa [validation disabled]" size="2" pos="10" show="59562" value="e8aa">
      <field name="ip.checksum_good" showname="Good: False" size="2" pos="10" show="0" value="e8aa"/>
      <field name="ip.checksum_bad" showname="Bad: False" size="2" pos="10" show="0" value="e8aa"/>
    </field>
    <field name="ip.src" showname="Source: 127.0.0.1 (127.0.0.1)" size="4" pos="12" show="127.0.0.1" value="7f000001"/>
    <field name="ip.addr" showname="Source or Destination Address: 127.0.0.1 (127.0.0.1)" hide="yes" size="4" pos="12" show="127.0.0.1" value="7f000001"/>
    <field name="ip.src_host" showname="Source Host: 127.0.0.1" hide="yes" size="4" pos="12" show="127.0.0.1" value="7f000001"/>
    <field name="ip.host" showname="Source or Destination Host: 127.0.0.1" hide="yes" size="4" pos="12" show="127.0.0.1" value="7f000001"/>
    <field name="ip.dst" showname="Destination: 239.255.255.250 (239.255.255.250)" size="4" pos="16" show="239.255.255.250" value="effffffa"/>
    <field name="ip.addr" showname="Source or Destination Address: 239.255.255.250 (239.255.255.250)" hide="yes" size="4" pos="16" show="239.255.255.250" value="effffffa"/>
    <field name="ip.dst_host" showname="Destination Host: 239.255.255.250" hide="yes" size="4" pos="16" show="239.255.255.250" value="effffffa"/>
    <field name="ip.host" showname="Source or Destination Host: 239.255.255.250" hide="yes" size="4" pos="16" show="239.255.255.250" value="effffffa"/>
    <field name="" show="Source GeoIP: Unknown" size="4" pos="12" value="7f000001"/>
    <field name="" show="Destination GeoIP: Unknown" size="4" pos="16" value="effffffa"/>
  </proto>
  <proto name="udp" showname="User Datagram Protocol, Src Port: 58098 (58098), Dst Port: 1900 (1900)" size="8" pos="20">
    <field name="udp.srcport" showname="Source Port: 58098 (58098)" size="2" pos="20" show="58098" value="e2f2"/>
    <field name="udp.dstport" showname="Destination Port: 1900 (1900)" size="2" pos="22" show="1900" value="076c"/>
    <field name="udp.port" showname="Source or Destination Port: 58098" hide="yes" size="2" pos="20" show="58098" value="e2f2"/>
    <field name="udp.port" showname="Source or Destination Port: 1900" hide="yes" size="2" pos="22" show="1900" value="076c"/>
    <field name="udp.length" showname="Length: 141" size="2" pos="24" show="141" value="008d"/>
    <field name="udp.checksum_coverage" showname="Checksum coverage: 141" hide="yes" size="0" pos="24" show="141"/>
    <field name="udp.checksum" showname="Checksum: 0x6f9a [validation disabled]" size="2" pos="26" show="28570" value="6f9a">
      <field name="udp.checksum_good" showname="Good Checksum: False" size="2" pos="26" show="0" value="6f9a"/>
      <field name="udp.checksum_bad" showname="Bad Checksum: False" size="2" pos="26" show="0" value="6f9a"/>
    </field>
    <field name="udp.stream" showname="Stream index: 0" size="0" pos="28" show="0"/>
  </proto>
  <proto name="http" showname="Hypertext Transfer Protocol" size="133" pos="28">
    <field name="" show="M-SEARCH * HTTP/1.1\r\n" size="21" pos="28" value="4d2d534541524348202a20485454502f312e310d0a">
      <field name="_ws.expert" showname="Expert Info (Chat/Sequence): M-SEARCH * HTTP/1.1\r\n" size="0" pos="28">
        <field name="http.chat" showname="M-SEARCH * HTTP/1.1\r\n" size="0" pos="0" show="" value=""/>
        <field name="_ws.expert.message" showname="Message: M-SEARCH * HTTP/1.1\r\n" hide="yes" size="0" pos="0" show="M-SEARCH * HTTP/1.1\r\n"/>
        <field name="_ws.expert.severity" showname="Severity level: Chat" size="0" pos="0" show="2097152"/>
        <field name="_ws.expert.group" showname="Group: Sequence" size="0" pos="0" show="33554432"/>
      </field>
      <field name="http.request.method" showname="Request Method: M-SEARCH" size="8" pos="28" show="M-SEARCH" value="4d2d534541524348"/>
      <field name="http.request.uri" showname="Request URI: *" size="1" pos="37" show="*" value="2a"/>
      <field name="http.request.version" showname="Request Version: HTTP/1.1" size="8" pos="39" show="HTTP/1.1" value="485454502f312e31"/>
    </field>
    <field name="http.host" showname="Host:239.255.255.250:1900\r\n" size="27" pos="49" show="239.255.255.250:1900" value="486f73743a3233392e3235352e3235352e3235303a313930300d0a"/>
    <field name="http.request.line" showname="Host:239.255.255.250:1900\r\n" hide="yes" size="27" pos="49" show="Host:239.255.255.250:1900\xd\xa" value="486f73743a3233392e3235352e3235352e3235303a313930300d0a"/>
    <field name="http.request.line" showname="ST:urn:schemas-upnp-org:device:InternetGatewayDevice:1\r\n" size="56" pos="76" show="ST:urn:schemas-upnp-org:device:InternetGatewayDevice:1\xd\xa" value="53543a75726e3a736368656d61732d75706e702d6f72673a6465766963653a496e7465726e6574476174657761794465766963653a310d0a"/>
    <field name="http.request.line" showname="Man:&quot;ssdp:discover&quot;\r\n" size="21" pos="132" show="Man:&quot;ssdp:discover&quot;\xd\xa" value="4d616e3a22737364703a646973636f766572220d0a"/>
    <field name="http.request.line" showname="MX:3\r\n" size="6" pos="153" show="MX:3\xd\xa" value="4d583a330d0a"/>
    <field name="" show="\r\n" size="2" pos="159" value="0d0a"/>
    <field name="http.request.full_uri" showname="Full request URI: http://239.255.255.250:1900*" size="0" pos="28" show="http://239.255.255.250:1900*"/>
    <field name="http.request" showname="Request: True" hide="yes" size="0" pos="28" show="1"/>
    <field name="" show="HTTP request 2/2" size="0" pos="28" value=""/>
    <field name="http.prev_request_in" showname="Prev request in frame: 1" size="0" pos="28" show="1"/>
  </proto>
</packet>


<packet>
  <proto name="geninfo" pos="0" showname="General information" size="52">
    <field name="num" pos="0" show="3" showname="Number" value="3" size="52"/>
    <field name="len" pos="0" show="52" showname="Frame Length" value="34" size="52"/>
    <field name="caplen" pos="0" show="52" showname="Captured Length" value="34" size="52"/>
    <field name="timestamp" pos="0" show="Sep 26, 2014 02:57:53.147032000 Pacific Daylight Time" showname="Captured Time" value="1411725473.147032000" size="52"/>
  </proto>
  <proto name="frame" showname="Frame 3: 52 bytes on wire (416 bits), 52 bytes captured (416 bits)" size="52" pos="0">
    <field name="frame.encap_type" showname="Encapsulation type: Raw IP (7)" size="0" pos="0" show="7"/>
    <field name="frame.time" showname="Arrival Time: Sep 26, 2014 02:57:53.147032000 Pacific Daylight Time" size="0" pos="0" show="Sep 26, 2014 02:57:53.147032000 Pacific Daylight Time"/>
    <field name="frame.offset_shift" showname="Time shift for this packet: 0.000000000 seconds" size="0" pos="0" show="0.000000000"/>
    <field name="frame.time_epoch" showname="Epoch Time: 1411725473.147032000 seconds" size="0" pos="0" show="1411725473.147032000"/>
    <field name="frame.time_delta" showname="Time delta from previous captured frame: 4.320247000 seconds" size="0" pos="0" show="4.320247000"/>
    <field name="frame.time_delta_displayed" showname="Time delta from previous displayed frame: 4.320247000 seconds" size="0" pos="0" show="4.320247000"/>
    <field name="frame.time_relative" showname="Time since reference or first frame: 4.322247000 seconds" size="0" pos="0" show="4.322247000"/>
    <field name="frame.number" showname="Frame Number: 3" size="0" pos="0" show="3"/>
    <field name="frame.len" showname="Frame Length: 52 bytes (416 bits)" size="0" pos="0" show="52"/>
    <field name="frame.cap_len" showname="Capture Length: 52 bytes (416 bits)" size="0" pos="0" show="52"/>
    <field name="frame.marked" showname="Frame is marked: False" size="0" pos="0" show="0"/>
    <field name="frame.ignored" showname="Frame is ignored: False" size="0" pos="0" show="0"/>
    <field name="frame.protocols" showname="Protocols in frame: raw:ip:tcp" size="0" pos="0" show="raw:ip:tcp"/>
  </proto>
  <proto name="raw" showname="Raw packet data" size="0" pos="0">
    <field name="" show="No link information available" size="0" pos="0" value=""/>
  </proto>
  <proto name="ip" showname="Internet Protocol Version 4, Src: 127.0.0.1 (127.0.0.1), Dst: 127.0.0.1 (127.0.0.1)" size="20" pos="0">
    <field name="ip.version" showname="Version: 4" size="1" pos="0" show="4" value="45"/>
    <field name="ip.hdr_len" showname="Header Length: 20 bytes" size="1" pos="0" show="20" value="45"/>
    <field name="ip.dsfield" showname="Differentiated Services Field: 0x00 (DSCP 0x00: Default; ECN: 0x00: Not-ECT (Not ECN-Capable Transport))" size="1" pos="1" show="0" value="00">
      <field name="ip.dsfield.dscp" showname="0000 00.. = Differentiated Services Codepoint: Default (0x00)" size="1" pos="1" show="0" value="0" unmaskedvalue="00"/>
      <field name="ip.dsfield.ecn" showname=".... ..00 = Explicit Congestion Notification: Not-ECT (Not ECN-Capable Transport) (0x00)" size="1" pos="1" show="0" value="0" unmaskedvalue="00"/>
    </field>
    <field name="ip.len" showname="Total Length: 52" size="2" pos="2" show="52" value="0034"/>
    <field name="ip.id" showname="Identification: 0x61a7 (24999)" size="2" pos="4" show="24999" value="61a7"/>
    <field name="ip.flags" showname="Flags: 0x02 (Don&apos;t Fragment)" size="1" pos="6" show="2" value="40">
      <field name="ip.flags.rb" showname="0... .... = Reserved bit: Not set" size="1" pos="6" show="0" value="40"/>
      <field name="ip.flags.df" showname=".1.. .... = Don&apos;t fragment: Set" size="1" pos="6" show="1" value="40"/>
      <field name="ip.flags.mf" showname="..0. .... = More fragments: Not set" size="1" pos="6" show="0" value="40"/>
    </field>
    <field name="ip.frag_offset" showname="Fragment offset: 0" size="2" pos="6" show="0" value="4000"/>
    <field name="ip.ttl" showname="Time to live: 128" size="1" pos="8" show="128" value="80"/>
    <field name="ip.proto" showname="Protocol: TCP (6)" size="1" pos="9" show="6" value="06"/>
    <field name="ip.checksum" showname="Header checksum: 0x0000 [validation disabled]" size="2" pos="10" show="0" value="0000">
      <field name="ip.checksum_good" showname="Good: False" size="2" pos="10" show="0" value="0000"/>
      <field name="ip.checksum_bad" showname="Bad: False" size="2" pos="10" show="0" value="0000"/>
    </field>
    <field name="ip.src" showname="Source: 127.0.0.1 (127.0.0.1)" size="4" pos="12" show="127.0.0.1" value="7f000001"/>
    <field name="ip.addr" showname="Source or Destination Address: 127.0.0.1 (127.0.0.1)" hide="yes" size="4" pos="12" show="127.0.0.1" value="7f000001"/>
    <field name="ip.src_host" showname="Source Host: 127.0.0.1" hide="yes" size="4" pos="12" show="127.0.0.1" value="7f000001"/>
    <field name="ip.host" showname="Source or Destination Host: 127.0.0.1" hide="yes" size="4" pos="12" show="127.0.0.1" value="7f000001"/>
    <field name="ip.dst" showname="Destination: 127.0.0.1 (127.0.0.1)" size="4" pos="16" show="127.0.0.1" value="7f000001"/>
    <field name="ip.addr" showname="Source or Destination Address: 127.0.0.1 (127.0.0.1)" hide="yes" size="4" pos="16" show="127.0.0.1" value="7f000001"/>
    <field name="ip.dst_host" showname="Destination Host: 127.0.0.1" hide="yes" size="4" pos="16" show="127.0.0.1" value="7f000001"/>
    <field name="ip.host" showname="Source or Destination Host: 127.0.0.1" hide="yes" size="4" pos="16" show="127.0.0.1" value="7f000001"/>
    <field name="" show="Source GeoIP: Unknown" size="4" pos="12" value="7f000001"/>
    <field name="" show="Destination GeoIP: Unknown" size="4" pos="16" value="7f000001"/>
  </proto>
  <proto name="tcp" showname="Transmission Control Protocol, Src Port: 50239 (50239), Dst Port: 8001 (8001), Seq: 0, Len: 0" size="32" pos="20">
    <field name="tcp.srcport" showname="Source Port: 50239 (50239)" size="2" pos="20" show="50239" value="c43f"/>
    <field name="tcp.dstport" showname="Destination Port: 8001 (8001)" size="2" pos="22" show="8001" value="1f41"/>
    <field name="tcp.port" showname="Source or Destination Port: 50239" hide="yes" size="2" pos="20" show="50239" value="c43f"/>
    <field name="tcp.port" showname="Source or Destination Port: 8001" hide="yes" size="2" pos="22" show="8001" value="1f41"/>
    <field name="tcp.stream" showname="Stream index: 0" size="0" pos="20" show="0"/>
    <field name="tcp.len" showname="TCP Segment Len: 0" size="1" pos="32" show="0" value="80"/>
    <field name="tcp.seq" showname="Sequence number: 0    (relative sequence number)" size="4" pos="24" show="0" value="b172634b"/>
    <field name="tcp.ack" showname="Acknowledgment number: 0" size="4" pos="28" show="0" value="00000000"/>
    <field name="tcp.hdr_len" showname="Header Length: 32 bytes" size="1" pos="32" show="32" value="80"/>
    <field name="tcp.flags" showname=".... 0000 0000 0010 = Flags: 0x002 (SYN)" size="2" pos="32" show="2" value="2" unmaskedvalue="8002">
      <field name="tcp.flags.res" showname="000. .... .... = Reserved: Not set" size="1" pos="32" show="0" value="0" unmaskedvalue="80"/>
      <field name="tcp.flags.ns" showname="...0 .... .... = Nonce: Not set" size="1" pos="32" show="0" value="0" unmaskedvalue="80"/>
      <field name="tcp.flags.cwr" showname=".... 0... .... = Congestion Window Reduced (CWR): Not set" size="1" pos="33" show="0" value="0" unmaskedvalue="02"/>
      <field name="tcp.flags.ecn" showname=".... .0.. .... = ECN-Echo: Not set" size="1" pos="33" show="0" value="0" unmaskedvalue="02"/>
      <field name="tcp.flags.urg" showname=".... ..0. .... = Urgent: Not set" size="1" pos="33" show="0" value="0" unmaskedvalue="02"/>
      <field name="tcp.flags.ack" showname=".... ...0 .... = Acknowledgment: Not set" size="1" pos="33" show="0" value="0" unmaskedvalue="02"/>
      <field name="tcp.flags.push" showname=".... .... 0... = Push: Not set" size="1" pos="33" show="0" value="0" unmaskedvalue="02"/>
      <field name="tcp.flags.reset" showname=".... .... .0.. = Reset: Not set" size="1" pos="33" show="0" value="0" unmaskedvalue="02"/>
      <field name="tcp.flags.syn" showname=".... .... ..1. = Syn: Set" size="1" pos="33" show="1" value="1" unmaskedvalue="02">
        <field name="_ws.expert" showname="Expert Info (Chat/Sequence): Connection establish request (SYN): server port 8001" size="0" pos="33">
          <field name="tcp.connection.syn" showname="Connection establish request (SYN): server port 8001" size="0" pos="0" show="" value=""/>
          <field name="_ws.expert.message" showname="Message: Connection establish request (SYN): server port 8001" hide="yes" size="0" pos="0" show="Connection establish request (SYN): server port 8001"/>
          <field name="_ws.expert.severity" showname="Severity level: Chat" size="0" pos="0" show="2097152"/>
          <field name="_ws.expert.group" showname="Group: Sequence" size="0" pos="0" show="33554432"/>
        </field>
      </field>
      <field name="tcp.flags.fin" showname=".... .... ...0 = Fin: Not set" size="1" pos="33" show="0" value="0" unmaskedvalue="02"/>
    </field>
    <field name="tcp.window_size_value" showname="Window size value: 8192" size="2" pos="34" show="8192" value="2000"/>
    <field name="tcp.window_size" showname="Calculated window size: 8192" size="2" pos="34" show="8192" value="2000"/>
    <field name="tcp.checksum" showname="Checksum: 0x5eab [validation disabled]" size="2" pos="36" show="24235" value="5eab">
      <field name="tcp.checksum_good" showname="Good Checksum: False" size="2" pos="36" show="0" value="5eab"/>
      <field name="tcp.checksum_bad" showname="Bad Checksum: False" size="2" pos="36" show="0" value="5eab"/>
    </field>
    <field name="tcp.urgent_pointer" showname="Urgent pointer: 0" size="2" pos="38" show="0" value="0000"/>
    <field name="tcp.options" showname="Options: (12 bytes), Maximum segment size, No-Operation (NOP), Window scale, No-Operation (NOP), No-Operation (NOP), SACK permitted" size="12" pos="40" show="02:04:ff:d7:01:03:03:08:01:01:04:02" value="0204ffd70103030801010402">
      <field name="tcp.options.mss" showname="Maximum segment size: 65495 bytes" size="4" pos="40" show="" value="">
        <field name="tcp.option_kind" showname="Kind: Maximum Segment Size (2)" size="1" pos="40" show="2" value="02"/>
        <field name="tcp.option_len" showname="Length: 4" size="1" pos="41" show="4" value="04"/>
        <field name="tcp.options.mss_val" showname="MSS Value: 65495" size="2" pos="42" show="65495" value="ffd7"/>
      </field>
      <field name="" show="No-Operation (NOP)" size="1" pos="44" value="01">
        <field name="tcp.options.type" showname="Type: 1" size="1" pos="44" show="1" value="01">
          <field name="tcp.options.type.copy" showname="0... .... = Copy on fragmentation: No" size="1" pos="44" show="0" value="0" unmaskedvalue="01"/>
          <field name="tcp.options.type.class" showname=".00. .... = Class: Control (0)" size="1" pos="44" show="0" value="0" unmaskedvalue="01"/>
          <field name="tcp.options.type.number" showname="...0 0001 = Number: No-Operation (NOP) (1)" size="1" pos="44" show="1" value="1" unmaskedvalue="01"/>
        </field>
      </field>
      <field name="" show="Window scale: 8 (multiply by 256)" size="3" pos="45" value="030308">
        <field name="tcp.option_kind" showname="Kind: Window Scale (3)" size="1" pos="45" show="3" value="03"/>
        <field name="tcp.option_len" showname="Length: 3" size="1" pos="46" show="3" value="03"/>
        <field name="tcp.options.wscale.shift" showname="Shift count: 8" size="1" pos="47" show="8" value="08"/>
        <field name="tcp.options.wscale.multiplier" showname="Multiplier: 256" size="1" pos="47" show="256" value="08"/>
      </field>
      <field name="" show="No-Operation (NOP)" size="1" pos="48" value="01">
        <field name="tcp.options.type" showname="Type: 1" size="1" pos="48" show="1" value="01">
          <field name="tcp.options.type.copy" showname="0... .... = Copy on fragmentation: No" size="1" pos="48" show="0" value="0" unmaskedvalue="01"/>
          <field name="tcp.options.type.class" showname=".00. .... = Class: Control (0)" size="1" pos="48" show="0" value="0" unmaskedvalue="01"/>
          <field name="tcp.options.type.number" showname="...0 0001 = Number: No-Operation (NOP) (1)" size="1" pos="48" show="1" value="1" unmaskedvalue="01"/>
        </field>
      </field>
      <field name="" show="No-Operation (NOP)" size="1" pos="49" value="01">
        <field name="tcp.options.type" showname="Type: 1" size="1" pos="49" show="1" value="01">
          <field name="tcp.options.type.copy" showname="0... .... = Copy on fragmentation: No" size="1" pos="49" show="0" value="0" unmaskedvalue="01"/>
          <field name="tcp.options.type.class" showname=".00. .... = Class: Control (0)" size="1" pos="49" show="0" value="0" unmaskedvalue="01"/>
          <field name="tcp.options.type.number" showname="...0 0001 = Number: No-Operation (NOP) (1)" size="1" pos="49" show="1" value="1" unmaskedvalue="01"/>
        </field>
      </field>
      <field name="tcp.options.sack_perm" showname="TCP SACK Permitted Option: True" size="2" pos="50" show="1" value="0402">
        <field name="tcp.option_kind" showname="Kind: SACK Permitted (4)" size="1" pos="50" show="4" value="04"/>
        <field name="tcp.option_len" showname="Length: 2" size="1" pos="51" show="2" value="02"/>
      </field>
    </field>
  </proto>
</packet>


<packet>
  <proto name="geninfo" pos="0" showname="General information" size="52">
    <field name="num" pos="0" show="4" showname="Number" value="4" size="52"/>
    <field name="len" pos="0" show="52" showname="Frame Length" value="34" size="52"/>
    <field name="caplen" pos="0" show="52" showname="Captured Length" value="34" size="52"/>
    <field name="timestamp" pos="0" show="Sep 26, 2014 02:57:53.147032000 Pacific Daylight Time" showname="Captured Time" value="1411725473.147032000" size="52"/>
  </proto>
  <proto name="frame" showname="Frame 4: 52 bytes on wire (416 bits), 52 bytes captured (416 bits)" size="52" pos="0">
    <field name="frame.encap_type" showname="Encapsulation type: Raw IP (7)" size="0" pos="0" show="7"/>
    <field name="frame.time" showname="Arrival Time: Sep 26, 2014 02:57:53.147032000 Pacific Daylight Time" size="0" pos="0" show="Sep 26, 2014 02:57:53.147032000 Pacific Daylight Time"/>
    <field name="frame.offset_shift" showname="Time shift for this packet: 0.000000000 seconds" size="0" pos="0" show="0.000000000"/>
    <field name="frame.time_epoch" showname="Epoch Time: 1411725473.147032000 seconds" size="0" pos="0" show="1411725473.147032000"/>
    <field name="frame.time_delta" showname="Time delta from previous captured frame: 0.000000000 seconds" size="0" pos="0" show="0.000000000"/>
    <field name="frame.time_delta_displayed" showname="Time delta from previous displayed frame: 0.000000000 seconds" size="0" pos="0" show="0.000000000"/>
    <field name="frame.time_relative" showname="Time since reference or first frame: 4.322247000 seconds" size="0" pos="0" show="4.322247000"/>
    <field name="frame.number" showname="Frame Number: 4" size="0" pos="0" show="4"/>
    <field name="frame.len" showname="Frame Length: 52 bytes (416 bits)" size="0" pos="0" show="52"/>
    <field name="frame.cap_len" showname="Capture Length: 52 bytes (416 bits)" size="0" pos="0" show="52"/>
    <field name="frame.marked" showname="Frame is marked: False" size="0" pos="0" show="0"/>
    <field name="frame.ignored" showname="Frame is ignored: False" size="0" pos="0" show="0"/>
    <field name="frame.protocols" showname="Protocols in frame: raw:ip:tcp" size="0" pos="0" show="raw:ip:tcp"/>
  </proto>
  <proto name="raw" showname="Raw packet data" size="0" pos="0">
    <field name="" show="No link information available" size="0" pos="0" value=""/>
  </proto>
  <proto name="ip" showname="Internet Protocol Version 4, Src: 127.0.0.1 (127.0.0.1), Dst: 127.0.0.1 (127.0.0.1)" size="20" pos="0">
    <field name="ip.version" showname="Version: 4" size="1" pos="0" show="4" value="45"/>
    <field name="ip.hdr_len" showname="Header Length: 20 bytes" size="1" pos="0" show="20" value="45"/>
    <field name="ip.dsfield" showname="Differentiated Services Field: 0x00 (DSCP 0x00: Default; ECN: 0x00: Not-ECT (Not ECN-Capable Transport))" size="1" pos="1" show="0" value="00">
      <field name="ip.dsfield.dscp" showname="0000 00.. = Differentiated Services Codepoint: Default (0x00)" size="1" pos="1" show="0" value="0" unmaskedvalue="00"/>
      <field name="ip.dsfield.ecn" showname=".... ..00 = Explicit Congestion Notification: Not-ECT (Not ECN-Capable Transport) (0x00)" size="1" pos="1" show="0" value="0" unmaskedvalue="00"/>
    </field>
    <field name="ip.len" showname="Total Length: 52" size="2" pos="2" show="52" value="0034"/>
    <field name="ip.id" showname="Identification: 0x61a8 (25000)" size="2" pos="4" show="25000" value="61a8"/>
    <field name="ip.flags" showname="Flags: 0x02 (Don&apos;t Fragment)" size="1" pos="6" show="2" value="40">
      <field name="ip.flags.rb" showname="0... .... = Reserved bit: Not set" size="1" pos="6" show="0" value="40"/>
      <field name="ip.flags.df" showname=".1.. .... = Don&apos;t fragment: Set" size="1" pos="6" show="1" value="40"/>
      <field name="ip.flags.mf" showname="..0. .... = More fragments: Not set" size="1" pos="6" show="0" value="40"/>
    </field>
    <field name="ip.frag_offset" showname="Fragment offset: 0" size="2" pos="6" show="0" value="4000"/>
    <field name="ip.ttl" showname="Time to live: 128" size="1" pos="8" show="128" value="80"/>
    <field name="ip.proto" showname="Protocol: TCP (6)" size="1" pos="9" show="6" value="06"/>
    <field name="ip.checksum" showname="Header checksum: 0x0000 [validation disabled]" size="2" pos="10" show="0" value="0000">
      <field name="ip.checksum_good" showname="Good: False" size="2" pos="10" show="0" value="0000"/>
      <field name="ip.checksum_bad" showname="Bad: False" size="2" pos="10" show="0" value="0000"/>
    </field>
    <field name="ip.src" showname="Source: 127.0.0.1 (127.0.0.1)" size="4" pos="12" show="127.0.0.1" value="7f000001"/>
    <field name="ip.addr" showname="Source or Destination Address: 127.0.0.1 (127.0.0.1)" hide="yes" size="4" pos="12" show="127.0.0.1" value="7f000001"/>
    <field name="ip.src_host" showname="Source Host: 127.0.0.1" hide="yes" size="4" pos="12" show="127.0.0.1" value="7f000001"/>
    <field name="ip.host" showname="Source or Destination Host: 127.0.0.1" hide="yes" size="4" pos="12" show="127.0.0.1" value="7f000001"/>
    <field name="ip.dst" showname="Destination: 127.0.0.1 (127.0.0.1)" size="4" pos="16" show="127.0.0.1" value="7f000001"/>
    <field name="ip.addr" showname="Source or Destination Address: 127.0.0.1 (127.0.0.1)" hide="yes" size="4" pos="16" show="127.0.0.1" value="7f000001"/>
    <field name="ip.dst_host" showname="Destination Host: 127.0.0.1" hide="yes" size="4" pos="16" show="127.0.0.1" value="7f000001"/>
    <field name="ip.host" showname="Source or Destination Host: 127.0.0.1" hide="yes" size="4" pos="16" show="127.0.0.1" value="7f000001"/>
