<?xml version="1.0"?>
<?xml-stylesheet type="text/xsl" href="pdml2html.xsl"?>
<!-- You can find pdml2html.xsl in C:\Program Files\Wireshark or at http://anonsvn.wireshark.org/trunk/wireshark/pdml2html.xsl. -->
<pdml version="0" creator="wireshark/1.12.2" time="Tue Dec 16 14:27:40 2014" capture_file="ie11_wse_BasicAuth8001.pcap">
<packet>
  <proto name="geninfo" pos="0" showname="General information" size="52">
    <field name="num" pos="0" show="1" showname="Number" value="1" size="52"/>
    <field name="len" pos="0" show="52" showname="Frame Length" value="34" size="52"/>
    <field name="caplen" pos="0" show="52" showname="Captured Length" value="34" size="52"/>
    <field name="timestamp" pos="0" show="Dec 16, 2014 06:22:55.755341000 Pacific Standard Time" showname="Captured Time" value="1418739775.755341000" size="52"/>
  </proto>
  <proto name="frame" showname="Frame 1: 52 bytes on wire (416 bits), 52 bytes captured (416 bits)" size="52" pos="0">
    <field name="frame.encap_type" showname="Encapsulation type: Raw IP (7)" size="0" pos="0" show="7"/>
    <field name="frame.time" showname="Arrival Time: Dec 16, 2014 06:22:55.755341000 Pacific Standard Time" size="0" pos="0" show="Dec 16, 2014 06:22:55.755341000 Pacific Standard Time"/>
    <field name="frame.offset_shift" showname="Time shift for this packet: 0.000000000 seconds" size="0" pos="0" show="0.000000000"/>
    <field name="frame.time_epoch" showname="Epoch Time: 1418739775.755341000 seconds" size="0" pos="0" show="1418739775.755341000"/>
    <field name="frame.time_delta" showname="Time delta from previous captured frame: 0.000000000 seconds" size="0" pos="0" show="0.000000000"/>
    <field name="frame.time_delta_displayed" showname="Time delta from previous displayed frame: 0.000000000 seconds" size="0" pos="0" show="0.000000000"/>
    <field name="frame.time_relative" showname="Time since reference or first frame: 0.000000000 seconds" size="0" pos="0" show="0.000000000"/>
    <field name="frame.number" showname="Frame Number: 1" size="0" pos="0" show="1"/>
    <field name="frame.len" showname="Frame Length: 52 bytes (416 bits)" size="0" pos="0" show="52"/>
    <field name="frame.cap_len" showname="Capture Length: 52 bytes (416 bits)" size="0" pos="0" show="52"/>
    <field name="frame.marked" showname="Frame is marked: False" size="0" pos="0" show="0"/>
    <field name="frame.ignored" showname="Frame is ignored: False" size="0" pos="0" show="0"/>
    <field name="frame.protocols" showname="Protocols in frame: raw:ip:tcp" size="0" pos="0" show="raw:ip:tcp"/>
  </proto>
  <proto name="raw" showname="Raw packet data" size="0" pos="0">
    <field name="" show="No link information available" size="0" pos="0"/>
  </proto>
  <proto name="ip" showname="Internet Protocol Version 4, Src: 127.0.0.1 (127.0.0.1), Dst: 127.0.0.1 (127.0.0.1)" size="20" pos="0">
    <field name="ip.version" showname="Version: 4" size="1" pos="0" show="4" value="45"/>
    <field name="ip.hdr_len" showname="Header Length: 20 bytes" size="1" pos="0" show="20" value="45"/>
    <field name="ip.dsfield" showname="Differentiated Services Field: 0x00 (DSCP 0x00: Default; ECN: 0x00: Not-ECT (Not ECN-Capable Transport))" size="1" pos="1" show="0" value="00">
      <field name="ip.dsfield.dscp" showname="0000 00.. = Differentiated Services Codepoint: Default (0x00)" size="1" pos="1" show="0" value="0" unmaskedvalue="00"/>
      <field name="ip.dsfield.ecn" showname=".... ..00 = Explicit Congestion Notification: Not-ECT (Not ECN-Capable Transport) (0x00)" size="1" pos="1" show="0" value="0" unmaskedvalue="00"/>
    </field>
    <field name="ip.len" showname="Total Length: 52" size="2" pos="2" show="52" value="0034"/>
    <field name="ip.id" showname="Identification: 0x1362 (4962)" size="2" pos="4" show="4962" value="1362"/>
    <field name="ip.flags" showname="Flags: 0x02 (Don&apos;t Fragment)" size="1" pos="6" show="2" value="40">
      <field name="ip.flags.rb" showname="0... .... = Reserved bit: Not set" size="1" pos="6" show="0" value="40"/>
      <field name="ip.flags.df" showname=".1.. .... = Don&apos;t fragment: Set" size="1" pos="6" show="1" value="40"/>
      <field name="ip.flags.mf" showname="..0. .... = More fragments: Not set" size="1" pos="6" show="0" value="40"/>
    </field>
    <field name="ip.frag_offset" showname="Fragment offset: 0" size="2" pos="6" show="0" value="4000"/>
    <field name="ip.ttl" showname="Time to live: 128" size="1" pos="8" show="128" value="80"/>
    <field name="ip.proto" showname="Protocol: TCP (6)" size="1" pos="9" show="6" value="06"/>
    <field name="ip.checksum" showname="Header checksum: 0x0000 [validation disabled]" size="2" pos="10" show="0" value="0000">
      <field name="ip.checksum_good" showname="Good: False" size="2" pos="10" show="0" value="0000"/>
      <field name="ip.checksum_bad" showname="Bad: False" size="2" pos="10" show="0" value="0000"/>
    </field>
    <field name="ip.src" showname="Source: 127.0.0.1 (127.0.0.1)" size="4" pos="12" show="127.0.0.1" value="7f000001"/>
    <field name="ip.addr" showname="Source or Destination Address: 127.0.0.1 (127.0.0.1)" hide="yes" size="4" pos="12" show="127.0.0.1" value="7f000001"/>
    <field name="ip.src_host" showname="Source Host: 127.0.0.1" hide="yes" size="4" pos="12" show="127.0.0.1" value="7f000001"/>
    <field name="ip.host" showname="Source or Destination Host: 127.0.0.1" hide="yes" size="4" pos="12" show="127.0.0.1" value="7f000001"/>
    <field name="ip.dst" showname="Destination: 127.0.0.1 (127.0.0.1)" size="4" pos="16" show="127.0.0.1" value="7f000001"/>
    <field name="ip.addr" showname="Source or Destination Address: 127.0.0.1 (127.0.0.1)" hide="yes" size="4" pos="16" show="127.0.0.1" value="7f000001"/>
    <field name="ip.dst_host" showname="Destination Host: 127.0.0.1" hide="yes" size="4" pos="16" show="127.0.0.1" value="7f000001"/>
    <field name="ip.host" showname="Source or Destination Host: 127.0.0.1" hide="yes" size="4" pos="16" show="127.0.0.1" value="7f000001"/>
    <field name="" show="Source GeoIP: Unknown" size="4" pos="12" value="7f000001"/>
    <field name="" show="Destination GeoIP: Unknown" size="4" pos="16" value="7f000001"/>
  </proto>
  <proto name="tcp" showname="Transmission Control Protocol, Src Port: 55402 (55402), Dst Port: 8001 (8001), Seq: 0, Len: 0" size="32" pos="20">
    <field name="tcp.srcport" showname="Source Port: 55402 (55402)" size="2" pos="20" show="55402" value="d86a"/>
    <field name="tcp.dstport" showname="Destination Port: 8001 (8001)" size="2" pos="22" show="8001" value="1f41"/>
    <field name="tcp.port" showname="Source or Destination Port: 55402" hide="yes" size="2" pos="20" show="55402" value="d86a"/>
    <field name="tcp.port" showname="Source or Destination Port: 8001" hide="yes" size="2" pos="22" show="8001" value="1f41"/>
    <field name="tcp.stream" showname="Stream index: 0" size="0" pos="20" show="0"/>
    <field name="tcp.len" showname="TCP Segment Len: 0" size="1" pos="32" show="0" value="80"/>
    <field name="tcp.seq" showname="Sequence number: 0    (relative sequence number)" size="4" pos="24" show="0" value="48f36be1"/>
    <field name="tcp.ack" showname="Acknowledgment number: 0" size="4" pos="28" show="0" value="00000000"/>
    <field name="tcp.hdr_len" showname="Header Length: 32 bytes" size="1" pos="32" show="32" value="80"/>
    <field name="tcp.flags" showname=".... 0000 0000 0010 = Flags: 0x002 (SYN)" size="2" pos="32" show="2" value="2" unmaskedvalue="8002">
      <field name="tcp.flags.res" showname="000. .... .... = Reserved: Not set" size="1" pos="32" show="0" value="0" unmaskedvalue="80"/>
      <field name="tcp.flags.ns" showname="...0 .... .... = Nonce: Not set" size="1" pos="32" show="0" value="0" unmaskedvalue="80"/>
      <field name="tcp.flags.cwr" showname=".... 0... .... = Congestion Window Reduced (CWR): Not set" size="1" pos="33" show="0" value="0" unmaskedvalue="02"/>
      <field name="tcp.flags.ecn" showname=".... .0.. .... = ECN-Echo: Not set" size="1" pos="33" show="0" value="0" unmaskedvalue="02"/>
      <field name="tcp.flags.urg" showname=".... ..0. .... = Urgent: Not set" size="1" pos="33" show="0" value="0" unmaskedvalue="02"/>
      <field name="tcp.flags.ack" showname=".... ...0 .... = Acknowledgment: Not set" size="1" pos="33" show="0" value="0" unmaskedvalue="02"/>
      <field name="tcp.flags.push" showname=".... .... 0... = Push: Not set" size="1" pos="33" show="0" value="0" unmaskedvalue="02"/>
      <field name="tcp.flags.reset" showname=".... .... .0.. = Reset: Not set" size="1" pos="33" show="0" value="0" unmaskedvalue="02"/>
      <field name="tcp.flags.syn" showname=".... .... ..1. = Syn: Set" size="1" pos="33" show="1" value="1" unmaskedvalue="02">
        <field name="_ws.expert" showname="Expert Info (Chat/Sequence): Connection establish request (SYN): server port 8001" size="0" pos="33">
          <field name="tcp.connection.syn" showname="Connection establish request (SYN): server port 8001" size="0" pos="0" show="" value=""/>
          <field name="_ws.expert.message" showname="Message: Connection establish request (SYN): server port 8001" hide="yes" size="0" pos="0" show="Connection establish request (SYN): server port 8001"/>
          <field name="_ws.expert.severity" showname="Severity level: Chat" size="0" pos="0" show="2097152"/>
          <field name="_ws.expert.group" showname="Group: Sequence" size="0" pos="0" show="33554432"/>
        </field>
      </field>
      <field name="tcp.flags.fin" showname=".... .... ...0 = Fin: Not set" size="1" pos="33" show="0" value="0" unmaskedvalue="02"/>
    </field>
    <field name="tcp.window_size_value" showname="Window size value: 8192" size="2" pos="34" show="8192" value="2000"/>
    <field name="tcp.window_size" showname="Calculated window size: 8192" size="2" pos="34" show="8192" value="2000"/>
    <field name="tcp.checksum" showname="Checksum: 0xaa69 [validation disabled]" size="2" pos="36" show="43625" value="aa69">
      <field name="tcp.checksum_good" showname="Good Checksum: False" size="2" pos="36" show="0" value="aa69"/>
      <field name="tcp.checksum_bad" showname="Bad Checksum: False" size="2" pos="36" show="0" value="aa69"/>
    </field>
    <field name="tcp.urgent_pointer" showname="Urgent pointer: 0" size="2" pos="38" show="0" value="0000"/>
    <field name="tcp.options" showname="Options: (12 bytes), Maximum segment size, No-Operation (NOP), Window scale, No-Operation (NOP), No-Operation (NOP), SACK permitted" size="12" pos="40" show="02:04:ff:d7:01:03:03:08:01:01:04:02" value="0204ffd70103030801010402">
      <field name="tcp.options.mss" showname="Maximum segment size: 65495 bytes" size="4" pos="40" show="" value="">
        <field name="tcp.option_kind" showname="Kind: Maximum Segment Size (2)" size="1" pos="40" show="2" value="02"/>
        <field name="tcp.option_len" showname="Length: 4" size="1" pos="41" show="4" value="04"/>
        <field name="tcp.options.mss_val" showname="MSS Value: 65495" size="2" pos="42" show="65495" value="ffd7"/>
      </field>
      <field name="" show="No-Operation (NOP)" size="1" pos="44" value="01">
        <field name="tcp.options.type" showname="Type: 1" size="1" pos="44" show="1" value="01">
          <field name="tcp.options.type.copy" showname="0... .... = Copy on fragmentation: No" size="1" pos="44" show="0" value="0" unmaskedvalue="01"/>
          <field name="tcp.options.type.class" showname=".00. .... = Class: Control (0)" size="1" pos="44" show="0" value="0" unmaskedvalue="01"/>
          <field name="tcp.options.type.number" showname="...0 0001 = Number: No-Operation (NOP) (1)" size="1" pos="44" show="1" value="1" unmaskedvalue="01"/>
        </field>
      </field>
      <field name="" show="Window scale: 8 (multiply by 256)" size="3" pos="45" value="030308">
        <field name="tcp.option_kind" showname="Kind: Window Scale (3)" size="1" pos="45" show="3" value="03"/>
        <field name="tcp.option_len" showname="Length: 3" size="1" pos="46" show="3" value="03"/>
        <field name="tcp.options.wscale.shift" showname="Shift count: 8" size="1" pos="47" show="8" value="08"/>
        <field name="tcp.options.wscale.multiplier" showname="Multiplier: 256" size="1" pos="47" show="256" value="08"/>
      </field>
      <field name="" show="No-Operation (NOP)" size="1" pos="48" value="01">
        <field name="tcp.options.type" showname="Type: 1" size="1" pos="48" show="1" value="01">
          <field name="tcp.options.type.copy" showname="0... .... = Copy on fragmentation: No" size="1" pos="48" show="0" value="0" unmaskedvalue="01"/>
          <field name="tcp.options.type.class" showname=".00. .... = Class: Control (0)" size="1" pos="48" show="0" value="0" unmaskedvalue="01"/>
          <field name="tcp.options.type.number" showname="...0 0001 = Number: No-Operation (NOP) (1)" size="1" pos="48" show="1" value="1" unmaskedvalue="01"/>
        </field>
      </field>
      <field name="" show="No-Operation (NOP)" size="1" pos="49" value="01">
        <field name="tcp.options.type" showname="Type: 1" size="1" pos="49" show="1" value="01">
          <field name="tcp.options.type.copy" showname="0... .... = Copy on fragmentation: No" size="1" pos="49" show="0" value="0" unmaskedvalue="01"/>
          <field name="tcp.options.type.class" showname=".00. .... = Class: Control (0)" size="1" pos="49" show="0" value="0" unmaskedvalue="01"/>
          <field name="tcp.options.type.number" showname="...0 0001 = Number: No-Operation (NOP) (1)" size="1" pos="49" show="1" value="1" unmaskedvalue="01"/>
        </field>
      </field>
      <field name="tcp.options.sack_perm" showname="TCP SACK Permitted Option: True" size="2" pos="50" show="1" value="0402">
        <field name="tcp.option_kind" showname="Kind: SACK Permitted (4)" size="1" pos="50" show="4" value="04"/>
        <field name="tcp.option_len" showname="Length: 2" size="1" pos="51" show="2" value="02"/>
      </field>
    </field>
  </proto>
</packet>


<packet>
  <proto name="geninfo" pos="0" showname="General information" size="52">
    <field name="num" pos="0" show="2" showname="Number" value="2" size="52"/>
    <field name="len" pos="0" show="52" showname="Frame Length" value="34" size="52"/>
    <field name="caplen" pos="0" show="52" showname="Captured Length" value="34" size="52"/>
    <field name="timestamp" pos="0" show="Dec 16, 2014 06:22:55.757841000 Pacific Standard Time" showname="Captured Time" value="1418739775.757841000" size="52"/>
  </proto>
  <proto name="frame" showname="Frame 2: 52 bytes on wire (416 bits), 52 bytes captured (416 bits)" size="52" pos="0">
    <field name="frame.encap_type" showname="Encapsulation type: Raw IP (7)" size="0" pos="0" show="7"/>
    <field name="frame.time" showname="Arrival Time: Dec 16, 2014 06:22:55.757841000 Pacific Standard Time" size="0" pos="0" show="Dec 16, 2014 06:22:55.757841000 Pacific Standard Time"/>
    <field name="frame.offset_shift" showname="Time shift for this packet: 0.000000000 seconds" size="0" pos="0" show="0.000000000"/>
    <field name="frame.time_epoch" showname="Epoch Time: 1418739775.757841000 seconds" size="0" pos="0" show="1418739775.757841000"/>
    <field name="frame.time_delta" showname="Time delta from previous captured frame: 0.002500000 seconds" size="0" pos="0" show="0.002500000"/>
    <field name="frame.time_delta_displayed" showname="Time delta from previous displayed frame: 0.002500000 seconds" size="0" pos="0" show="0.002500000"/>
    <field name="frame.time_relative" showname="Time since reference or first frame: 0.002500000 seconds" size="0" pos="0" show="0.002500000"/>
    <field name="frame.number" showname="Frame Number: 2" size="0" pos="0" show="2"/>
    <field name="frame.len" showname="Frame Length: 52 bytes (416 bits)" size="0" pos="0" show="52"/>
    <field name="frame.cap_len" showname="Capture Length: 52 bytes (416 bits)" size="0" pos="0" show="52"/>
    <field name="frame.marked" showname="Frame is marked: False" size="0" pos="0" show="0"/>
    <field name="frame.ignored" showname="Frame is ignored: False" size="0" pos="0" show="0"/>
    <field name="frame.protocols" showname="Protocols in frame: raw:ip:tcp" size="0" pos="0" show="raw:ip:tcp"/>
  </proto>
  <proto name="raw" showname="Raw packet data" size="0" pos="0">
    <field name="" show="No link information available" size="0" pos="0"/>
  </proto>
  <proto name="ip" showname="Internet Protocol Version 4, Src: 127.0.0.1 (127.0.0.1), Dst: 127.0.0.1 (127.0.0.1)" size="20" pos="0">
    <field name="ip.version" showname="Version: 4" size="1" pos="0" show="4" value="45"/>
    <field name="ip.hdr_len" showname="Header Length: 20 bytes" size="1" pos="0" show="20" value="45"/>
    <field name="ip.dsfield" showname="Differentiated Services Field: 0x00 (DSCP 0x00: Default; ECN: 0x00: Not-ECT (Not ECN-Capable Transport))" size="1" pos="1" show="0" value="00">
      <field name="ip.dsfield.dscp" showname="0000 00.. = Differentiated Services Codepoint: Default (0x00)" size="1" pos="1" show="0" value="0" unmaskedvalue="00"/>
      <field name="ip.dsfield.ecn" showname=".... ..00 = Explicit Congestion Notification: Not-ECT (Not ECN-Capable Transport) (0x00)" size="1" pos="1" show="0" value="0" unmaskedvalue="00"/>
    </field>
    <field name="ip.len" showname="Total Length: 52" size="2" pos="2" show="52" value="0034"/>
    <field name="ip.id" showname="Identification: 0x1363 (4963)" size="2" pos="4" show="4963" value="1363"/>
    <field name="ip.flags" showname="Flags: 0x02 (Don&apos;t Fragment)" size="1" pos="6" show="2" value="40">
      <field name="ip.flags.rb" showname="0... .... = Reserved bit: Not set" size="1" pos="6" show="0" value="40"/>
      <field name="ip.flags.df" showname=".1.. .... = Don&apos;t fragment: Set" size="1" pos="6" show="1" value="40"/>
      <field name="ip.flags.mf" showname="..0. .... = More fragments: Not set" size="1" pos="6" show="0" value="40"/>
    </field>
    <field name="ip.frag_offset" showname="Fragment offset: 0" size="2" pos="6" show="0" value="4000"/>
    <field name="ip.ttl" showname="Time to live: 128" size="1" pos="8" show="128" value="80"/>
    <field name="ip.proto" showname="Protocol: TCP (6)" size="1" pos="9" show="6" value="06"/>
    <field name="ip.checksum" showname="Header checksum: 0x0000 [validation disabled]" size="2" pos="10" show="0" value="0000">
      <field name="ip.checksum_good" showname="Good: False" size="2" pos="10" show="0" value="0000"/>
      <field name="ip.checksum_bad" showname="Bad: False" size="2" pos="10" show="0" value="0000"/>
    </field>
    <field name="ip.src" showname="Source: 127.0.0.1 (127.0.0.1)" size="4" pos="12" show="127.0.0.1" value="7f000001"/>
    <field name="ip.addr" showname="Source or Destination Address: 127.0.0.1 (127.0.0.1)" hide="yes" size="4" pos="12" show="127.0.0.1" value="7f000001"/>
    <field name="ip.src_host" showname="Source Host: 127.0.0.1" hide="yes" size="4" pos="12" show="127.0.0.1" value="7f000001"/>
    <field name="ip.host" showname="Source or Destination Host: 127.0.0.1" hide="yes" size="4" pos="12" show="127.0.0.1" value="7f000001"/>
    <field name="ip.dst" showname="Destination: 127.0.0.1 (127.0.0.1)" size="4" pos="16" show="127.0.0.1" value="7f000001"/>
    <field name="ip.addr" showname="Source or Destination Address: 127.0.0.1 (127.0.0.1)" hide="yes" size="4" pos="16" show="127.0.0.1" value="7f000001"/>
    <field name="ip.dst_host" showname="Destination Host: 127.0.0.1" hide="yes" size="4" pos="16" show="127.0.0.1" value="7f000001"/>
    <field name="ip.host" showname="Source or Destination Host: 127.0.0.1" hide="yes" size="4" pos="16" show="127.0.0.1" value="7f000001"/>
    <field name="" show="Source GeoIP: Unknown" size="4" pos="12" value="7f000001"/>
    <field name="" show="Destination GeoIP: Unknown" size="4" pos="16" value="7f000001"/>
  </proto>
  <proto name="tcp" showname="Transmission Control Protocol, Src Port: 8001 (8001), Dst Port: 55402 (55402), Seq: 0, Ack: 1, Len: 0" size="32" pos="20">
    <field name="tcp.srcport" showname="Source Port: 8001 (8001)" size="2" pos="20" show="8001" value="1f41"/>
    <field name="tcp.dstport" showname="Destination Port: 55402 (55402)" size="2" pos="22" show="55402" value="d86a"/>
    <field name="tcp.port" showname="Source or Destination Port: 8001" hide="yes" size="2" pos="20" show="8001" value="1f41"/>
    <field name="tcp.port" showname="Source or Destination Port: 55402" hide="yes" size="2" pos="22" show="55402" value="d86a"/>
    <field name="tcp.stream" showname="Stream index: 0" size="0" pos="20" show="0"/>
    <field name="tcp.len" showname="TCP Segment Len: 0" size="1" pos="32" show="0" value="80"/>
    <field name="tcp.seq" showname="Sequence number: 0    (relative sequence number)" size="4" pos="24" show="0" value="34f91216"/>
    <field name="tcp.ack" showname="Acknowledgment number: 1    (relative ack number)" size="4" pos="28" show="1" value="48f36be2"/>
    <field name="tcp.hdr_len" showname="Header Length: 32 bytes" size="1" pos="32" show="32" value="80"/>
    <field name="tcp.flags" showname=".... 0000 0001 0010 = Flags: 0x012 (SYN, ACK)" size="2" pos="32" show="18" value="12" unmaskedvalue="8012">
      <field name="tcp.flags.res" showname="000. .... .... = Reserved: Not set" size="1" pos="32" show="0" value="0" unmaskedvalue="80"/>
      <field name="tcp.flags.ns" showname="...0 .... .... = Nonce: Not set" size="1" pos="32" show="0" value="0" unmaskedvalue="80"/>
      <field name="tcp.flags.cwr" showname=".... 0... .... = Congestion Window Reduced (CWR): Not set" size="1" pos="33" show="0" value="0" unmaskedvalue="12"/>
      <field name="tcp.flags.ecn" showname=".... .0.. .... = ECN-Echo: Not set" size="1" pos="33" show="0" value="0" unmaskedvalue="12"/>
      <field name="tcp.flags.urg" showname=".... ..0. .... = Urgent: Not set" size="1" pos="33" show="0" value="0" unmaskedvalue="12"/>
      <field name="tcp.flags.ack" showname=".... ...1 .... = Acknowledgment: Set" size="1" pos="33" show="1" value="1" unmaskedvalue="12"/>
      <field name="tcp.flags.push" showname=".... .... 0... = Push: Not set" size="1" pos="33" show="0" value="0" unmaskedvalue="12"/>
      <field name="tcp.flags.reset" showname=".... .... .0.. = Reset: Not set" size="1" pos="33" show="0" value="0" unmaskedvalue="12"/>
      <field name="tcp.flags.syn" showname=".... .... ..1. = Syn: Set" size="1" pos="33" show="1" value="1" unmaskedvalue="12">
        <field name="_ws.expert" showname="Expert Info (Chat/Sequence): Connection establish acknowledge (SYN+ACK): server port 8001" size="0" pos="33">
          <field name="tcp.connection.sack" showname="Connection establish acknowledge (SYN+ACK): server port 8001" size="0" pos="0" show="" value=""/>
          <field name="_ws.expert.message" showname="Message: Connection establish acknowledge (SYN+ACK): server port 8001" hide="yes" size="0" pos="0" show="Connection establish acknowledge (SYN+ACK): server port 8001"/>
          <field name="_ws.expert.severity" showname="Severity level: Chat" size="0" pos="0" show="2097152"/>
          <field name="_ws.expert.group" showname="Group: Sequence" size="0" pos="0" show="33554432"/>
        </field>
      </field>
      <field name="tcp.flags.fin" showname=".... .... ...0 = Fin: Not set" size="1" pos="33" show="0" value="0" unmaskedvalue="12"/>
    </field>
    <field name="tcp.window_size_value" showname="Window size value: 8192" size="2" pos="34" show="8192" value="2000"/>
    <field name="tcp.window_size" showname="Calculated window size: 8192" size="2" pos="34" show="8192" value="2000"/>
    <field name="tcp.checksum" showname="Checksum: 0x6349 [validation disabled]" size="2" pos="36" show="25417" value="6349">
      <field name="tcp.checksum_good" showname="Good Checksum: False" size="2" pos="36" show="0" value="6349"/>
      <field name="tcp.checksum_bad" showname="Bad Checksum: False" size="2" pos="36" show="0" value="6349"/>
    </field>
    <field name="tcp.urgent_pointer" showname="Urgent pointer: 0" size="2" pos="38" show="0" value="0000"/>
    <field name="tcp.options" showname="Options: (12 bytes), Maximum segment size, No-Operation (NOP), Window scale, No-Operation (NOP), No-Operation (NOP), SACK permitted" size="12" pos="40" show="02:04:ff:d7:01:03:03:08:01:01:04:02" value="0204ffd70103030801010402">
      <field name="tcp.options.mss" showname="Maximum segment size: 65495 bytes" size="4" pos="40" show="" value="">
        <field name="tcp.option_kind" showname="Kind: Maximum Segment Size (2)" size="1" pos="40" show="2" value="02"/>
        <field name="tcp.option_len" showname="Length: 4" size="1" pos="41" show="4" value="04"/>
        <field name="tcp.options.mss_val" showname="MSS Value: 65495" size="2" pos="42" show="65495" value="ffd7"/>
      </field>
      <field name="" show="No-Operation (NOP)" size="1" pos="44" value="01">
        <field name="tcp.options.type" showname="Type: 1" size="1" pos="44" show="1" value="01">
          <field name="tcp.options.type.copy" showname="0... .... = Copy on fragmentation: No" size="1" pos="44" show="0" value="0" unmaskedvalue="01"/>
          <field name="tcp.options.type.class" showname=".00. .... = Class: Control (0)" size="1" pos="44" show="0" value="0" unmaskedvalue="01"/>
          <field name="tcp.options.type.number" showname="...0 0001 = Number: No-Operation (NOP) (1)" size="1" pos="44" show="1" value="1" unmaskedvalue="01"/>
        </field>
      </field>
      <field name="" show="Window scale: 8 (multiply by 256)" size="3" pos="45" value="030308">
        <field name="tcp.option_kind" showname="Kind: Window Scale (3)" size="1" pos="45" show="3" value="03"/>
        <field name="tcp.option_len" showname="Length: 3" size="1" pos="46" show="3" value="03"/>
        <field name="tcp.options.wscale.shift" showname="Shift count: 8" size="1" pos="47" show="8" value="08"/>
        <field name="tcp.options.wscale.multiplier" showname="Multiplier: 256" size="1" pos="47" show="256" value="08"/>
      </field>
      <field name="" show="No-Operation (NOP)" size="1" pos="48" value="01">
        <field name="tcp.options.type" showname="Type: 1" size="1" pos="48" show="1" value="01">
          <field name="tcp.options.type.copy" showname="0... .... = Copy on fragmentation: No" size="1" pos="48" show="0" value="0" unmaskedvalue="01"/>
          <field name="tcp.options.type.class" showname=".00. .... = Class: Control (0)" size="1" pos="48" show="0" value="0" unmaskedvalue="01"/>
          <field name="tcp.options.type.number" showname="...0 0001 = Number: No-Operation (NOP) (1)" size="1" pos="48" show="1" value="1" unmaskedvalue="01"/>
        </field>
      </field>
      <field name="" show="No-Operation (NOP)" size="1" pos="49" value="01">
        <field name="tcp.options.type" showname="Type: 1" size="1" pos="49" show="1" value="01">
          <field name="tcp.options.type.copy" showname="0... .... = Copy on fragmentation: No" size="1" pos="49" show="0" value="0" unmaskedvalue="01"/>
          <field name="tcp.options.type.class" showname=".00. .... = Class: Control (0)" size="1" pos="49" show="0" value="0" unmaskedvalue="01"/>
          <field name="tcp.options.type.number" showname="...0 0001 = Number: No-Operation (NOP) (1)" size="1" pos="49" show="1" value="1" unmaskedvalue="01"/>
        </field>
      </field>
      <field name="tcp.options.sack_perm" showname="TCP SACK Permitted Option: True" size="2" pos="50" show="1" value="0402">
        <field name="tcp.option_kind" showname="Kind: SACK Permitted (4)" size="1" pos="50" show="4" value="04"/>
        <field name="tcp.option_len" showname="Length: 2" size="1" pos="51" show="2" value="02"/>
      </field>
    </field>
    <field name="tcp.analysis" showname="SEQ/ACK analysis" size="0" pos="20" show="" value="">
      <field name="tcp.analysis.acks_frame" showname="This is an ACK to the segment in frame: 1" size="0" pos="20" show="1"/>
      <field name="tcp.analysis.ack_rtt" showname="The RTT to ACK the segment was: 0.002500000 seconds" size="0" pos="20" show="0.002500000"/>
    </field>
  </proto>
</packet>


<packet>
  <proto name="geninfo" pos="0" showname="General information" size="40">
    <field name="num" pos="0" show="3" showname="Number" value="3" size="40"/>
    <field name="len" pos="0" show="40" showname="Frame Length" value="28" size="40"/>
    <field name="caplen" pos="0" show="40" showname="Captured Length" value="28" size="40"/>
    <field name="timestamp" pos="0" show="Dec 16, 2014 06:22:55.757841000 Pacific Standard Time" showname="Captured Time" value="1418739775.757841000" size="40"/>
  </proto>
  <proto name="frame" showname="Frame 3: 40 bytes on wire (320 bits), 40 bytes captured (320 bits)" size="40" pos="0">
    <field name="frame.encap_type" showname="Encapsulation type: Raw IP (7)" size="0" pos="0" show="7"/>
    <field name="frame.time" showname="Arrival Time: Dec 16, 2014 06:22:55.757841000 Pacific Standard Time" size="0" pos="0" show="Dec 16, 2014 06:22:55.757841000 Pacific Standard Time"/>
    <field name="frame.offset_shift" showname="Time shift for this packet: 0.000000000 seconds" size="0" pos="0" show="0.000000000"/>
    <field name="frame.time_epoch" showname="Epoch Time: 1418739775.757841000 seconds" size="0" pos="0" show="1418739775.757841000"/>
    <field name="frame.time_delta" showname="Time delta from previous captured frame: 0.000000000 seconds" size="0" pos="0" show="0.000000000"/>
    <field name="frame.time_delta_displayed" showname="Time delta from previous displayed frame: 0.000000000 seconds" size="0" pos="0" show="0.000000000"/>
    <field name="frame.time_relative" showname="Time since reference or first frame: 0.002500000 seconds" size="0" pos="0" show="0.002500000"/>
    <field name="frame.number" showname="Frame Number: 3" size="0" pos="0" show="3"/>
    <field name="frame.len" showname="Frame Length: 40 bytes (320 bits)" size="0" pos="0" show="40"/>
    <field name="frame.cap_len" showname="Capture Length: 40 bytes (320 bits)" size="0" pos="0" show="40"/>
    <field name="frame.marked" showname="Frame is marked: False" size="0" pos="0" show="0"/>
    <field name="frame.ignored" showname="Frame is ignored: False" size="0" pos="0" show="0"/>
    <field name="frame.protocols" showname="Protocols in frame: raw:ip:tcp" size="0" pos="0" show="raw:ip:tcp"/>
  </proto>
  <proto name="raw" showname="Raw packet data" size="0" pos="0">
    <field name="" show="No link information available" size="0" pos="0"/>
  </proto>
  <proto name="ip" showname="Internet Protocol Version 4, Src: 127.0.0.1 (127.0.0.1), Dst: 127.0.0.1 (127.0.0.1)" size="20" pos="0">
    <field name="ip.version" showname="Version: 4" size="1" pos="0" show="4" value="45"/>
    <field name="ip.hdr_len" showname="Header Length: 20 bytes" size="1" pos="0" show="20" value="45"/>
    <field name="ip.dsfield" showname="Differentiated Services Field: 0x00 (DSCP 0x00: Default; ECN: 0x00: Not-ECT (Not ECN-Capable Transport))" size="1" pos="1" show="0" value="00">
      <field name="ip.dsfield.dscp" showname="0000 00.. = Differentiated Services Codepoint: Default (0x00)" size="1" pos="1" show="0" value="0" unmaskedvalue="00"/>
      <field name="ip.dsfield.ecn" showname=".... ..00 = Explicit Congestion Notification: Not-ECT (Not ECN-Capable Transport) (0x00)" size="1" pos="1" show="0" value="0" unmaskedvalue="00"/>
    </field>
    <field name="ip.len" showname="Total Length: 40" size="2" pos="2" show="40" value="0028"/>
    <field name="ip.id" showname="Identification: 0x1364 (4964)" size="2" pos="4" show="4964" value="1364"/>
    <field name="ip.flags" showname="Flags: 0x02 (Don&apos;t Fragment)" size="1" pos="6" show="2" value="40">
      <field name="ip.flags.rb" showname="0... .... = Reserved bit: Not set" size="1" pos="6" show="0" value="40"/>
      <field name="ip.flags.df" showname=".1.. .... = Don&apos;t fragment: Set" size="1" pos="6" show="1" value="40"/>
      <field name="ip.flags.mf" showname="..0. .... = More fragments: Not set" size="1" pos="6" show="0" value="40"/>
    </field>
    <field name="ip.frag_offset" showname="Fragment offset: 0" size="2" pos="6" show="0" value="4000"/>
    <field name="ip.ttl" showname="Time to live: 128" size="1" pos="8" show="128" value="80"/>
    <field name="ip.proto" showname="Protocol: TCP (6)" size="1" pos="9" show="6" value="06"/>
    <field name="ip.checksum" showname="Header checksum: 0x0000 [validation disabled]" size="2" pos="10" show="0" value="0000">
      <field name="ip.checksum_good" showname="Good: False" size="2" pos="10" show="0" value="0000"/>
      <field name="ip.checksum_bad" showname="Bad: False" size="2" pos="10" show="0" value="0000"/>
    </field>
    <field name="ip.src" showname="Source: 127.0.0.1 (127.0.0.1)" size="4" pos="12" show="127.0.0.1" value="7f000001"/>
    <field name="ip.addr" showname="Source or Destination Address: 127.0.0.1 (127.0.0.1)" hide="yes" size="4" pos="12" show="127.0.0.1" value="7f000001"/>
    <field name="ip.src_host" showname="Source Host: 127.0.0.1" hide="yes" size="4" pos="12" show="127.0.0.1" value="7f000001"/>
    <field name="ip.host" showname="Source or Destination Host: 127.0.0.1" hide="yes" size="4" pos="12" show="127.0.0.1" value="7f000001"/>
    <field name="ip.dst" showname="Destination: 127.0.0.1 (127.0.0.1)" size="4" pos="16" show="127.0.0.1" value="7f000001"/>
    <field name="ip.addr" showname="Source or Destination Address: 127.0.0.1 (127.0.0.1)" hide="yes" size="4" pos="16" show="127.0.0.1" value="7f000001"/>
    <field name="ip.dst_host" showname="Destination Host: 127.0.0.1" hide="yes" size="4" pos="16" show="127.0.0.1" value="7f000001"/>
    <field name="ip.host" showname="Source or Destination Host: 127.0.0.1" hide="yes" size="4" pos="16" show="127.0.0.1" value="7f000001"/>
    <field name="" show="Source GeoIP: Unknown" size="4" pos="12" value="7f000001"/>
    <field name="" show="Destination GeoIP: Unknown" size="4" pos="16" value="7f000001"/>
  </proto>
  <proto name="tcp" showname="Transmission Control Protocol, Src Port: 55402 (55402), Dst Port: 8001 (8001), Seq: 1, Ack: 1, Len: 0" size="20" pos="20">
    <field name="tcp.srcport" showname="Source Port: 55402 (55402)" size="2" pos="20" show="55402" value="d86a"/>
    <field name="tcp.dstport" showname="Destination Port: 8001 (8001)" size="2" pos="22" show="8001" value="1f41"/>
    <field name="tcp.port" showname="Source or Destination Port: 55402" hide="yes" size="2" pos="20" show="55402" value="d86a"/>
    <field name="tcp.port" showname="Source or Destination Port: 8001" hide="yes" size="2" pos="22" show="8001" value="1f41"/>
    <field name="tcp.stream" showname="Stream index: 0" size="0" pos="20" show="0"/>
    <field name="tcp.len" showname="TCP Segment Len: 0" size="1" pos="32" show="0" value="50"/>
    <field name="tcp.seq" showname="Sequence number: 1    (relative sequence number)" size="4" pos="24" show="1" value="48f36be2"/>
    <field name="tcp.ack" showname="Acknowledgment number: 1    (relative ack number)" size="4" pos="28" show="1" value="34f91217"/>
    <field name="tcp.hdr_len" showname="Header Length: 20 bytes" size="1" pos="32" show="20" value="50"/>
    <field name="tcp.flags" showname=".... 0000 0001 0000 = Flags: 0x010 (ACK)" size="2" pos="32" show="16" value="10" unmaskedvalue="5010">
      <field name="tcp.flags.res" showname="000. .... .... = Reserved: Not set" size="1" pos="32" show="0" value="0" unmaskedvalue="50"/>
      <field name="tcp.flags.ns" showname="...0 .... .... = Nonce: Not set" size="1" pos="32" show="0" value="0" unmaskedvalue="50"/>
      <field name="tcp.flags.cwr" showname=".... 0... .... = Congestion Window Reduced (CWR): Not set" size="1" pos="33" show="0" value="0" unmaskedvalue="10"/>
      <field name="tcp.flags.ecn" showname=".... .0.. .... = ECN-Echo: Not set" size="1" pos="33" show="0" value="0" unmaskedvalue="10"/>
      <field name="tcp.flags.urg" showname=".... ..0. .... = Urgent: Not set" size="1" pos="33" show="0" value="0" unmaskedvalue="10"/>
      <field name="tcp.flags.ack" showname=".... ...1 .... = Acknowledgment: Set" size="1" pos="33" show="1" value="1" unmaskedvalue="10"/>
      <field name="tcp.flags.push" showname=".... .... 0... = Push: Not set" size="1" pos="33" show="0" value="0" unmaskedvalue="10"/>
      <field name="tcp.flags.reset" showname=".... .... .0.. = Reset: Not set" size="1" pos="33" show="0" value="0" unmaskedvalue="10"/>
      <field name="tcp.flags.syn" showname=".... .... ..0. = Syn: Not set" size="1" pos="33" show="0" value="0" unmaskedvalue="10"/>
      <field name="tcp.flags.fin" showname=".... .... ...0 = Fin: Not set" size="1" pos="33" show="0" value="0" unmaskedvalue="10"/>
    </field>
    <field name="tcp.window_size_value" showname="Window size value: 32" size="2" pos="34" show="32" value="0020"/>
    <field name="tcp.window_size" showname="Calculated window size: 8192" size="2" pos="34" show="8192" value="0020"/>
    <field name="tcp.window_size_scalefactor" showname="Window size scaling factor: 256" size="2" pos="34" show="256" value="0020"/>
    <field name="tcp.checksum" showname="Checksum: 0xbe20 [validation disabled]" size="2" pos="36" show="48672" value="be20">
      <field name="tcp.checksum_good" showname="Good Checksum: False" size="2" pos="36" show="0" value="be20"/>
      <field name="tcp.checksum_bad" showname="Bad Checksum: False" size="2" pos="36" show="0" value="be20"/>
    </field>
    <field name="tcp.urgent_pointer" showname="Urgent pointer: 0" size="2" pos="38" show="0" value="0000"/>
    <field name="tcp.analysis" showname="SEQ/ACK analysis" size="0" pos="20" show="" value="">
      <field name="tcp.analysis.acks_frame" showname="This is an ACK to the segment in frame: 2" size="0" pos="20" show="2"/>
      <field name="tcp.analysis.initial_rtt" showname="iRTT: 0.002500000 seconds" size="0" pos="20" show="0.002500000"/>
    </field>
  </proto>
</packet>


<packet>
  <proto name="geninfo" pos="0" showname="General information" size="52">
    <field name="num" pos="0" show="4" showname="Number" value="4" size="52"/>
    <field name="len" pos="0" show="52" showname="Frame Length" value="34" size="52"/>
    <field name="caplen" pos="0" show="52" showname="Captured Length" value="34" size="52"/>
    <field name="timestamp" pos="0" show="Dec 16, 2014 06:22:55.760341000 Pacific Standard Time" showname="Captured Time" value="1418739775.760341000" size="52"/>
  </proto>
  <proto name="frame" showname="Frame 4: 52 bytes on wire (416 bits), 52 bytes captured (416 bits)" size="52" pos="0">
    <field name="frame.encap_type" showname="Encapsulation type: Raw IP (7)" size="0" pos="0" show="7"/>
    <field name="frame.time" showname="Arrival Time: Dec 16, 2014 06:22:55.760341000 Pacific Standard Time" size="0" pos="0" show="Dec 16, 2014 06:22:55.760341000 Pacific Standard Time"/>
    <field name="frame.offset_shift" showname="Time shift for this packet: 0.000000000 seconds" size="0" pos="0" show="0.000000000"/>
    <field name="frame.time_epoch" showname="Epoch Time: 1418739775.760341000 seconds" size="0" pos="0" show="1418739775.760341000"/>
    <field name="frame.time_delta" showname="Time delta from previous captured frame: 0.002500000 seconds" size="0" pos="0" show="0.002500000"/>
    <field name="frame.time_delta_displayed" showname="Time delta from previous displayed frame: 0.002500000 seconds" size="0" pos="0" show="0.002500000"/>
