<?xml version="1.0"?>
<?xml-stylesheet type="text/xsl" href="pdml2html.xsl"?>
<!-- You can find pdml2html.xsl in /Applications/Wireshark.app/Contents/Resources/share/wireshark or at http://anonsvn.wireshark.org/trunk/wireshark/pdml2html.xsl. -->
<pdml version="0" creator="wireshark/1.8.5" time="Mon Apr 15 15:45:15 2013" capture_file="CaptureOfDirService.cap">
<packet>
  <proto name="geninfo" pos="0" showname="General information" size="88">
    <field name="num" pos="0" show="1" showname="Number" value="1" size="88"/>
    <field name="len" pos="0" show="88" showname="Frame Length" value="58" size="88"/>
    <field name="caplen" pos="0" show="88" showname="Captured Length" value="58" size="88"/>
    <field name="timestamp" pos="0" show="Apr 15, 2013 13:55:23.852528000 PDT" showname="Captured Time" value="1366059323.852528000" size="88"/>
  </proto>
  <proto name="frame" showname="Frame 1: 88 bytes on wire (704 bits), 88 bytes captured (704 bits) on interface 0" size="88" pos="0">
    <field name="frame.interface_id" showname="Interface id: 0" size="0" pos="0" show="0"/>
    <field name="frame.dlt" showname="WTAP_ENCAP: 15" size="0" pos="0" show="15"/>
    <field name="frame.time" showname="Arrival Time: Apr 15, 2013 13:55:23.852528000 PDT" size="0" pos="0" show="Apr 15, 2013 13:55:23.852528000"/>
    <field name="frame.offset_shift" showname="Time shift for this packet: 0.000000000 seconds" size="0" pos="0" show="0.000000000"/>
    <field name="frame.time_epoch" showname="Epoch Time: 1366059323.852528000 seconds" size="0" pos="0" show="1366059323.852528000"/>
    <field name="frame.time_delta" showname="Time delta from previous captured frame: 0.000000000 seconds" size="0" pos="0" show="0.000000000"/>
    <field name="frame.time_delta_displayed" showname="Time delta from previous displayed frame: 0.000000000 seconds" size="0" pos="0" show="0.000000000"/>
    <field name="frame.time_relative" showname="Time since reference or first frame: 0.000000000 seconds" size="0" pos="0" show="0.000000000"/>
    <field name="frame.number" showname="Frame Number: 1" size="0" pos="0" show="1"/>
    <field name="frame.len" showname="Frame Length: 88 bytes (704 bits)" size="0" pos="0" show="88"/>
    <field name="frame.cap_len" showname="Capture Length: 88 bytes (704 bits)" size="0" pos="0" show="88"/>
    <field name="frame.marked" showname="Frame is marked: False" size="0" pos="0" show="0"/>
    <field name="frame.ignored" showname="Frame is ignored: False" size="0" pos="0" show="0"/>
    <field name="frame.protocols" showname="Protocols in frame: null:ipv6:tcp" size="0" pos="0" show="null:ipv6:tcp"/>
  </proto>
  <proto name="null" showname="Null/Loopback" size="4" pos="0">
    <field name="null.family" showname="Family: IPv6 (30)" size="4" pos="0" show="30" value="1e000000"/>
  </proto>
  <proto name="ipv6" showname="Internet Protocol Version 6, Src: ::1 (::1), Dst: ::1 (::1)" size="40" pos="4">
    <field name="ipv6.version" showname="0110 .... = Version: 6" size="1" pos="4" show="6" value="6" unmaskedvalue="60">
      <field name="ip.version" showname="0110 .... = This field makes the filter &quot;ip.version == 6&quot; possible: 6" size="1" pos="4" show="6" value="6" unmaskedvalue="60"/>
    </field>
    <field name="ipv6.class" showname=".... 0000 0000 .... .... .... .... .... = Traffic class: 0x00000000" size="4" pos="4" show="0x00000000" value="0" unmaskedvalue="60000000">
      <field name="ipv6.traffic_class.dscp" showname=".... 0000 00.. .... .... .... .... .... = Differentiated Services Field: Default (0x00000000)" size="4" pos="4" show="0x00000000" value="0" unmaskedvalue="60000000"/>
      <field name="ipv6.traffic_class.ect" showname=".... .... ..0. .... .... .... .... .... = ECN-Capable Transport (ECT): Not set" size="4" pos="4" show="0" value="0" unmaskedvalue="60000000"/>
      <field name="ipv6.traffic_class.ce" showname=".... .... ...0 .... .... .... .... .... = ECN-CE: Not set" size="4" pos="4" show="0" value="0" unmaskedvalue="60000000"/>
    </field>
    <field name="ipv6.flow" showname=".... .... .... 0000 0000 0000 0000 0000 = Flowlabel: 0x00000000" size="4" pos="4" show="0x00000000" value="0" unmaskedvalue="60000000"/>
    <field name="ipv6.plen" showname="Payload length: 44" size="2" pos="8" show="44" value="002c"/>
    <field name="ipv6.nxt" showname="Next header: TCP (6)" size="1" pos="10" show="6" value="06"/>
    <field name="ipv6.hlim" showname="Hop limit: 64" size="1" pos="11" show="64" value="40"/>
    <field name="ipv6.src" showname="Source: ::1 (::1)" size="16" pos="12" show="::1" value="00000000000000000000000000000001"/>
    <field name="ipv6.addr" showname="Source or Destination Address: ::1 (::1)" hide="yes" size="16" pos="12" show="::1" value="00000000000000000000000000000001"/>
    <field name="ipv6.src_host" showname="Source Host: ::1" hide="yes" size="16" pos="12" show="::1" value="00000000000000000000000000000001"/>
    <field name="ipv6.host" showname="Source or Destination Host: ::1" hide="yes" size="16" pos="12" show="::1" value="00000000000000000000000000000001"/>
    <field name="ipv6.dst" showname="Destination: ::1 (::1)" size="16" pos="28" show="::1" value="00000000000000000000000000000001"/>
    <field name="ipv6.addr" showname="Source or Destination Address: ::1 (::1)" hide="yes" size="16" pos="28" show="::1" value="00000000000000000000000000000001"/>
    <field name="ipv6.dst_host" showname="Destination Host: ::1" hide="yes" size="16" pos="28" show="::1" value="00000000000000000000000000000001"/>
    <field name="ipv6.host" showname="Source or Destination Host: ::1" hide="yes" size="16" pos="28" show="::1" value="00000000000000000000000000000001"/>
    <field name="" show="Source GeoIP: Unknown" size="16" pos="12" value="00000000000000000000000000000001"/>
    <field name="" show="Destination GeoIP: Unknown" size="16" pos="28" value="00000000000000000000000000000001"/>
  </proto>
  <proto name="tcp" showname="Transmission Control Protocol, Src Port: 51153 (51153), Dst Port: irdmi (8000), Seq: 0, Len: 0" size="44" pos="44">
    <field name="tcp.srcport" showname="Source port: 51153 (51153)" size="2" pos="44" show="51153" value="c7d1"/>
    <field name="tcp.dstport" showname="Destination port: irdmi (8000)" size="2" pos="46" show="8000" value="1f40"/>
    <field name="tcp.port" showname="Source or Destination Port: 51153" hide="yes" size="2" pos="44" show="51153" value="c7d1"/>
    <field name="tcp.port" showname="Source or Destination Port: 8000" hide="yes" size="2" pos="46" show="8000" value="1f40"/>
    <field name="tcp.stream" showname="Stream index: 0" size="0" pos="44" show="0"/>
    <field name="tcp.len" showname="TCP Segment Len: 0" hide="yes" size="1" pos="56" show="0" value="b0"/>
    <field name="tcp.seq" showname="Sequence number: 0    (relative sequence number)" size="4" pos="48" show="0" value="7074cf73"/>
    <field name="tcp.hdr_len" showname="Header length: 44 bytes" size="1" pos="56" show="44" value="b0"/>
    <field name="tcp.flags" showname="Flags: 0x002 (SYN)" size="2" pos="56" show="0x0002" value="2" unmaskedvalue="b002">
      <field name="tcp.flags.res" showname="000. .... .... = Reserved: Not set" size="1" pos="56" show="0" value="0" unmaskedvalue="b0"/>
      <field name="tcp.flags.ns" showname="...0 .... .... = Nonce: Not set" size="1" pos="56" show="0" value="0" unmaskedvalue="b0"/>
      <field name="tcp.flags.cwr" showname=".... 0... .... = Congestion Window Reduced (CWR): Not set" size="1" pos="57" show="0" value="0" unmaskedvalue="02"/>
      <field name="tcp.flags.ecn" showname=".... .0.. .... = ECN-Echo: Not set" size="1" pos="57" show="0" value="0" unmaskedvalue="02"/>
      <field name="tcp.flags.urg" showname=".... ..0. .... = Urgent: Not set" size="1" pos="57" show="0" value="0" unmaskedvalue="02"/>
      <field name="tcp.flags.ack" showname=".... ...0 .... = Acknowledgment: Not set" size="1" pos="57" show="0" value="0" unmaskedvalue="02"/>
      <field name="tcp.flags.push" showname=".... .... 0... = Push: Not set" size="1" pos="57" show="0" value="0" unmaskedvalue="02"/>
      <field name="tcp.flags.reset" showname=".... .... .0.. = Reset: Not set" size="1" pos="57" show="0" value="0" unmaskedvalue="02"/>
      <field name="tcp.flags.syn" showname=".... .... ..1. = Syn: Set" size="1" pos="57" show="1" value="1" unmaskedvalue="02">
        <field name="expert" showname="Expert Info (Chat/Sequence): Connection establish request (SYN): server port irdmi" size="0" pos="57">
          <field name="expert.message" showname="Message: Connection establish request (SYN): server port irdmi" size="0" pos="0" show="Connection establish request (SYN): server port irdmi"/>
          <field name="expert.severity" showname="Severity level: Chat" size="0" pos="0" show="0x00200000"/>
          <field name="expert.group" showname="Group: Sequence" size="0" pos="0" show="0x02000000"/>
        </field>
      </field>
      <field name="tcp.flags.fin" showname=".... .... ...0 = Fin: Not set" size="1" pos="57" show="0" value="0" unmaskedvalue="02"/>
    </field>
    <field name="tcp.window_size_value" showname="Window size value: 65535" size="2" pos="58" show="65535" value="ffff"/>
    <field name="tcp.window_size" showname="Calculated window size: 65535" size="2" pos="58" show="65535" value="ffff"/>
    <field name="tcp.checksum" showname="Checksum: 0x0034 [validation disabled]" size="2" pos="60" show="0x0034" value="0034">
      <field name="tcp.checksum_good" showname="Good Checksum: False" size="2" pos="60" show="0" value="0034"/>
      <field name="tcp.checksum_bad" showname="Bad Checksum: False" size="2" pos="60" show="0" value="0034"/>
    </field>
    <field name="tcp.options" showname="Options: (24 bytes), Maximum segment size, No-Operation (NOP), Window scale, No-Operation (NOP), No-Operation (NOP), Timestamps, SACK permitted, End of Option List (EOL)" size="24" pos="64" show="02:04:3f:c4:01:03:03:04:01:01:08:0a:2e:93:cf:ab:00:00:00:00:04:02:00:00" value="02043fc4010303040101080a2e93cfab0000000004020000">
      <field name="tcp.options.mss" showname="Maximum segment size: 16324 bytes" size="4" pos="64" show="" value="">
        <field name="tcp.option_kind" showname="Kind: MSS size (2)" size="1" pos="64" show="2" value="02"/>
        <field name="tcp.option_len" showname="Length: 4" size="1" pos="65" show="4" value="04"/>
        <field name="tcp.options.mss_val" showname="MSS Value: 16324" size="2" pos="66" show="16324" value="3fc4"/>
      </field>
      <field name="" show="No-Operation (NOP)" size="1" pos="68" value="01">
        <field name="ip.opt.type" showname="Type: 1" size="1" pos="68" show="1" value="01">
          <field name="ip.opt.type.copy" showname="0... .... = Copy on fragmentation: No" size="1" pos="68" show="0" value="0" unmaskedvalue="01"/>
          <field name="ip.opt.type.class" showname=".00. .... = Class: Control (0)" size="1" pos="68" show="0" value="0" unmaskedvalue="01"/>
          <field name="ip.opt.type.number" showname="...0 0001 = Number: No-Operation (NOP) (1)" size="1" pos="68" show="1" value="1" unmaskedvalue="01"/>
        </field>
      </field>
      <field name="" show="Window scale: 4 (multiply by 16)" size="3" pos="69" value="030304">
        <field name="tcp.option_kind" showname="Kind: Window Scale (3)" size="1" pos="69" show="3" value="03"/>
        <field name="tcp.option_len" showname="Length: 3" size="1" pos="70" show="3" value="03"/>
        <field name="tcp.options.wscale.shift" showname="Shift count: 4" size="1" pos="71" show="4" value="04"/>
        <field name="tcp.options.wscale.multiplier" showname="Multiplier: 16" size="1" pos="71" show="16" value="04"/>
      </field>
      <field name="" show="No-Operation (NOP)" size="1" pos="72" value="01">
        <field name="ip.opt.type" showname="Type: 1" size="1" pos="72" show="1" value="01">
          <field name="ip.opt.type.copy" showname="0... .... = Copy on fragmentation: No" size="1" pos="72" show="0" value="0" unmaskedvalue="01"/>
          <field name="ip.opt.type.class" showname=".00. .... = Class: Control (0)" size="1" pos="72" show="0" value="0" unmaskedvalue="01"/>
          <field name="ip.opt.type.number" showname="...0 0001 = Number: No-Operation (NOP) (1)" size="1" pos="72" show="1" value="1" unmaskedvalue="01"/>
        </field>
      </field>
      <field name="" show="No-Operation (NOP)" size="1" pos="73" value="01">
        <field name="ip.opt.type" showname="Type: 1" size="1" pos="73" show="1" value="01">
          <field name="ip.opt.type.copy" showname="0... .... = Copy on fragmentation: No" size="1" pos="73" show="0" value="0" unmaskedvalue="01"/>
          <field name="ip.opt.type.class" showname=".00. .... = Class: Control (0)" size="1" pos="73" show="0" value="0" unmaskedvalue="01"/>
          <field name="ip.opt.type.number" showname="...0 0001 = Number: No-Operation (NOP) (1)" size="1" pos="73" show="1" value="1" unmaskedvalue="01"/>
        </field>
      </field>
      <field name="" show="Timestamps: TSval 781438891, TSecr 0" size="10" pos="74" value="080a2e93cfab00000000">
        <field name="tcp.option_kind" showname="Kind: Timestamp (8)" size="1" pos="74" show="8" value="08"/>
        <field name="tcp.option_len" showname="Length: 10" size="1" pos="75" show="10" value="0a"/>
        <field name="tcp.options.timestamp.tsval" showname="Timestamp value: 781438891" size="4" pos="76" show="781438891" value="2e93cfab"/>
        <field name="tcp.options.timestamp.tsecr" showname="Timestamp echo reply: 0" size="4" pos="80" show="0" value="00000000"/>
      </field>
      <field name="tcp.options.sack_perm" showname="TCP SACK Permitted Option: True" size="2" pos="84" show="1" value="0402">
        <field name="tcp.option_kind" showname="Kind: SACK Permission (4)" size="1" pos="84" show="4" value="04"/>
        <field name="tcp.option_len" showname="Length: 2" size="1" pos="85" show="2" value="02"/>
      </field>
      <field name="" show="End of Option List (EOL)" size="1" pos="86" value="00">
        <field name="ip.opt.type" showname="Type: 0" size="1" pos="86" show="0" value="00">
          <field name="ip.opt.type.copy" showname="0... .... = Copy on fragmentation: No" size="1" pos="86" show="0" value="0" unmaskedvalue="00"/>
          <field name="ip.opt.type.class" showname=".00. .... = Class: Control (0)" size="1" pos="86" show="0" value="0" unmaskedvalue="00"/>
          <field name="ip.opt.type.number" showname="...0 0000 = Number: End of Option List (EOL) (0)" size="1" pos="86" show="0" value="0" unmaskedvalue="00"/>
        </field>
      </field>
    </field>
  </proto>
</packet>


<packet>
  <proto name="geninfo" pos="0" showname="General information" size="64">
    <field name="num" pos="0" show="2" showname="Number" value="2" size="64"/>
    <field name="len" pos="0" show="64" showname="Frame Length" value="40" size="64"/>
    <field name="caplen" pos="0" show="64" showname="Captured Length" value="40" size="64"/>
    <field name="timestamp" pos="0" show="Apr 15, 2013 13:55:23.852558000 PDT" showname="Captured Time" value="1366059323.852558000" size="64"/>
  </proto>
  <proto name="frame" showname="Frame 2: 64 bytes on wire (512 bits), 64 bytes captured (512 bits) on interface 0" size="64" pos="0">
    <field name="frame.interface_id" showname="Interface id: 0" size="0" pos="0" show="0"/>
    <field name="frame.dlt" showname="WTAP_ENCAP: 15" size="0" pos="0" show="15"/>
    <field name="frame.time" showname="Arrival Time: Apr 15, 2013 13:55:23.852558000 PDT" size="0" pos="0" show="Apr 15, 2013 13:55:23.852558000"/>
    <field name="frame.offset_shift" showname="Time shift for this packet: 0.000000000 seconds" size="0" pos="0" show="0.000000000"/>
    <field name="frame.time_epoch" showname="Epoch Time: 1366059323.852558000 seconds" size="0" pos="0" show="1366059323.852558000"/>
    <field name="frame.time_delta" showname="Time delta from previous captured frame: 0.000030000 seconds" size="0" pos="0" show="0.000030000"/>
    <field name="frame.time_delta_displayed" showname="Time delta from previous displayed frame: 0.000030000 seconds" size="0" pos="0" show="0.000030000"/>
    <field name="frame.time_relative" showname="Time since reference or first frame: 0.000030000 seconds" size="0" pos="0" show="0.000030000"/>
    <field name="frame.number" showname="Frame Number: 2" size="0" pos="0" show="2"/>
    <field name="frame.len" showname="Frame Length: 64 bytes (512 bits)" size="0" pos="0" show="64"/>
    <field name="frame.cap_len" showname="Capture Length: 64 bytes (512 bits)" size="0" pos="0" show="64"/>
    <field name="frame.marked" showname="Frame is marked: False" size="0" pos="0" show="0"/>
    <field name="frame.ignored" showname="Frame is ignored: False" size="0" pos="0" show="0"/>
    <field name="frame.protocols" showname="Protocols in frame: null:ipv6:tcp" size="0" pos="0" show="null:ipv6:tcp"/>
  </proto>
  <proto name="null" showname="Null/Loopback" size="4" pos="0">
    <field name="null.family" showname="Family: IPv6 (30)" size="4" pos="0" show="30" value="1e000000"/>
  </proto>
  <proto name="ipv6" showname="Internet Protocol Version 6, Src: ::1 (::1), Dst: ::1 (::1)" size="40" pos="4">
    <field name="ipv6.version" showname="0110 .... = Version: 6" size="1" pos="4" show="6" value="6" unmaskedvalue="60">
      <field name="ip.version" showname="0110 .... = This field makes the filter &quot;ip.version == 6&quot; possible: 6" size="1" pos="4" show="6" value="6" unmaskedvalue="60"/>
    </field>
    <field name="ipv6.class" showname=".... 0000 0000 .... .... .... .... .... = Traffic class: 0x00000000" size="4" pos="4" show="0x00000000" value="0" unmaskedvalue="60000000">
      <field name="ipv6.traffic_class.dscp" showname=".... 0000 00.. .... .... .... .... .... = Differentiated Services Field: Default (0x00000000)" size="4" pos="4" show="0x00000000" value="0" unmaskedvalue="60000000"/>
      <field name="ipv6.traffic_class.ect" showname=".... .... ..0. .... .... .... .... .... = ECN-Capable Transport (ECT): Not set" size="4" pos="4" show="0" value="0" unmaskedvalue="60000000"/>
      <field name="ipv6.traffic_class.ce" showname=".... .... ...0 .... .... .... .... .... = ECN-CE: Not set" size="4" pos="4" show="0" value="0" unmaskedvalue="60000000"/>
    </field>
    <field name="ipv6.flow" showname=".... .... .... 0000 0000 0000 0000 0000 = Flowlabel: 0x00000000" size="4" pos="4" show="0x00000000" value="0" unmaskedvalue="60000000"/>
    <field name="ipv6.plen" showname="Payload length: 20" size="2" pos="8" show="20" value="0014"/>
    <field name="ipv6.nxt" showname="Next header: TCP (6)" size="1" pos="10" show="6" value="06"/>
    <field name="ipv6.hlim" showname="Hop limit: 64" size="1" pos="11" show="64" value="40"/>
    <field name="ipv6.src" showname="Source: ::1 (::1)" size="16" pos="12" show="::1" value="00000000000000000000000000000001"/>
    <field name="ipv6.addr" showname="Source or Destination Address: ::1 (::1)" hide="yes" size="16" pos="12" show="::1" value="00000000000000000000000000000001"/>
    <field name="ipv6.src_host" showname="Source Host: ::1" hide="yes" size="16" pos="12" show="::1" value="00000000000000000000000000000001"/>
    <field name="ipv6.host" showname="Source or Destination Host: ::1" hide="yes" size="16" pos="12" show="::1" value="00000000000000000000000000000001"/>
    <field name="ipv6.dst" showname="Destination: ::1 (::1)" size="16" pos="28" show="::1" value="00000000000000000000000000000001"/>
    <field name="ipv6.addr" showname="Source or Destination Address: ::1 (::1)" hide="yes" size="16" pos="28" show="::1" value="00000000000000000000000000000001"/>
    <field name="ipv6.dst_host" showname="Destination Host: ::1" hide="yes" size="16" pos="28" show="::1" value="00000000000000000000000000000001"/>
    <field name="ipv6.host" showname="Source or Destination Host: ::1" hide="yes" size="16" pos="28" show="::1" value="00000000000000000000000000000001"/>
    <field name="" show="Source GeoIP: Unknown" size="16" pos="12" value="00000000000000000000000000000001"/>
    <field name="" show="Destination GeoIP: Unknown" size="16" pos="28" value="00000000000000000000000000000001"/>
  </proto>
  <proto name="tcp" showname="Transmission Control Protocol, Src Port: irdmi (8000), Dst Port: 51153 (51153), Seq: 1, Ack: 1, Len: 0" size="20" pos="44">
    <field name="tcp.srcport" showname="Source port: irdmi (8000)" size="2" pos="44" show="8000" value="1f40"/>
    <field name="tcp.dstport" showname="Destination port: 51153 (51153)" size="2" pos="46" show="51153" value="c7d1"/>
    <field name="tcp.port" showname="Source or Destination Port: 8000" hide="yes" size="2" pos="44" show="8000" value="1f40"/>
    <field name="tcp.port" showname="Source or Destination Port: 51153" hide="yes" size="2" pos="46" show="51153" value="c7d1"/>
    <field name="tcp.stream" showname="Stream index: 0" size="0" pos="44" show="0"/>
    <field name="tcp.len" showname="TCP Segment Len: 0" hide="yes" size="1" pos="56" show="0" value="50"/>
    <field name="tcp.seq" showname="Sequence number: 1    (relative sequence number)" size="4" pos="48" show="1" value="00000000"/>
    <field name="tcp.ack" showname="Acknowledgment number: 1    (relative ack number)" size="4" pos="52" show="1" value="7074cf74"/>
    <field name="tcp.hdr_len" showname="Header length: 20 bytes" size="1" pos="56" show="20" value="50"/>
    <field name="tcp.flags" showname="Flags: 0x014 (RST, ACK)" size="2" pos="56" show="0x0014" value="14" unmaskedvalue="5014">
      <field name="tcp.flags.res" showname="000. .... .... = Reserved: Not set" size="1" pos="56" show="0" value="0" unmaskedvalue="50"/>
      <field name="tcp.flags.ns" showname="...0 .... .... = Nonce: Not set" size="1" pos="56" show="0" value="0" unmaskedvalue="50"/>
      <field name="tcp.flags.cwr" showname=".... 0... .... = Congestion Window Reduced (CWR): Not set" size="1" pos="57" show="0" value="0" unmaskedvalue="14"/>
      <field name="tcp.flags.ecn" showname=".... .0.. .... = ECN-Echo: Not set" size="1" pos="57" show="0" value="0" unmaskedvalue="14"/>
      <field name="tcp.flags.urg" showname=".... ..0. .... = Urgent: Not set" size="1" pos="57" show="0" value="0" unmaskedvalue="14"/>
      <field name="tcp.flags.ack" showname=".... ...1 .... = Acknowledgment: Set" size="1" pos="57" show="1" value="1" unmaskedvalue="14"/>
      <field name="tcp.flags.push" showname=".... .... 0... = Push: Not set" size="1" pos="57" show="0" value="0" unmaskedvalue="14"/>
      <field name="tcp.flags.reset" showname=".... .... .1.. = Reset: Set" size="1" pos="57" show="1" value="1" unmaskedvalue="14">
        <field name="expert" showname="Expert Info (Chat/Sequence): Connection reset (RST)" size="0" pos="57">
          <field name="expert.message" showname="Message: Connection reset (RST)" size="0" pos="0" show="Connection reset (RST)"/>
          <field name="expert.severity" showname="Severity level: Chat" size="0" pos="0" show="0x00200000"/>
          <field name="expert.group" showname="Group: Sequence" size="0" pos="0" show="0x02000000"/>
        </field>
      </field>
      <field name="tcp.flags.syn" showname=".... .... ..0. = Syn: Not set" size="1" pos="57" show="0" value="0" unmaskedvalue="14"/>
      <field name="tcp.flags.fin" showname=".... .... ...0 = Fin: Not set" size="1" pos="57" show="0" value="0" unmaskedvalue="14"/>
    </field>
    <field name="tcp.window_size_value" showname="Window size value: 0" size="2" pos="58" show="0" value="0000"/>
    <field name="tcp.window_size" showname="Calculated window size: 0" size="2" pos="58" show="0" value="0000"/>
    <field name="tcp.window_size_scalefactor" showname="Window size scaling factor: -1 (unknown)" size="2" pos="58" show="-1" value="0000"/>
    <field name="tcp.checksum" showname="Checksum: 0x001c [validation disabled]" size="2" pos="60" show="0x001c" value="001c">
      <field name="tcp.checksum_good" showname="Good Checksum: False" size="2" pos="60" show="0" value="001c"/>
      <field name="tcp.checksum_bad" showname="Bad Checksum: False" size="2" pos="60" show="0" value="001c"/>
    </field>
    <field name="tcp.analysis" showname="SEQ/ACK analysis" size="0" pos="44" show="" value="">
      <field name="tcp.analysis.acks_frame" showname="This is an ACK to the segment in frame: 1" size="0" pos="44" show="1"/>
      <field name="tcp.analysis.ack_rtt" showname="The RTT to ACK the segment was: 0.000030000 seconds" size="0" pos="44" show="0.000030000"/>
    </field>
  </proto>
</packet>


<packet>
  <proto name="geninfo" pos="0" showname="General information" size="88">
    <field name="num" pos="0" show="3" showname="Number" value="3" size="88"/>
    <field name="len" pos="0" show="88" showname="Frame Length" value="58" size="88"/>
    <field name="caplen" pos="0" show="88" showname="Captured Length" value="58" size="88"/>
    <field name="timestamp" pos="0" show="Apr 15, 2013 13:55:23.852678000 PDT" showname="Captured Time" value="1366059323.852678000" size="88"/>
  </proto>
  <proto name="frame" showname="Frame 3: 88 bytes on wire (704 bits), 88 bytes captured (704 bits) on interface 0" size="88" pos="0">
    <field name="frame.interface_id" showname="Interface id: 0" size="0" pos="0" show="0"/>
    <field name="frame.dlt" showname="WTAP_ENCAP: 15" size="0" pos="0" show="15"/>
    <field name="frame.time" showname="Arrival Time: Apr 15, 2013 13:55:23.852678000 PDT" size="0" pos="0" show="Apr 15, 2013 13:55:23.852678000"/>
    <field name="frame.offset_shift" showname="Time shift for this packet: 0.000000000 seconds" size="0" pos="0" show="0.000000000"/>
    <field name="frame.time_epoch" showname="Epoch Time: 1366059323.852678000 seconds" size="0" pos="0" show="1366059323.852678000"/>
    <field name="frame.time_delta" showname="Time delta from previous captured frame: 0.000120000 seconds" size="0" pos="0" show="0.000120000"/>
    <field name="frame.time_delta_displayed" showname="Time delta from previous displayed frame: 0.000120000 seconds" size="0" pos="0" show="0.000120000"/>
    <field name="frame.time_relative" showname="Time since reference or first frame: 0.000150000 seconds" size="0" pos="0" show="0.000150000"/>
    <field name="frame.number" showname="Frame Number: 3" size="0" pos="0" show="3"/>
    <field name="frame.len" showname="Frame Length: 88 bytes (704 bits)" size="0" pos="0" show="88"/>
    <field name="frame.cap_len" showname="Capture Length: 88 bytes (704 bits)" size="0" pos="0" show="88"/>
    <field name="frame.marked" showname="Frame is marked: False" size="0" pos="0" show="0"/>
    <field name="frame.ignored" showname="Frame is ignored: False" size="0" pos="0" show="0"/>
    <field name="frame.protocols" showname="Protocols in frame: null:ipv6:tcp" size="0" pos="0" show="null:ipv6:tcp"/>
  </proto>
  <proto name="null" showname="Null/Loopback" size="4" pos="0">
    <field name="null.family" showname="Family: IPv6 (30)" size="4" pos="0" show="30" value="1e000000"/>
  </proto>
  <proto name="ipv6" showname="Internet Protocol Version 6, Src: ::1 (::1), Dst: ::1 (::1)" size="40" pos="4">
    <field name="ipv6.version" showname="0110 .... = Version: 6" size="1" pos="4" show="6" value="6" unmaskedvalue="60">
      <field name="ip.version" showname="0110 .... = This field makes the filter &quot;ip.version == 6&quot; possible: 6" size="1" pos="4" show="6" value="6" unmaskedvalue="60"/>
    </field>
    <field name="ipv6.class" showname=".... 0000 0000 .... .... .... .... .... = Traffic class: 0x00000000" size="4" pos="4" show="0x00000000" value="0" unmaskedvalue="60000000">
      <field name="ipv6.traffic_class.dscp" showname=".... 0000 00.. .... .... .... .... .... = Differentiated Services Field: Default (0x00000000)" size="4" pos="4" show="0x00000000" value="0" unmaskedvalue="60000000"/>
      <field name="ipv6.traffic_class.ect" showname=".... .... ..0. .... .... .... .... .... = ECN-Capable Transport (ECT): Not set" size="4" pos="4" show="0" value="0" unmaskedvalue="60000000"/>
      <field name="ipv6.traffic_class.ce" showname=".... .... ...0 .... .... .... .... .... = ECN-CE: Not set" size="4" pos="4" show="0" value="0" unmaskedvalue="60000000"/>
    </field>
    <field name="ipv6.flow" showname=".... .... .... 0000 0000 0000 0000 0000 = Flowlabel: 0x00000000" size="4" pos="4" show="0x00000000" value="0" unmaskedvalue="60000000"/>
    <field name="ipv6.plen" showname="Payload length: 44" size="2" pos="8" show="44" value="002c"/>
    <field name="ipv6.nxt" showname="Next header: TCP (6)" size="1" pos="10" show="6" value="06"/>
    <field name="ipv6.hlim" showname="Hop limit: 64" size="1" pos="11" show="64" value="40"/>
    <field name="ipv6.src" showname="Source: ::1 (::1)" size="16" pos="12" show="::1" value="00000000000000000000000000000001"/>
    <field name="ipv6.addr" showname="Source or Destination Address: ::1 (::1)" hide="yes" size="16" pos="12" show="::1" value="00000000000000000000000000000001"/>
    <field name="ipv6.src_host" showname="Source Host: ::1" hide="yes" size="16" pos="12" show="::1" value="00000000000000000000000000000001"/>
    <field name="ipv6.host" showname="Source or Destination Host: ::1" hide="yes" size="16" pos="12" show="::1" value="00000000000000000000000000000001"/>
    <field name="ipv6.dst" showname="Destination: ::1 (::1)" size="16" pos="28" show="::1" value="00000000000000000000000000000001"/>
    <field name="ipv6.addr" showname="Source or Destination Address: ::1 (::1)" hide="yes" size="16" pos="28" show="::1" value="00000000000000000000000000000001"/>
    <field name="ipv6.dst_host" showname="Destination Host: ::1" hide="yes" size="16" pos="28" show="::1" value="00000000000000000000000000000001"/>
    <field name="ipv6.host" showname="Source or Destination Host: ::1" hide="yes" size="16" pos="28" show="::1" value="00000000000000000000000000000001"/>
    <field name="" show="Source GeoIP: Unknown" size="16" pos="12" value="00000000000000000000000000000001"/>
    <field name="" show="Destination GeoIP: Unknown" size="16" pos="28" value="00000000000000000000000000000001"/>
  </proto>
  <proto name="tcp" showname="Transmission Control Protocol, Src Port: 51154 (51154), Dst Port: irdmi (8000), Seq: 0, Len: 0" size="44" pos="44">
    <field name="tcp.srcport" showname="Source port: 51154 (51154)" size="2" pos="44" show="51154" value="c7d2"/>
    <field name="tcp.dstport" showname="Destination port: irdmi (8000)" size="2" pos="46" show="8000" value="1f40"/>
    <field name="tcp.port" showname="Source or Destination Port: 51154" hide="yes" size="2" pos="44" show="51154" value="c7d2"/>
    <field name="tcp.port" showname="Source or Destination Port: 8000" hide="yes" size="2" pos="46" show="8000" value="1f40"/>
    <field name="tcp.stream" showname="Stream index: 1" size="0" pos="44" show="1"/>
    <field name="tcp.len" showname="TCP Segment Len: 0" hide="yes" size="1" pos="56" show="0" value="b0"/>
    <field name="tcp.seq" showname="Sequence number: 0    (relative sequence number)" size="4" pos="48" show="0" value="aee1cc56"/>
    <field name="tcp.hdr_len" showname="Header length: 44 bytes" size="1" pos="56" show="44" value="b0"/>
    <field name="tcp.flags" showname="Flags: 0x002 (SYN)" size="2" pos="56" show="0x0002" value="2" unmaskedvalue="b002">
      <field name="tcp.flags.res" showname="000. .... .... = Reserved: Not set" size="1" pos="56" show="0" value="0" unmaskedvalue="b0"/>
      <field name="tcp.flags.ns" showname="...0 .... .... = Nonce: Not set" size="1" pos="56" show="0" value="0" unmaskedvalue="b0"/>
      <field name="tcp.flags.cwr" showname=".... 0... .... = Congestion Window Reduced (CWR): Not set" size="1" pos="57" show="0" value="0" unmaskedvalue="02"/>
      <field name="tcp.flags.ecn" showname=".... .0.. .... = ECN-Echo: Not set" size="1" pos="57" show="0" value="0" unmaskedvalue="02"/>
      <field name="tcp.flags.urg" showname=".... ..0. .... = Urgent: Not set" size="1" pos="57" show="0" value="0" unmaskedvalue="02"/>
      <field name="tcp.flags.ack" showname=".... ...0 .... = Acknowledgment: Not set" size="1" pos="57" show="0" value="0" unmaskedvalue="02"/>
      <field name="tcp.flags.push" showname=".... .... 0... = Push: Not set" size="1" pos="57" show="0" value="0" unmaskedvalue="02"/>
      <field name="tcp.flags.reset" showname=".... .... .0.. = Reset: Not set" size="1" pos="57" show="0" value="0" unmaskedvalue="02"/>
      <field name="tcp.flags.syn" showname=".... .... ..1. = Syn: Set" size="1" pos="57" show="1" value="1" unmaskedvalue="02">
        <field name="expert" showname="Expert Info (Chat/Sequence): Connection establish request (SYN): server port irdmi" size="0" pos="57">
          <field name="expert.message" showname="Message: Connection establish request (SYN): server port irdmi" size="0" pos="0" show="Connection establish request (SYN): server port irdmi"/>
          <field name="expert.severity" showname="Severity level: Chat" size="0" pos="0" show="0x00200000"/>
          <field name="expert.group" showname="Group: Sequence" size="0" pos="0" show="0x02000000"/>
        </field>
      </field>
      <field name="tcp.flags.fin" showname=".... .... ...0 = Fin: Not set" size="1" pos="57" show="0" value="0" unmaskedvalue="02"/>
    </field>
    <field name="tcp.window_size_value" showname="Window size value: 65535" size="2" pos="58" show="65535" value="ffff"/>
    <field name="tcp.window_size" showname="Calculated window size: 65535" size="2" pos="58" show="65535" value="ffff"/>
    <field name="tcp.checksum" showname="Checksum: 0x0034 [validation disabled]" size="2" pos="60" show="0x0034" value="0034">
      <field name="tcp.checksum_good" showname="Good Checksum: False" size="2" pos="60" show="0" value="0034"/>
      <field name="tcp.checksum_bad" showname="Bad Checksum: False" size="2" pos="60" show="0" value="0034"/>
    </field>
    <field name="tcp.options" showname="Options: (24 bytes), Maximum segment size, No-Operation (NOP), Window scale, No-Operation (NOP), No-Operation (NOP), Timestamps, SACK permitted, End of Option List (EOL)" size="24" pos="64" show="02:04:3f:c4:01:03:03:04:01:01:08:0a:2e:93:cf:ab:00:00:00:00:04:02:00:00" value="02043fc4010303040101080a2e93cfab0000000004020000">
      <field name="tcp.options.mss" showname="Maximum segment size: 16324 bytes" size="4" pos="64" show="" value="">
        <field name="tcp.option_kind" showname="Kind: MSS size (2)" size="1" pos="64" show="2" value="02"/>
        <field name="tcp.option_len" showname="Length: 4" size="1" pos="65" show="4" value="04"/>
        <field name="tcp.options.mss_val" showname="MSS Value: 16324" size="2" pos="66" show="16324" value="3fc4"/>
      </field>
      <field name="" show="No-Operation (NOP)" size="1" pos="68" value="01">
        <field name="ip.opt.type" showname="Type: 1" size="1" pos="68" show="1" value="01">
          <field name="ip.opt.type.copy" showname="0... .... = Copy on fragmentation: No" size="1" pos="68" show="0" value="0" unmaskedvalue="01"/>
          <field name="ip.opt.type.class" showname=".00. .... = Class: Control (0)" size="1" pos="68" show="0" value="0" unmaskedvalue="01"/>
          <field name="ip.opt.type.number" showname="...0 0001 = Number: No-Operation (NOP) (1)" size="1" pos="68" show="1" value="1" unmaskedvalue="01"/>
        </field>
      </field>
      <field name="" show="Window scale: 4 (multiply by 16)" size="3" pos="69" value="030304">
        <field name="tcp.option_kind" showname="Kind: Window Scale (3)" size="1" pos="69" show="3" value="03"/>
        <field name="tcp.option_len" showname="Length: 3" size="1" pos="70" show="3" value="03"/>
        <field name="tcp.options.wscale.shift" showname="Shift count: 4" size="1" pos="71" show="4" value="04"/>
        <field name="tcp.options.wscale.multiplier" showname="Multiplier: 16" size="1" pos="71" show="16" value="04"/>
      </field>
      <field name="" show="No-Operation (NOP)" size="1" pos="72" value="01">
        <field name="ip.opt.type" showname="Type: 1" size="1" pos="72" show="1" value="01">
          <field name="ip.opt.type.copy" showname="0... .... = Copy on fragmentation: No" size="1" pos="72" show="0" value="0" unmaskedvalue="01"/>
          <field name="ip.opt.type.class" showname=".00. .... = Class: Control (0)" size="1" pos="72" show="0" value="0" unmaskedvalue="01"/>
          <field name="ip.opt.type.number" showname="...0 0001 = Number: No-Operation (NOP) (1)" size="1" pos="72" show="1" value="1" unmaskedvalue="01"/>
        </field>
      </field>
      <field name="" show="No-Operation (NOP)" size="1" pos="73" value="01">
        <field name="ip.opt.type" showname="Type: 1" size="1" pos="73" show="1" value="01">
          <field name="ip.opt.type.copy" showname="0... .... = Copy on fragmentation: No" size="1" pos="73" show="0" value="0" unmaskedvalue="01"/>
          <field name="ip.opt.type.class" showname=".00. .... = Class: Control (0)" size="1" pos="73" show="0" value="0" unmaskedvalue="01"/>
          <field name="ip.opt.type.number" showname="...0 0001 = Number: No-Operation (NOP) (1)" size="1" pos="73" show="1" value="1" unmaskedvalue="01"/>
        </field>
      </field>
      <field name="" show="Timestamps: TSval 781438891, TSecr 0" size="10" pos="74" value="080a2e93cfab00000000">
        <field name="tcp.option_kind" showname="Kind: Timestamp (8)" size="1" pos="74" show="8" value="08"/>
        <field name="tcp.option_len" showname="Length: 10" size="1" pos="75" show="10" value="0a"/>
        <field name="tcp.options.timestamp.tsval" showname="Timestamp value: 781438891" size="4" pos="76" show="781438891" value="2e93cfab"/>
        <field name="tcp.options.timestamp.tsecr" showname="Timestamp echo reply: 0" size="4" pos="80" show="0" value="00000000"/>
      </field>
      <field name="tcp.options.sack_perm" showname="TCP SACK Permitted Option: True" size="2" pos="84" show="1" value="0402">
        <field name="tcp.option_kind" showname="Kind: SACK Permission (4)" size="1" pos="84" show="4" value="04"/>
        <field name="tcp.option_len" showname="Length: 2" size="1" pos="85" show="2" value="02"/>
      </field>
      <field name="" show="End of Option List (EOL)" size="1" pos="86" value="00">
        <field name="ip.opt.type" showname="Type: 0" size="1" pos="86" show="0" value="00">
          <field name="ip.opt.type.copy" showname="0... .... = Copy on fragmentation: No" size="1" pos="86" show="0" value="0" unmaskedvalue="00"/>
          <field name="ip.opt.type.class" showname=".00. .... = Class: Control (0)" size="1" pos="86" show="0" value="0" unmaskedvalue="00"/>
          <field name="ip.opt.type.number" showname="...0 0000 = Number: End of Option List (EOL) (0)" size="1" pos="86" show="0" value="0" unmaskedvalue="00"/>
        </field>
      </field>
    </field>
  </proto>
</packet>


<packet>
  <proto name="geninfo" pos="0" showname="General information" size="64">
    <field name="num" pos="0" show="4" showname="Number" value="4" size="64"/>
    <field name="len" pos="0" show="64" showname="Frame Length" value="40" size="64"/>
    <field name="caplen" pos="0" show="64" showname="Captured Length" value="40" size="64"/>
    <field name="timestamp" pos="0" show="Apr 15, 2013 13:55:23.852696000 PDT" showname="Captured Time" value="1366059323.852696000" size="64"/>
  </proto>
  <proto name="frame" showname="Frame 4: 64 bytes on wire (512 bits), 64 bytes captured (512 bits) on interface 0" size="64" pos="0">
    <field name="frame.interface_id" showname="Interface id: 0" size="0" pos="0" show="0"/>
    <field name="frame.dlt" showname="WTAP_ENCAP: 15" size="0" pos="0" show="15"/>
    <field name="frame.time" showname="Arrival Time: Apr 15, 2013 13:55:23.852696000 PDT" size="0" pos="0" show="Apr 15, 2013 13:55:23.852696000"/>
    <field name="frame.offset_shift" showname="Time shift for this packet: 0.000000000 seconds" size="0" pos="0" show="0.000000000"/>
