<?xml version="1.0"?>
<pdml version="0" creator="wireshark/1.4.3">
<packet>
  <proto name="geninfo" pos="0" showname="General information" size="88">
    <field name="num" pos="0" show="1" showname="Number" value="1" size="88"/>
    <field name="len" pos="0" show="88" showname="Frame Length" value="58" size="88"/>
    <field name="caplen" pos="0" show="88" showname="Captured Length" value="58" size="88"/>
    <field name="timestamp" pos="0" show="Jan  7, 2013 15:57:36.273585000 PST" showname="Captured Time" value="1357603056.273585000" size="88"/>
  </proto>
  <proto name="frame" showname="Frame 1: 88 bytes on wire (704 bits), 88 bytes captured (704 bits)" size="88" pos="0">
    <field name="frame.time" showname="Arrival Time: Jan  7, 2013 15:57:36.273585000 PST" size="0" pos="0" show="Jan  7, 2013 15:57:36.273585000"/>
    <field name="frame.time_epoch" showname="Epoch Time: 1357603056.273585000 seconds" size="0" pos="0" show="1357603056.273585000"/>
    <field name="frame.time_delta" showname="Time delta from previous captured frame: 0.000000000 seconds" size="0" pos="0" show="0.000000000"/>
    <field name="frame.time_delta_displayed" showname="Time delta from previous displayed frame: 0.000000000 seconds" size="0" pos="0" show="0.000000000"/>
    <field name="frame.time_relative" showname="Time since reference or first frame: 0.000000000 seconds" size="0" pos="0" show="0.000000000"/>
    <field name="frame.number" showname="Frame Number: 1" size="0" pos="0" show="1"/>
    <field name="frame.len" showname="Frame Length: 88 bytes (704 bits)" size="0" pos="0" show="88"/>
    <field name="frame.cap_len" showname="Capture Length: 88 bytes (704 bits)" size="0" pos="0" show="88"/>
    <field name="frame.marked" showname="Frame is marked: False" size="0" pos="0" show="0"/>
    <field name="frame.ignored" showname="Frame is ignored: False" size="0" pos="0" show="0"/>
    <field name="frame.protocols" showname="Protocols in frame: null:ipv6:tcp" size="0" pos="0" show="null:ipv6:tcp"/>
  </proto>
  <proto name="null" showname="Null/Loopback" size="4" pos="0">
    <field name="null.family" showname="Family: IPv6 (30)" size="4" pos="0" show="30" value="1e000000"/>
  </proto>
  <proto name="ipv6" showname="Internet Protocol Version 6, Src: ::1 (::1), Dst: ::1 (::1)" size="40" pos="4">
    <field name="ipv6.version" showname="0110 .... = Version: 6" size="1" pos="4" show="6" value="6" unmaskedvalue="60">
      <field name="ip.version" showname="0110 .... = This field makes the filter &quot;ip.version == 6&quot; possible: 6" size="1" pos="4" show="6" value="6" unmaskedvalue="60"/>
    </field>
    <field name="ipv6.class" showname=".... 0000 0000 .... .... .... .... .... = Traffic class: 0x00000000" size="4" pos="4" show="0x00000000" value="0" unmaskedvalue="60000000">
      <field name="ipv6.traffic_class.dscp" showname=".... 0000 00.. .... .... .... .... .... = Differentiated Services Field: Default (0x00000000)" size="4" pos="4" show="0x00000000" value="0" unmaskedvalue="60000000"/>
      <field name="ipv6.traffic_class.ect" showname=".... .... ..0. .... .... .... .... .... = ECN-Capable Transport (ECT): Not set" size="4" pos="4" show="0" value="0" unmaskedvalue="60000000"/>
      <field name="ipv6.traffic_class.ce" showname=".... .... ...0 .... .... .... .... .... = ECN-CE: Not set" size="4" pos="4" show="0" value="0" unmaskedvalue="60000000"/>
    </field>
    <field name="ipv6.flow" showname=".... .... .... 0000 0000 0000 0000 0000 = Flowlabel: 0x00000000" size="4" pos="4" show="0x00000000" value="0" unmaskedvalue="60000000"/>
    <field name="ipv6.plen" showname="Payload length: 44" size="2" pos="8" show="44" value="002c"/>
    <field name="ipv6.nxt" showname="Next header: TCP (0x06)" size="1" pos="10" show="0x06" value="06"/>
    <field name="ipv6.hlim" showname="Hop limit: 64" size="1" pos="11" show="64" value="40"/>
    <field name="ipv6.src" showname="Source: ::1 (::1)" size="16" pos="12" show="::1" value="00000000000000000000000000000001"/>
    <field name="ipv6.addr" showname="Address: ::1 (::1)" hide="yes" size="16" pos="12" show="::1" value="00000000000000000000000000000001"/>
    <field name="ipv6.src_host" showname="Source Host: ::1" hide="yes" size="16" pos="12" show="::1" value="00000000000000000000000000000001"/>
    <field name="ipv6.host" showname="Host: ::1" hide="yes" size="16" pos="12" show="::1" value="00000000000000000000000000000001"/>
    <field name="ipv6.dst" showname="Destination: ::1 (::1)" size="16" pos="28" show="::1" value="00000000000000000000000000000001"/>
    <field name="ipv6.addr" showname="Address: ::1 (::1)" hide="yes" size="16" pos="28" show="::1" value="00000000000000000000000000000001"/>
    <field name="ipv6.dst_host" showname="Destination Host: ::1" hide="yes" size="16" pos="28" show="::1" value="00000000000000000000000000000001"/>
    <field name="ipv6.host" showname="Host: ::1" hide="yes" size="16" pos="28" show="::1" value="00000000000000000000000000000001"/>
  </proto>
  <proto name="tcp" showname="Transmission Control Protocol, Src Port: 57320 (57320), Dst Port: afs3-fileserver (7000), Seq: 0, Len: 0" size="44" pos="44">
    <field name="tcp.srcport" showname="Source port: 57320 (57320)" size="2" pos="44" show="57320" value="dfe8"/>
    <field name="tcp.dstport" showname="Destination port: afs3-fileserver (7000)" size="2" pos="46" show="7000" value="1b58"/>
    <field name="tcp.port" showname="Source or Destination Port: 57320" hide="yes" size="2" pos="44" show="57320" value="dfe8"/>
    <field name="tcp.port" showname="Source or Destination Port: 7000" hide="yes" size="2" pos="46" show="7000" value="1b58"/>
    <field name="tcp.stream" showname="Stream index: 0" size="0" pos="44" show="0"/>
    <field name="tcp.len" showname="TCP Segment Len: 0" hide="yes" size="1" pos="56" show="0" value="b0"/>
    <field name="tcp.seq" showname="Sequence number: 0    (relative sequence number)" size="4" pos="48" show="0" value="99a9575d"/>
    <field name="tcp.hdr_len" showname="Header length: 44 bytes" size="1" pos="56" show="44" value="b0"/>
    <field name="tcp.flags" showname="Flags: 0x02 (SYN)" size="2" pos="56" show="0x02" value="b002">
      <field name="tcp.flags.res" showname="000. .... .... = Reserved: Not set" size="1" pos="56" show="0" value="0" unmaskedvalue="b0"/>
      <field name="tcp.flags.ns" showname="...0 .... .... = Nonce: Not set" size="1" pos="56" show="0" value="0" unmaskedvalue="b0"/>
      <field name="tcp.flags.cwr" showname=".... 0... .... = Congestion Window Reduced (CWR): Not set" size="1" pos="57" show="0" value="0" unmaskedvalue="02"/>
      <field name="tcp.flags.ecn" showname=".... .0.. .... = ECN-Echo: Not set" size="1" pos="57" show="0" value="0" unmaskedvalue="02"/>
      <field name="tcp.flags.urg" showname=".... ..0. .... = Urgent: Not set" size="1" pos="57" show="0" value="0" unmaskedvalue="02"/>
      <field name="tcp.flags.ack" showname=".... ...0 .... = Acknowledgement: Not set" size="1" pos="57" show="0" value="0" unmaskedvalue="02"/>
      <field name="tcp.flags.push" showname=".... .... 0... = Push: Not set" size="1" pos="57" show="0" value="0" unmaskedvalue="02"/>
      <field name="tcp.flags.reset" showname=".... .... .0.. = Reset: Not set" size="1" pos="57" show="0" value="0" unmaskedvalue="02"/>
      <field name="tcp.flags.syn" showname=".... .... ..1. = Syn: Set" size="1" pos="57" show="1" value="1" unmaskedvalue="02">
        <proto name="expert" showname="Expert Info (Chat/Sequence): Connection establish request (SYN): server port afs3-fileserver" size="0" pos="0">
          <field name="expert.message" showname="Message: Connection establish request (SYN): server port afs3-fileserver" size="0" pos="0" show="Connection establish request (SYN): server port afs3-fileserver"/>
          <field name="expert.severity" showname="Severity level: Chat" size="0" pos="0" show="Chat"/>
          <field name="expert.group" showname="Group: Sequence" size="0" pos="0" show="Sequence"/>
        </proto>
      </field>
      <field name="tcp.flags.fin" showname=".... .... ...0 = Fin: Not set" size="1" pos="57" show="0" value="0" unmaskedvalue="02"/>
    </field>
    <field name="tcp.window_size" showname="Window size: 65535" size="2" pos="58" show="65535" value="ffff"/>
    <field name="tcp.checksum" showname="Checksum: 0x0034 [validation disabled]" size="2" pos="60" show="0x0034" value="0034">
      <field name="tcp.checksum_good" showname="Good Checksum: False" size="2" pos="60" show="0" value="0034"/>
      <field name="tcp.checksum_bad" showname="Bad Checksum: False" size="2" pos="60" show="0" value="0034"/>
    </field>
    <field name="tcp.options" showname="Options: (24 bytes)" size="24" pos="64" show="02:04:3f:c4:01:03:03:04:01:01:08:0a:11:4c:ea:90:00:00:00:00:04:02:00:00" value="02043fc4010303040101080a114cea900000000004020000">
      <field name="tcp.options.mss" showname="TCP MSS Option: True" hide="yes" size="4" pos="64" show="1" value="02043fc4"/>
      <field name="tcp.options.mss_val" showname="Maximum segment size: 16324 bytes" size="4" pos="64" show="16324" value="02043fc4"/>
      <field name="" show="NOP" size="1" pos="68" value="01"/>
      <field name="tcp.options.wscale" showname="TCP Window Scale Option: True" hide="yes" size="3" pos="69" show="1" value="030304"/>
      <field name="tcp.options.wscale_val" showname="Window scale: 4 (multiply by 16)" size="3" pos="69" show="4" value="030304"/>
      <field name="" show="NOP" size="1" pos="72" value="01"/>
      <field name="" show="NOP" size="1" pos="73" value="01"/>
      <field name="tcp.options.time_stamp" showname="TCP Time Stamp Option: True" hide="yes" size="10" pos="74" show="1" value="080a114cea9000000000"/>
      <field name="" show="Timestamps: TSval 290253456, TSecr 0" size="10" pos="74" value="080a114cea9000000000"/>
      <field name="tcp.options.sack_perm" showname="TCP SACK Permitted Option: True" size="2" pos="84" show="1" value="0402"/>
      <field name="" show="EOL" size="1" pos="86" value="00"/>
    </field>
  </proto>
</packet>


<packet>
  <proto name="geninfo" pos="0" showname="General information" size="64">
    <field name="num" pos="0" show="2" showname="Number" value="2" size="64"/>
    <field name="len" pos="0" show="64" showname="Frame Length" value="40" size="64"/>
    <field name="caplen" pos="0" show="64" showname="Captured Length" value="40" size="64"/>
    <field name="timestamp" pos="0" show="Jan  7, 2013 15:57:36.273616000 PST" showname="Captured Time" value="1357603056.273616000" size="64"/>
  </proto>
  <proto name="frame" showname="Frame 2: 64 bytes on wire (512 bits), 64 bytes captured (512 bits)" size="64" pos="0">
    <field name="frame.time" showname="Arrival Time: Jan  7, 2013 15:57:36.273616000 PST" size="0" pos="0" show="Jan  7, 2013 15:57:36.273616000"/>
    <field name="frame.time_epoch" showname="Epoch Time: 1357603056.273616000 seconds" size="0" pos="0" show="1357603056.273616000"/>
    <field name="frame.time_delta" showname="Time delta from previous captured frame: 0.000031000 seconds" size="0" pos="0" show="0.000031000"/>
    <field name="frame.time_delta_displayed" showname="Time delta from previous displayed frame: 0.000031000 seconds" size="0" pos="0" show="0.000031000"/>
    <field name="frame.time_relative" showname="Time since reference or first frame: 0.000031000 seconds" size="0" pos="0" show="0.000031000"/>
    <field name="frame.number" showname="Frame Number: 2" size="0" pos="0" show="2"/>
    <field name="frame.len" showname="Frame Length: 64 bytes (512 bits)" size="0" pos="0" show="64"/>
    <field name="frame.cap_len" showname="Capture Length: 64 bytes (512 bits)" size="0" pos="0" show="64"/>
    <field name="frame.marked" showname="Frame is marked: False" size="0" pos="0" show="0"/>
    <field name="frame.ignored" showname="Frame is ignored: False" size="0" pos="0" show="0"/>
    <field name="frame.protocols" showname="Protocols in frame: null:ipv6:tcp" size="0" pos="0" show="null:ipv6:tcp"/>
  </proto>
  <proto name="null" showname="Null/Loopback" size="4" pos="0">
    <field name="null.family" showname="Family: IPv6 (30)" size="4" pos="0" show="30" value="1e000000"/>
  </proto>
  <proto name="ipv6" showname="Internet Protocol Version 6, Src: ::1 (::1), Dst: ::1 (::1)" size="40" pos="4">
    <field name="ipv6.version" showname="0110 .... = Version: 6" size="1" pos="4" show="6" value="6" unmaskedvalue="60">
      <field name="ip.version" showname="0110 .... = This field makes the filter &quot;ip.version == 6&quot; possible: 6" size="1" pos="4" show="6" value="6" unmaskedvalue="60"/>
    </field>
    <field name="ipv6.class" showname=".... 0000 0000 .... .... .... .... .... = Traffic class: 0x00000000" size="4" pos="4" show="0x00000000" value="0" unmaskedvalue="60000000">
      <field name="ipv6.traffic_class.dscp" showname=".... 0000 00.. .... .... .... .... .... = Differentiated Services Field: Default (0x00000000)" size="4" pos="4" show="0x00000000" value="0" unmaskedvalue="60000000"/>
      <field name="ipv6.traffic_class.ect" showname=".... .... ..0. .... .... .... .... .... = ECN-Capable Transport (ECT): Not set" size="4" pos="4" show="0" value="0" unmaskedvalue="60000000"/>
      <field name="ipv6.traffic_class.ce" showname=".... .... ...0 .... .... .... .... .... = ECN-CE: Not set" size="4" pos="4" show="0" value="0" unmaskedvalue="60000000"/>
    </field>
    <field name="ipv6.flow" showname=".... .... .... 0000 0000 0000 0000 0000 = Flowlabel: 0x00000000" size="4" pos="4" show="0x00000000" value="0" unmaskedvalue="60000000"/>
    <field name="ipv6.plen" showname="Payload length: 20" size="2" pos="8" show="20" value="0014"/>
    <field name="ipv6.nxt" showname="Next header: TCP (0x06)" size="1" pos="10" show="0x06" value="06"/>
    <field name="ipv6.hlim" showname="Hop limit: 64" size="1" pos="11" show="64" value="40"/>
    <field name="ipv6.src" showname="Source: ::1 (::1)" size="16" pos="12" show="::1" value="00000000000000000000000000000001"/>
    <field name="ipv6.addr" showname="Address: ::1 (::1)" hide="yes" size="16" pos="12" show="::1" value="00000000000000000000000000000001"/>
    <field name="ipv6.src_host" showname="Source Host: ::1" hide="yes" size="16" pos="12" show="::1" value="00000000000000000000000000000001"/>
    <field name="ipv6.host" showname="Host: ::1" hide="yes" size="16" pos="12" show="::1" value="00000000000000000000000000000001"/>
    <field name="ipv6.dst" showname="Destination: ::1 (::1)" size="16" pos="28" show="::1" value="00000000000000000000000000000001"/>
    <field name="ipv6.addr" showname="Address: ::1 (::1)" hide="yes" size="16" pos="28" show="::1" value="00000000000000000000000000000001"/>
    <field name="ipv6.dst_host" showname="Destination Host: ::1" hide="yes" size="16" pos="28" show="::1" value="00000000000000000000000000000001"/>
    <field name="ipv6.host" showname="Host: ::1" hide="yes" size="16" pos="28" show="::1" value="00000000000000000000000000000001"/>
  </proto>
  <proto name="tcp" showname="Transmission Control Protocol, Src Port: afs3-fileserver (7000), Dst Port: 57320 (57320), Seq: 1, Ack: 1, Len: 0" size="20" pos="44">
    <field name="tcp.srcport" showname="Source port: afs3-fileserver (7000)" size="2" pos="44" show="7000" value="1b58"/>
    <field name="tcp.dstport" showname="Destination port: 57320 (57320)" size="2" pos="46" show="57320" value="dfe8"/>
    <field name="tcp.port" showname="Source or Destination Port: 7000" hide="yes" size="2" pos="44" show="7000" value="1b58"/>
    <field name="tcp.port" showname="Source or Destination Port: 57320" hide="yes" size="2" pos="46" show="57320" value="dfe8"/>
    <field name="tcp.stream" showname="Stream index: 0" size="0" pos="44" show="0"/>
    <field name="tcp.len" showname="TCP Segment Len: 0" hide="yes" size="1" pos="56" show="0" value="50"/>
    <field name="tcp.seq" showname="Sequence number: 1    (relative sequence number)" size="4" pos="48" show="1" value="00000000"/>
    <field name="tcp.ack" showname="Acknowledgement number: 1    (relative ack number)" size="4" pos="52" show="1" value="99a9575e"/>
    <field name="tcp.hdr_len" showname="Header length: 20 bytes" size="1" pos="56" show="20" value="50"/>
    <field name="tcp.flags" showname="Flags: 0x14 (RST, ACK)" size="2" pos="56" show="0x14" value="5014">
      <field name="tcp.flags.res" showname="000. .... .... = Reserved: Not set" size="1" pos="56" show="0" value="0" unmaskedvalue="50"/>
      <field name="tcp.flags.ns" showname="...0 .... .... = Nonce: Not set" size="1" pos="56" show="0" value="0" unmaskedvalue="50"/>
      <field name="tcp.flags.cwr" showname=".... 0... .... = Congestion Window Reduced (CWR): Not set" size="1" pos="57" show="0" value="0" unmaskedvalue="14"/>
      <field name="tcp.flags.ecn" showname=".... .0.. .... = ECN-Echo: Not set" size="1" pos="57" show="0" value="0" unmaskedvalue="14"/>
      <field name="tcp.flags.urg" showname=".... ..0. .... = Urgent: Not set" size="1" pos="57" show="0" value="0" unmaskedvalue="14"/>
      <field name="tcp.flags.ack" showname=".... ...1 .... = Acknowledgement: Set" size="1" pos="57" show="1" value="1" unmaskedvalue="14"/>
      <field name="tcp.flags.push" showname=".... .... 0... = Push: Not set" size="1" pos="57" show="0" value="0" unmaskedvalue="14"/>
      <field name="tcp.flags.reset" showname=".... .... .1.. = Reset: Set" size="1" pos="57" show="1" value="1" unmaskedvalue="14">
        <proto name="expert" showname="Expert Info (Chat/Sequence): Connection reset (RST)" size="0" pos="0">
          <field name="expert.message" showname="Message: Connection reset (RST)" size="0" pos="0" show="Connection reset (RST)"/>
          <field name="expert.severity" showname="Severity level: Chat" size="0" pos="0" show="Chat"/>
          <field name="expert.group" showname="Group: Sequence" size="0" pos="0" show="Sequence"/>
        </proto>
      </field>
      <field name="tcp.flags.syn" showname=".... .... ..0. = Syn: Not set" size="1" pos="57" show="0" value="0" unmaskedvalue="14"/>
      <field name="tcp.flags.fin" showname=".... .... ...0 = Fin: Not set" size="1" pos="57" show="0" value="0" unmaskedvalue="14"/>
    </field>
    <field name="tcp.window_size" showname="Window size: 0" size="2" pos="58" show="0" value="0000"/>
    <field name="tcp.checksum" showname="Checksum: 0x001c [validation disabled]" size="2" pos="60" show="0x001c" value="001c">
      <field name="tcp.checksum_good" showname="Good Checksum: False" size="2" pos="60" show="0" value="001c"/>
      <field name="tcp.checksum_bad" showname="Bad Checksum: False" size="2" pos="60" show="0" value="001c"/>
    </field>
    <field name="" show="SEQ/ACK analysis" size="0" pos="44" value="">
      <field name="tcp.analysis.acks_frame" showname="This is an ACK to the segment in frame: 1" size="0" pos="44" show="1"/>
      <field name="tcp.analysis.ack_rtt" showname="The RTT to ACK the segment was: 0.000031000 seconds" size="0" pos="44" show="0.000031000"/>
    </field>
  </proto>
</packet>


<packet>
  <proto name="geninfo" pos="0" showname="General information" size="68">
    <field name="num" pos="0" show="3" showname="Number" value="3" size="68"/>
    <field name="len" pos="0" show="68" showname="Frame Length" value="44" size="68"/>
    <field name="caplen" pos="0" show="68" showname="Captured Length" value="44" size="68"/>
    <field name="timestamp" pos="0" show="Jan  7, 2013 15:57:36.273664000 PST" showname="Captured Time" value="1357603056.273664000" size="68"/>
  </proto>
  <proto name="frame" showname="Frame 3: 68 bytes on wire (544 bits), 68 bytes captured (544 bits)" size="68" pos="0">
    <field name="frame.time" showname="Arrival Time: Jan  7, 2013 15:57:36.273664000 PST" size="0" pos="0" show="Jan  7, 2013 15:57:36.273664000"/>
    <field name="frame.time_epoch" showname="Epoch Time: 1357603056.273664000 seconds" size="0" pos="0" show="1357603056.273664000"/>
    <field name="frame.time_delta" showname="Time delta from previous captured frame: 0.000048000 seconds" size="0" pos="0" show="0.000048000"/>
    <field name="frame.time_delta_displayed" showname="Time delta from previous displayed frame: 0.000048000 seconds" size="0" pos="0" show="0.000048000"/>
    <field name="frame.time_relative" showname="Time since reference or first frame: 0.000079000 seconds" size="0" pos="0" show="0.000079000"/>
    <field name="frame.number" showname="Frame Number: 3" size="0" pos="0" show="3"/>
    <field name="frame.len" showname="Frame Length: 68 bytes (544 bits)" size="0" pos="0" show="68"/>
    <field name="frame.cap_len" showname="Capture Length: 68 bytes (544 bits)" size="0" pos="0" show="68"/>
    <field name="frame.marked" showname="Frame is marked: False" size="0" pos="0" show="0"/>
    <field name="frame.ignored" showname="Frame is ignored: False" size="0" pos="0" show="0"/>
    <field name="frame.protocols" showname="Protocols in frame: null:ip:tcp" size="0" pos="0" show="null:ip:tcp"/>
  </proto>
  <proto name="null" showname="Null/Loopback" size="4" pos="0">
    <field name="null.family" showname="Family: IP (2)" size="4" pos="0" show="2" value="02000000"/>
  </proto>
  <proto name="ip" showname="Internet Protocol, Src: 127.0.0.1 (127.0.0.1), Dst: 127.0.0.1 (127.0.0.1)" size="20" pos="4">
    <field name="ip.version" showname="Version: 4" size="1" pos="4" show="4" value="45"/>
    <field name="ip.hdr_len" showname="Header length: 20 bytes" size="1" pos="4" show="20" value="45"/>
    <field name="ip.dsfield" showname="Differentiated Services Field: 0x00 (DSCP 0x00: Default; ECN: 0x00)" size="1" pos="5" show="0" value="00">
      <field name="ip.dsfield.dscp" showname="0000 00.. = Differentiated Services Codepoint: Default (0x00)" size="1" pos="5" show="0x00" value="0" unmaskedvalue="00"/>
      <field name="ip.dsfield.ect" showname=".... ..0. = ECN-Capable Transport (ECT): 0" size="1" pos="5" show="0" value="0" unmaskedvalue="00"/>
      <field name="ip.dsfield.ce" showname=".... ...0 = ECN-CE: 0" size="1" pos="5" show="0" value="0" unmaskedvalue="00"/>
    </field>
    <field name="ip.len" showname="Total Length: 64" size="2" pos="6" show="64" value="0040"/>
    <field name="ip.id" showname="Identification: 0x3de8 (15848)" size="2" pos="8" show="0x3de8" value="3de8"/>
    <field name="ip.flags" showname="Flags: 0x02 (Don&apos;t Fragment)" size="1" pos="10" show="0x02" value="40">
      <field name="ip.flags.rb" showname="0... .... = Reserved bit: Not set" size="1" pos="10" show="0" value="40"/>
      <field name="ip.flags.df" showname=".1.. .... = Don&apos;t fragment: Set" size="1" pos="10" show="1" value="40"/>
      <field name="ip.flags.mf" showname="..0. .... = More fragments: Not set" size="1" pos="10" show="0" value="40"/>
    </field>
    <field name="ip.frag_offset" showname="Fragment offset: 0" size="2" pos="10" show="0" value="4000"/>
    <field name="ip.ttl" showname="Time to live: 64" size="1" pos="12" show="64" value="40"/>
    <field name="ip.proto" showname="Protocol: TCP (6)" size="1" pos="13" show="6" value="06"/>
    <field name="ip.checksum" showname="Header checksum: 0x0000 [incorrect, should be 0xfecd]" size="2" pos="14" show="0x0000" value="0000">
      <field name="ip.checksum_good" showname="Good: False" size="2" pos="14" show="0" value="0000"/>
      <field name="ip.checksum_bad" showname="Bad: True" size="2" pos="14" show="1" value="0000">
        <proto name="expert" showname="Expert Info (Error/Checksum): Bad checksum" size="0" pos="0">
          <field name="expert.message" showname="Message: Bad checksum" size="0" pos="0" show="Bad checksum"/>
          <field name="expert.severity" showname="Severity level: Error" size="0" pos="0" show="Error"/>
          <field name="expert.group" showname="Group: Checksum" size="0" pos="0" show="Checksum"/>
        </proto>
      </field>
    </field>
    <field name="ip.src" showname="Source: 127.0.0.1 (127.0.0.1)" size="4" pos="16" show="127.0.0.1" value="7f000001"/>
    <field name="ip.addr" showname="Source or Destination Address: 127.0.0.1 (127.0.0.1)" hide="yes" size="4" pos="16" show="127.0.0.1" value="7f000001"/>
    <field name="ip.src_host" showname="Source Host: 127.0.0.1" hide="yes" size="4" pos="16" show="127.0.0.1" value="7f000001"/>
    <field name="ip.host" showname="Source or Destination Host: 127.0.0.1" hide="yes" size="4" pos="16" show="127.0.0.1" value="7f000001"/>
    <field name="ip.dst" showname="Destination: 127.0.0.1 (127.0.0.1)" size="4" pos="20" show="127.0.0.1" value="7f000001"/>
    <field name="ip.addr" showname="Source or Destination Address: 127.0.0.1 (127.0.0.1)" hide="yes" size="4" pos="20" show="127.0.0.1" value="7f000001"/>
    <field name="ip.dst_host" showname="Destination Host: 127.0.0.1" hide="yes" size="4" pos="20" show="127.0.0.1" value="7f000001"/>
    <field name="ip.host" showname="Source or Destination Host: 127.0.0.1" hide="yes" size="4" pos="20" show="127.0.0.1" value="7f000001"/>
  </proto>
  <proto name="tcp" showname="Transmission Control Protocol, Src Port: 57321 (57321), Dst Port: afs3-fileserver (7000), Seq: 0, Len: 0" size="44" pos="24">
    <field name="tcp.srcport" showname="Source port: 57321 (57321)" size="2" pos="24" show="57321" value="dfe9"/>
    <field name="tcp.dstport" showname="Destination port: afs3-fileserver (7000)" size="2" pos="26" show="7000" value="1b58"/>
    <field name="tcp.port" showname="Source or Destination Port: 57321" hide="yes" size="2" pos="24" show="57321" value="dfe9"/>
    <field name="tcp.port" showname="Source or Destination Port: 7000" hide="yes" size="2" pos="26" show="7000" value="1b58"/>
    <field name="tcp.stream" showname="Stream index: 1" size="0" pos="24" show="1"/>
    <field name="tcp.len" showname="TCP Segment Len: 0" hide="yes" size="1" pos="36" show="0" value="b0"/>
    <field name="tcp.seq" showname="Sequence number: 0    (relative sequence number)" size="4" pos="28" show="0" value="1c85239e"/>
    <field name="tcp.hdr_len" showname="Header length: 44 bytes" size="1" pos="36" show="44" value="b0"/>
    <field name="tcp.flags" showname="Flags: 0x02 (SYN)" size="2" pos="36" show="0x02" value="b002">
      <field name="tcp.flags.res" showname="000. .... .... = Reserved: Not set" size="1" pos="36" show="0" value="0" unmaskedvalue="b0"/>
      <field name="tcp.flags.ns" showname="...0 .... .... = Nonce: Not set" size="1" pos="36" show="0" value="0" unmaskedvalue="b0"/>
      <field name="tcp.flags.cwr" showname=".... 0... .... = Congestion Window Reduced (CWR): Not set" size="1" pos="37" show="0" value="0" unmaskedvalue="02"/>
      <field name="tcp.flags.ecn" showname=".... .0.. .... = ECN-Echo: Not set" size="1" pos="37" show="0" value="0" unmaskedvalue="02"/>
      <field name="tcp.flags.urg" showname=".... ..0. .... = Urgent: Not set" size="1" pos="37" show="0" value="0" unmaskedvalue="02"/>
      <field name="tcp.flags.ack" showname=".... ...0 .... = Acknowledgement: Not set" size="1" pos="37" show="0" value="0" unmaskedvalue="02"/>
      <field name="tcp.flags.push" showname=".... .... 0... = Push: Not set" size="1" pos="37" show="0" value="0" unmaskedvalue="02"/>
      <field name="tcp.flags.reset" showname=".... .... .0.. = Reset: Not set" size="1" pos="37" show="0" value="0" unmaskedvalue="02"/>
      <field name="tcp.flags.syn" showname=".... .... ..1. = Syn: Set" size="1" pos="37" show="1" value="1" unmaskedvalue="02">
        <proto name="expert" showname="Expert Info (Chat/Sequence): Connection establish request (SYN): server port afs3-fileserver" size="0" pos="0">
          <field name="expert.message" showname="Message: Connection establish request (SYN): server port afs3-fileserver" size="0" pos="0" show="Connection establish request (SYN): server port afs3-fileserver"/>
          <field name="expert.severity" showname="Severity level: Chat" size="0" pos="0" show="Chat"/>
          <field name="expert.group" showname="Group: Sequence" size="0" pos="0" show="Sequence"/>
        </proto>
      </field>
      <field name="tcp.flags.fin" showname=".... .... ...0 = Fin: Not set" size="1" pos="37" show="0" value="0" unmaskedvalue="02"/>
    </field>
    <field name="tcp.window_size" showname="Window size: 65535" size="2" pos="38" show="65535" value="ffff"/>
    <field name="tcp.checksum" showname="Checksum: 0xfe34 [validation disabled]" size="2" pos="40" show="0xfe34" value="fe34">
      <field name="tcp.checksum_good" showname="Good Checksum: False" size="2" pos="40" show="0" value="fe34"/>
      <field name="tcp.checksum_bad" showname="Bad Checksum: False" size="2" pos="40" show="0" value="fe34"/>
    </field>
    <field name="tcp.options" showname="Options: (24 bytes)" size="24" pos="44" show="02:04:3f:d8:01:03:03:04:01:01:08:0a:11:4c:ea:90:00:00:00:00:04:02:00:00" value="02043fd8010303040101080a114cea900000000004020000">
      <field name="tcp.options.mss" showname="TCP MSS Option: True" hide="yes" size="4" pos="44" show="1" value="02043fd8"/>
      <field name="tcp.options.mss_val" showname="Maximum segment size: 16344 bytes" size="4" pos="44" show="16344" value="02043fd8"/>
      <field name="" show="NOP" size="1" pos="48" value="01"/>
      <field name="tcp.options.wscale" showname="TCP Window Scale Option: True" hide="yes" size="3" pos="49" show="1" value="030304"/>
      <field name="tcp.options.wscale_val" showname="Window scale: 4 (multiply by 16)" size="3" pos="49" show="4" value="030304"/>
      <field name="" show="NOP" size="1" pos="52" value="01"/>
      <field name="" show="NOP" size="1" pos="53" value="01"/>
      <field name="tcp.options.time_stamp" showname="TCP Time Stamp Option: True" hide="yes" size="10" pos="54" show="1" value="080a114cea9000000000"/>
      <field name="" show="Timestamps: TSval 290253456, TSecr 0" size="10" pos="54" value="080a114cea9000000000"/>
      <field name="tcp.options.sack_perm" showname="TCP SACK Permitted Option: True" size="2" pos="64" show="1" value="0402"/>
      <field name="" show="EOL" size="1" pos="66" value="00"/>
    </field>
  </proto>
</packet>


<packet>
  <proto name="geninfo" pos="0" showname="General information" size="68">
    <field name="num" pos="0" show="4" showname="Number" value="4" size="68"/>
    <field name="len" pos="0" show="68" showname="Frame Length" value="44" size="68"/>
    <field name="caplen" pos="0" show="68" showname="Captured Length" value="44" size="68"/>
    <field name="timestamp" pos="0" show="Jan  7, 2013 15:57:36.273718000 PST" showname="Captured Time" value="1357603056.273718000" size="68"/>
  </proto>
  <proto name="frame" showname="Frame 4: 68 bytes on wire (544 bits), 68 bytes captured (544 bits)" size="68" pos="0">
    <field name="frame.time" showname="Arrival Time: Jan  7, 2013 15:57:36.273718000 PST" size="0" pos="0" show="Jan  7, 2013 15:57:36.273718000"/>
    <field name="frame.time_epoch" showname="Epoch Time: 1357603056.273718000 seconds" size="0" pos="0" show="1357603056.273718000"/>
    <field name="frame.time_delta" showname="Time delta from previous captured frame: 0.000054000 seconds" size="0" pos="0" show="0.000054000"/>
    <field name="frame.time_delta_displayed" showname="Time delta from previous displayed frame: 0.000054000 seconds" size="0" pos="0" show="0.000054000"/>
    <field name="frame.time_relative" showname="Time since reference or first frame: 0.000133000 seconds" size="0" pos="0" show="0.000133000"/>
    <field name="frame.number" showname="Frame Number: 4" size="0" pos="0" show="4"/>
    <field name="frame.len" showname="Frame Length: 68 bytes (544 bits)" size="0" pos="0" show="68"/>
    <field name="frame.cap_len" showname="Capture Length: 68 bytes (544 bits)" size="0" pos="0" show="68"/>
    <field name="frame.marked" showname="Frame is marked: False" size="0" pos="0" show="0"/>
    <field name="frame.ignored" showname="Frame is ignored: False" size="0" pos="0" show="0"/>
    <field name="frame.protocols" showname="Protocols in frame: null:ip:tcp" size="0" pos="0" show="null:ip:tcp"/>
  </proto>
  <proto name="null" showname="Null/Loopback" size="4" pos="0">
    <field name="null.family" showname="Family: IP (2)" size="4" pos="0" show="2" value="02000000"/>
  </proto>
  <proto name="ip" showname="Internet Protocol, Src: 127.0.0.1 (127.0.0.1), Dst: 127.0.0.1 (127.0.0.1)" size="20" pos="4">
    <field name="ip.version" showname="Version: 4" size="1" pos="4" show="4" value="45"/>
    <field name="ip.hdr_len" showname="Header length: 20 bytes" size="1" pos="4" show="20" value="45"/>
    <field name="ip.dsfield" showname="Differentiated Services Field: 0x00 (DSCP 0x00: Default; ECN: 0x00)" size="1" pos="5" show="0" value="00">
      <field name="ip.dsfield.dscp" showname="0000 00.. = Differentiated Services Codepoint: Default (0x00)" size="1" pos="5" show="0x00" value="0" unmaskedvalue="00"/>
      <field name="ip.dsfield.ect" showname=".... ..0. = ECN-Capable Transport (ECT): 0" size="1" pos="5" show="0" value="0" unmaskedvalue="00"/>
      <field name="ip.dsfield.ce" showname=".... ...0 = ECN-CE: 0" size="1" pos="5" show="0" value="0" unmaskedvalue="00"/>
    </field>
    <field name="ip.len" showname="Total Length: 64" size="2" pos="6" show="64" value="0040"/>
    <field name="ip.id" showname="Identification: 0x7985 (31109)" size="2" pos="8" show="0x7985" value="7985"/>
    <field name="ip.flags" showname="Flags: 0x02 (Don&apos;t Fragment)" size="1" pos="10" show="0x02" value="40">
      <field name="ip.flags.rb" showname="0... .... = Reserved bit: Not set" size="1" pos="10" show="0" value="40"/>
      <field name="ip.flags.df" showname=".1.. .... = Don&apos;t fragment: Set" size="1" pos="10" show="1" value="40"/>
      <field name="ip.flags.mf" showname="..0. .... = More fragments: Not set" size="1" pos="10" show="0" value="40"/>
    </field>
    <field name="ip.frag_offset" showname="Fragment offset: 0" size="2" pos="10" show="0" value="4000"/>
    <field name="ip.ttl" showname="Time to live: 64" size="1" pos="12" show="64" value="40"/>
    <field name="ip.proto" showname="Protocol: TCP (6)" size="1" pos="13" show="6" value="06"/>
    <field name="ip.checksum" showname="Header checksum: 0x0000 [incorrect, should be 0xc330]" size="2" pos="14" show="0x0000" value="0000">
      <field name="ip.checksum_good" showname="Good: False" size="2" pos="14" show="0" value="0000"/>
      <field name="ip.checksum_bad" showname="Bad: True" size="2" pos="14" show="1" value="0000">
        <proto name="expert" showname="Expert Info (Error/Checksum): Bad checksum" size="0" pos="0">
          <field name="expert.message" showname="Message: Bad checksum" size="0" pos="0" show="Bad checksum"/>
          <field name="expert.severity" showname="Severity level: Error" size="0" pos="0" show="Error"/>
          <field name="expert.group" showname="Group: Checksum" size="0" pos="0" show="Checksum"/>
        </proto>
      </field>
    </field>
    <field name="ip.src" showname="Source: 127.0.0.1 (127.0.0.1)" size="4" pos="16" show="127.0.0.1" value="7f000001"/>
    <field name="ip.addr" showname="Source or Destination Address: 127.0.0.1 (127.0.0.1)" hide="yes" size="4" pos="16" show="127.0.0.1" value="7f000001"/>
    <field name="ip.src_host" showname="Source Host: 127.0.0.1" hide="yes" size="4" pos="16" show="127.0.0.1" value="7f000001"/>
    <field name="ip.host" showname="Source or Destination Host: 127.0.0.1" hide="yes" size="4" pos="16" show="127.0.0.1" value="7f000001"/>
    <field name="ip.dst" showname="Destination: 127.0.0.1 (127.0.0.1)" size="4" pos="20" show="127.0.0.1" value="7f000001"/>
    <field name="ip.addr" showname="Source or Destination Address: 127.0.0.1 (127.0.0.1)" hide="yes" size="4" pos="20" show="127.0.0.1" value="7f000001"/>
    <field name="ip.dst_host" showname="Destination Host: 127.0.0.1" hide="yes" size="4" pos="20" show="127.0.0.1" value="7f000001"/>
    <field name="ip.host" showname="Source or Destination Host: 127.0.0.1" hide="yes" size="4" pos="20" show="127.0.0.1" value="7f000001"/>
  </proto>
  <proto name="tcp" showname="Transmission Control Protocol, Src Port: afs3-fileserver (7000), Dst Port: 57321 (57321), Seq: 0, Ack: 1, Len: 0" size="44" pos="24">
    <field name="tcp.srcport" showname="Source port: afs3-fileserver (7000)" size="2" pos="24" show="7000" value="1b58"/>
    <field name="tcp.dstport" showname="Destination port: 57321 (57321)" size="2" pos="26" show="57321" value="dfe9"/>
    <field name="tcp.port" showname="Source or Destination Port: 7000" hide="yes" size="2" pos="24" show="7000" value="1b58"/>
    <field name="tcp.port" showname="Source or Destination Port: 57321" hide="yes" size="2" pos="26" show="57321" value="dfe9"/>
    <field name="tcp.stream" showname="Stream index: 1" size="0" pos="24" show="1"/>
    <field name="tcp.len" showname="TCP Segment Len: 0" hide="yes" size="1" pos="36" show="0" value="b0"/>
    <field name="tcp.seq" showname="Sequence number: 0    (relative sequence number)" size="4" pos="28" show="0" value="174cd72b"/>
    <field name="tcp.ack" showname="Acknowledgement number: 1    (relative ack number)" size="4" pos="32" show="1" value="1c85239f"/>
    <field name="tcp.hdr_len" showname="Header length: 44 bytes" size="1" pos="36" show="44" value="b0"/>
    <field name="tcp.flags" showname="Flags: 0x12 (SYN, ACK)" size="2" pos="36" show="0x12" value="b012">
      <field name="tcp.flags.res" showname="000. .... .... = Reserved: Not set" size="1" pos="36" show="0" value="0" unmaskedvalue="b0"/>
      <field name="tcp.flags.ns" showname="...0 .... .... = Nonce: Not set" size="1" pos="36" show="0" value="0" unmaskedvalue="b0"/>
      <field name="tcp.flags.cwr" showname=".... 0... .... = Congestion Window Reduced (CWR): Not set" size="1" pos="37" show="0" value="0" unmaskedvalue="12"/>
      <field name="tcp.flags.ecn" showname=".... .0.. .... = ECN-Echo: Not set" size="1" pos="37" show="0" value="0" unmaskedvalue="12"/>
      <field name="tcp.flags.urg" showname=".... ..0. .... = Urgent: Not set" size="1" pos="37" show="0" value="0" unmaskedvalue="12"/>
      <field name="tcp.flags.ack" showname=".... ...1 .... = Acknowledgement: Set" size="1" pos="37" show="1" value="1" unmaskedvalue="12"/>
      <field name="tcp.flags.push" showname=".... .... 0... = Push: Not set" size="1" pos="37" show="0" value="0" unmaskedvalue="12"/>
      <field name="tcp.flags.reset" showname=".... .... .0.. = Reset: Not set" size="1" pos="37" show="0" value="0" unmaskedvalue="12"/>
      <field name="tcp.flags.syn" showname=".... .... ..1. = Syn: Set" size="1" pos="37" show="1" value="1" unmaskedvalue="12">
        <proto name="expert" showname="Expert Info (Chat/Sequence): Connection establish acknowledge (SYN+ACK): server port afs3-fileserver" size="0" pos="0">
          <field name="expert.message" showname="Message: Connection establish acknowledge (SYN+ACK): server port afs3-fileserver" size="0" pos="0" show="Connection establish acknowledge (SYN+ACK): server port afs3-fileserver"/>
          <field name="expert.severity" showname="Severity level: Chat" size="0" pos="0" show="Chat"/>
          <field name="expert.group" showname="Group: Sequence" size="0" pos="0" show="Sequence"/>
        </proto>
      </field>
      <field name="tcp.flags.fin" showname=".... .... ...0 = Fin: Not set" size="1" pos="37" show="0" value="0" unmaskedvalue="12"/>
    </field>
    <field name="tcp.window_size" showname="Window size: 65535" size="2" pos="38" show="65535" value="ffff"/>
    <field name="tcp.checksum" showname="Checksum: 0xfe34 [validation disabled]" size="2" pos="40" show="0xfe34" value="fe34">
      <field name="tcp.checksum_good" showname="Good Checksum: False" size="2" pos="40" show="0" value="fe34"/>
      <field name="tcp.checksum_bad" showname="Bad Checksum: False" size="2" pos="40" show="0" value="fe34"/>
    </field>
