<?xml version="1.0"?>
<?xml-stylesheet type="text/xsl" href="pdml2html.xsl"?>
<!-- You can find pdml2html.xsl in C:\Program Files\Wireshark or at http://anonsvn.wireshark.org/trunk/wireshark/pdml2html.xsl. -->
<pdml version="0" creator="wireshark/1.8.4" time="Mon Apr 29 14:59:21 2013" capture_file="verifyClientSSL.pcap">
<packet>
  <proto name="geninfo" pos="0" showname="General information" size="66">
    <field name="num" pos="0" show="1" showname="Number" value="1" size="66"/>
    <field name="len" pos="0" show="66" showname="Frame Length" value="42" size="66"/>
    <field name="caplen" pos="0" show="66" showname="Captured Length" value="42" size="66"/>
    <field name="timestamp" pos="0" show="Apr 25, 2013 14:39:28.632219000 Pacific Daylight Time" showname="Captured Time" value="1366925968.632219000" size="66"/>
  </proto>
  <proto name="frame" showname="Frame 1: 66 bytes on wire (528 bits), 66 bytes captured (528 bits)" size="66" pos="0">
    <field name="frame.dlt" showname="WTAP_ENCAP: 1" size="0" pos="0" show="1"/>
    <field name="frame.time" showname="Arrival Time: Apr 25, 2013 14:39:28.632219000 Pacific Daylight Time" size="0" pos="0" show="Apr 25, 2013 14:39:28.632219000"/>
    <field name="frame.offset_shift" showname="Time shift for this packet: 0.000000000 seconds" size="0" pos="0" show="0.000000000"/>
    <field name="frame.time_epoch" showname="Epoch Time: 1366925968.632219000 seconds" size="0" pos="0" show="1366925968.632219000"/>
    <field name="frame.time_delta" showname="Time delta from previous captured frame: 0.000000000 seconds" size="0" pos="0" show="0.000000000"/>
    <field name="frame.time_delta_displayed" showname="Time delta from previous displayed frame: 0.000000000 seconds" size="0" pos="0" show="0.000000000"/>
    <field name="frame.time_relative" showname="Time since reference or first frame: 0.000000000 seconds" size="0" pos="0" show="0.000000000"/>
    <field name="frame.number" showname="Frame Number: 1" size="0" pos="0" show="1"/>
    <field name="frame.len" showname="Frame Length: 66 bytes (528 bits)" size="0" pos="0" show="66"/>
    <field name="frame.cap_len" showname="Capture Length: 66 bytes (528 bits)" size="0" pos="0" show="66"/>
    <field name="frame.marked" showname="Frame is marked: False" size="0" pos="0" show="0"/>
    <field name="frame.ignored" showname="Frame is ignored: False" size="0" pos="0" show="0"/>
    <field name="frame.protocols" showname="Protocols in frame: eth:ip:tcp" size="0" pos="0" show="eth:ip:tcp"/>
  </proto>
  <proto name="eth" showname="Ethernet II, Src: Dell_65:9f:bf (5c:26:0a:65:9f:bf), Dst: Netscreen_ff:20:70 (00:10:db:ff:20:70)" size="14" pos="0">
    <field name="eth.dst" showname="Destination: Netscreen_ff:20:70 (00:10:db:ff:20:70)" size="6" pos="0" show="00:10:db:ff:20:70" value="0010dbff2070">
      <field name="eth.addr" showname="Address: Netscreen_ff:20:70 (00:10:db:ff:20:70)" size="6" pos="0" show="00:10:db:ff:20:70" value="0010dbff2070"/>
      <field name="eth.lg" showname=".... ..0. .... .... .... .... = LG bit: Globally unique address (factory default)" size="3" pos="0" show="0" value="0" unmaskedvalue="0010db"/>
      <field name="eth.ig" showname=".... ...0 .... .... .... .... = IG bit: Individual address (unicast)" size="3" pos="0" show="0" value="0" unmaskedvalue="0010db"/>
    </field>
    <field name="eth.src" showname="Source: Dell_65:9f:bf (5c:26:0a:65:9f:bf)" size="6" pos="6" show="5c:26:0a:65:9f:bf" value="5c260a659fbf">
      <field name="eth.addr" showname="Address: Dell_65:9f:bf (5c:26:0a:65:9f:bf)" size="6" pos="6" show="5c:26:0a:65:9f:bf" value="5c260a659fbf"/>
      <field name="eth.lg" showname=".... ..0. .... .... .... .... = LG bit: Globally unique address (factory default)" size="3" pos="6" show="0" value="0" unmaskedvalue="5c260a"/>
      <field name="eth.ig" showname=".... ...0 .... .... .... .... = IG bit: Individual address (unicast)" size="3" pos="6" show="0" value="0" unmaskedvalue="5c260a"/>
    </field>
    <field name="eth.type" showname="Type: IP (0x0800)" size="2" pos="12" show="0x0800" value="0800"/>
  </proto>
  <proto name="ip" showname="Internet Protocol Version 4, Src: 192.168.4.233 (192.168.4.233), Dst: 192.168.5.21 (192.168.5.21)" size="20" pos="14">
    <field name="ip.version" showname="Version: 4" size="1" pos="14" show="4" value="45"/>
    <field name="ip.hdr_len" showname="Header length: 20 bytes" size="1" pos="14" show="20" value="45"/>
    <field name="ip.dsfield" showname="Differentiated Services Field: 0x00 (DSCP 0x00: Default; ECN: 0x00: Not-ECT (Not ECN-Capable Transport))" size="1" pos="15" show="0" value="00">
      <field name="ip.dsfield.dscp" showname="0000 00.. = Differentiated Services Codepoint: Default (0x00)" size="1" pos="15" show="0x00" value="0" unmaskedvalue="00"/>
      <field name="ip.dsfield.ecn" showname=".... ..00 = Explicit Congestion Notification: Not-ECT (Not ECN-Capable Transport) (0x00)" size="1" pos="15" show="0x00" value="0" unmaskedvalue="00"/>
    </field>
    <field name="ip.len" showname="Total Length: 52" size="2" pos="16" show="52" value="0034"/>
    <field name="ip.id" showname="Identification: 0x68ae (26798)" size="2" pos="18" show="0x68ae" value="68ae"/>
    <field name="ip.flags" showname="Flags: 0x02 (Don&apos;t Fragment)" size="1" pos="20" show="0x02" value="40">
      <field name="ip.flags.rb" showname="0... .... = Reserved bit: Not set" size="1" pos="20" show="0" value="40"/>
      <field name="ip.flags.df" showname=".1.. .... = Don&apos;t fragment: Set" size="1" pos="20" show="1" value="40"/>
      <field name="ip.flags.mf" showname="..0. .... = More fragments: Not set" size="1" pos="20" show="0" value="40"/>
    </field>
    <field name="ip.frag_offset" showname="Fragment offset: 0" size="2" pos="20" show="0" value="4000"/>
    <field name="ip.ttl" showname="Time to live: 128" size="1" pos="22" show="128" value="80"/>
    <field name="ip.proto" showname="Protocol: TCP (6)" size="1" pos="23" show="6" value="06"/>
    <field name="ip.checksum" showname="Header checksum: 0x06c7 [correct]" size="2" pos="24" show="0x06c7" value="06c7">
      <field name="ip.checksum_good" showname="Good: True" size="2" pos="24" show="1" value="06c7"/>
      <field name="ip.checksum_bad" showname="Bad: False" size="2" pos="24" show="0" value="06c7"/>
    </field>
    <field name="ip.src" showname="Source: 192.168.4.233 (192.168.4.233)" size="4" pos="26" show="192.168.4.233" value="c0a804e9"/>
    <field name="ip.addr" showname="Source or Destination Address: 192.168.4.233 (192.168.4.233)" hide="yes" size="4" pos="26" show="192.168.4.233" value="c0a804e9"/>
    <field name="ip.src_host" showname="Source Host: 192.168.4.233" hide="yes" size="4" pos="26" show="192.168.4.233" value="c0a804e9"/>
    <field name="ip.host" showname="Source or Destination Host: 192.168.4.233" hide="yes" size="4" pos="26" show="192.168.4.233" value="c0a804e9"/>
    <field name="ip.dst" showname="Destination: 192.168.5.21 (192.168.5.21)" size="4" pos="30" show="192.168.5.21" value="c0a80515"/>
    <field name="ip.addr" showname="Source or Destination Address: 192.168.5.21 (192.168.5.21)" hide="yes" size="4" pos="30" show="192.168.5.21" value="c0a80515"/>
    <field name="ip.dst_host" showname="Destination Host: 192.168.5.21" hide="yes" size="4" pos="30" show="192.168.5.21" value="c0a80515"/>
    <field name="ip.host" showname="Source or Destination Host: 192.168.5.21" hide="yes" size="4" pos="30" show="192.168.5.21" value="c0a80515"/>
    <field name="" show="Source GeoIP: Unknown" size="4" pos="26" value="c0a804e9"/>
    <field name="" show="Destination GeoIP: Unknown" size="4" pos="30" value="c0a80515"/>
  </proto>
  <proto name="tcp" showname="Transmission Control Protocol, Src Port: 52887 (52887), Dst Port: 9032 (9032), Seq: 0, Len: 0" size="32" pos="34">
    <field name="tcp.srcport" showname="Source port: 52887 (52887)" size="2" pos="34" show="52887" value="ce97"/>
    <field name="tcp.dstport" showname="Destination port: 9032 (9032)" size="2" pos="36" show="9032" value="2348"/>
    <field name="tcp.port" showname="Source or Destination Port: 52887" hide="yes" size="2" pos="34" show="52887" value="ce97"/>
    <field name="tcp.port" showname="Source or Destination Port: 9032" hide="yes" size="2" pos="36" show="9032" value="2348"/>
    <field name="tcp.stream" showname="Stream index: 0" size="0" pos="34" show="0"/>
    <field name="tcp.len" showname="TCP Segment Len: 0" hide="yes" size="1" pos="46" show="0" value="80"/>
    <field name="tcp.seq" showname="Sequence number: 0    (relative sequence number)" size="4" pos="38" show="0" value="682c58a1"/>
    <field name="tcp.hdr_len" showname="Header length: 32 bytes" size="1" pos="46" show="32" value="80"/>
    <field name="tcp.flags" showname="Flags: 0x002 (SYN)" size="2" pos="46" show="0x0002" value="2" unmaskedvalue="8002">
      <field name="tcp.flags.res" showname="000. .... .... = Reserved: Not set" size="1" pos="46" show="0" value="0" unmaskedvalue="80"/>
      <field name="tcp.flags.ns" showname="...0 .... .... = Nonce: Not set" size="1" pos="46" show="0" value="0" unmaskedvalue="80"/>
      <field name="tcp.flags.cwr" showname=".... 0... .... = Congestion Window Reduced (CWR): Not set" size="1" pos="47" show="0" value="0" unmaskedvalue="02"/>
      <field name="tcp.flags.ecn" showname=".... .0.. .... = ECN-Echo: Not set" size="1" pos="47" show="0" value="0" unmaskedvalue="02"/>
      <field name="tcp.flags.urg" showname=".... ..0. .... = Urgent: Not set" size="1" pos="47" show="0" value="0" unmaskedvalue="02"/>
      <field name="tcp.flags.ack" showname=".... ...0 .... = Acknowledgment: Not set" size="1" pos="47" show="0" value="0" unmaskedvalue="02"/>
      <field name="tcp.flags.push" showname=".... .... 0... = Push: Not set" size="1" pos="47" show="0" value="0" unmaskedvalue="02"/>
      <field name="tcp.flags.reset" showname=".... .... .0.. = Reset: Not set" size="1" pos="47" show="0" value="0" unmaskedvalue="02"/>
      <field name="tcp.flags.syn" showname=".... .... ..1. = Syn: Set" size="1" pos="47" show="1" value="1" unmaskedvalue="02">
        <field name="expert" showname="Expert Info (Chat/Sequence): Connection establish request (SYN): server port 9032" size="0" pos="47">
          <field name="expert.message" showname="Message: Connection establish request (SYN): server port 9032" size="0" pos="0" show="Connection establish request (SYN): server port 9032"/>
          <field name="expert.severity" showname="Severity level: Chat" size="0" pos="0" show="Chat"/>
          <field name="expert.group" showname="Group: Sequence" size="0" pos="0" show="Sequence"/>
        </field>
      </field>
      <field name="tcp.flags.fin" showname=".... .... ...0 = Fin: Not set" size="1" pos="47" show="0" value="0" unmaskedvalue="02"/>
    </field>
    <field name="tcp.window_size_value" showname="Window size value: 8192" size="2" pos="48" show="8192" value="2000"/>
    <field name="tcp.window_size" showname="Calculated window size: 8192" size="2" pos="48" show="8192" value="2000"/>
    <field name="tcp.checksum" showname="Checksum: 0x111a [validation disabled]" size="2" pos="50" show="0x111a" value="111a">
      <field name="tcp.checksum_good" showname="Good Checksum: False" size="2" pos="50" show="0" value="111a"/>
      <field name="tcp.checksum_bad" showname="Bad Checksum: False" size="2" pos="50" show="0" value="111a"/>
    </field>
    <field name="tcp.options" showname="Options: (12 bytes), Maximum segment size, No-Operation (NOP), Window scale, No-Operation (NOP), No-Operation (NOP), SACK permitted" size="12" pos="54" show="02:04:05:b4:01:03:03:02:01:01:04:02" value="020405b40103030201010402">
      <field name="tcp.options.mss" showname="Maximum segment size: 1460 bytes" size="4" pos="54" show="" value="">
        <field name="tcp.option_kind" showname="Kind: MSS size (2)" size="1" pos="54" show="2" value="02"/>
        <field name="tcp.option_len" showname="Length: 4" size="1" pos="55" show="4" value="04"/>
        <field name="tcp.options.mss_val" showname="MSS Value: 1460" size="2" pos="56" show="1460" value="05b4"/>
      </field>
      <field name="" show="No-Operation (NOP)" size="1" pos="58" value="01">
        <field name="ip.opt.type" showname="Type: 1" size="1" pos="58" show="1" value="01">
          <field name="ip.opt.type.copy" showname="0... .... = Copy on fragmentation: No" size="1" pos="58" show="0" value="0" unmaskedvalue="01"/>
          <field name="ip.opt.type.class" showname=".00. .... = Class: Control (0)" size="1" pos="58" show="0" value="0" unmaskedvalue="01"/>
          <field name="ip.opt.type.number" showname="...0 0001 = Number: No-Operation (NOP) (1)" size="1" pos="58" show="1" value="1" unmaskedvalue="01"/>
        </field>
      </field>
      <field name="" show="Window scale: 2 (multiply by 4)" size="3" pos="59" value="030302">
        <field name="tcp.option_kind" showname="Kind: Window Scale (3)" size="1" pos="59" show="3" value="03"/>
        <field name="tcp.option_len" showname="Length: 3" size="1" pos="60" show="3" value="03"/>
        <field name="tcp.options.wscale.shift" showname="Shift count: 2" size="1" pos="61" show="2" value="02"/>
        <field name="tcp.options.wscale.multiplier" showname="Multiplier: 4" size="1" pos="61" show="4" value="02"/>
      </field>
      <field name="" show="No-Operation (NOP)" size="1" pos="62" value="01">
        <field name="ip.opt.type" showname="Type: 1" size="1" pos="62" show="1" value="01">
          <field name="ip.opt.type.copy" showname="0... .... = Copy on fragmentation: No" size="1" pos="62" show="0" value="0" unmaskedvalue="01"/>
          <field name="ip.opt.type.class" showname=".00. .... = Class: Control (0)" size="1" pos="62" show="0" value="0" unmaskedvalue="01"/>
          <field name="ip.opt.type.number" showname="...0 0001 = Number: No-Operation (NOP) (1)" size="1" pos="62" show="1" value="1" unmaskedvalue="01"/>
        </field>
      </field>
      <field name="" show="No-Operation (NOP)" size="1" pos="63" value="01">
        <field name="ip.opt.type" showname="Type: 1" size="1" pos="63" show="1" value="01">
          <field name="ip.opt.type.copy" showname="0... .... = Copy on fragmentation: No" size="1" pos="63" show="0" value="0" unmaskedvalue="01"/>
          <field name="ip.opt.type.class" showname=".00. .... = Class: Control (0)" size="1" pos="63" show="0" value="0" unmaskedvalue="01"/>
          <field name="ip.opt.type.number" showname="...0 0001 = Number: No-Operation (NOP) (1)" size="1" pos="63" show="1" value="1" unmaskedvalue="01"/>
        </field>
      </field>
      <field name="tcp.options.sack_perm" showname="TCP SACK Permitted Option: True" size="2" pos="64" show="1" value="0402">
        <field name="tcp.option_kind" showname="Kind: SACK Permission (4)" size="1" pos="64" show="4" value="04"/>
        <field name="tcp.option_len" showname="Length: 2" size="1" pos="65" show="2" value="02"/>
      </field>
    </field>
  </proto>
</packet>


<packet>
  <proto name="geninfo" pos="0" showname="General information" size="66">
    <field name="num" pos="0" show="2" showname="Number" value="2" size="66"/>
    <field name="len" pos="0" show="66" showname="Frame Length" value="42" size="66"/>
    <field name="caplen" pos="0" show="66" showname="Captured Length" value="42" size="66"/>
    <field name="timestamp" pos="0" show="Apr 25, 2013 14:39:28.634284000 Pacific Daylight Time" showname="Captured Time" value="1366925968.634284000" size="66"/>
  </proto>
  <proto name="frame" showname="Frame 2: 66 bytes on wire (528 bits), 66 bytes captured (528 bits)" size="66" pos="0">
    <field name="frame.dlt" showname="WTAP_ENCAP: 1" size="0" pos="0" show="1"/>
    <field name="frame.time" showname="Arrival Time: Apr 25, 2013 14:39:28.634284000 Pacific Daylight Time" size="0" pos="0" show="Apr 25, 2013 14:39:28.634284000"/>
    <field name="frame.offset_shift" showname="Time shift for this packet: 0.000000000 seconds" size="0" pos="0" show="0.000000000"/>
    <field name="frame.time_epoch" showname="Epoch Time: 1366925968.634284000 seconds" size="0" pos="0" show="1366925968.634284000"/>
    <field name="frame.time_delta" showname="Time delta from previous captured frame: 0.002065000 seconds" size="0" pos="0" show="0.002065000"/>
    <field name="frame.time_delta_displayed" showname="Time delta from previous displayed frame: 0.002065000 seconds" size="0" pos="0" show="0.002065000"/>
    <field name="frame.time_relative" showname="Time since reference or first frame: 0.002065000 seconds" size="0" pos="0" show="0.002065000"/>
    <field name="frame.number" showname="Frame Number: 2" size="0" pos="0" show="2"/>
    <field name="frame.len" showname="Frame Length: 66 bytes (528 bits)" size="0" pos="0" show="66"/>
    <field name="frame.cap_len" showname="Capture Length: 66 bytes (528 bits)" size="0" pos="0" show="66"/>
    <field name="frame.marked" showname="Frame is marked: False" size="0" pos="0" show="0"/>
    <field name="frame.ignored" showname="Frame is ignored: False" size="0" pos="0" show="0"/>
    <field name="frame.protocols" showname="Protocols in frame: eth:ip:tcp" size="0" pos="0" show="eth:ip:tcp"/>
  </proto>
  <proto name="eth" showname="Ethernet II, Src: Netscreen_ff:20:70 (00:10:db:ff:20:70), Dst: Dell_65:9f:bf (5c:26:0a:65:9f:bf)" size="14" pos="0">
    <field name="eth.dst" showname="Destination: Dell_65:9f:bf (5c:26:0a:65:9f:bf)" size="6" pos="0" show="5c:26:0a:65:9f:bf" value="5c260a659fbf">
      <field name="eth.addr" showname="Address: Dell_65:9f:bf (5c:26:0a:65:9f:bf)" size="6" pos="0" show="5c:26:0a:65:9f:bf" value="5c260a659fbf"/>
      <field name="eth.lg" showname=".... ..0. .... .... .... .... = LG bit: Globally unique address (factory default)" size="3" pos="0" show="0" value="0" unmaskedvalue="5c260a"/>
      <field name="eth.ig" showname=".... ...0 .... .... .... .... = IG bit: Individual address (unicast)" size="3" pos="0" show="0" value="0" unmaskedvalue="5c260a"/>
    </field>
    <field name="eth.src" showname="Source: Netscreen_ff:20:70 (00:10:db:ff:20:70)" size="6" pos="6" show="00:10:db:ff:20:70" value="0010dbff2070">
      <field name="eth.addr" showname="Address: Netscreen_ff:20:70 (00:10:db:ff:20:70)" size="6" pos="6" show="00:10:db:ff:20:70" value="0010dbff2070"/>
      <field name="eth.lg" showname=".... ..0. .... .... .... .... = LG bit: Globally unique address (factory default)" size="3" pos="6" show="0" value="0" unmaskedvalue="0010db"/>
      <field name="eth.ig" showname=".... ...0 .... .... .... .... = IG bit: Individual address (unicast)" size="3" pos="6" show="0" value="0" unmaskedvalue="0010db"/>
    </field>
    <field name="eth.type" showname="Type: IP (0x0800)" size="2" pos="12" show="0x0800" value="0800"/>
  </proto>
  <proto name="ip" showname="Internet Protocol Version 4, Src: 192.168.5.21 (192.168.5.21), Dst: 192.168.4.233 (192.168.4.233)" size="20" pos="14">
    <field name="ip.version" showname="Version: 4" size="1" pos="14" show="4" value="45"/>
    <field name="ip.hdr_len" showname="Header length: 20 bytes" size="1" pos="14" show="20" value="45"/>
    <field name="ip.dsfield" showname="Differentiated Services Field: 0x00 (DSCP 0x00: Default; ECN: 0x00: Not-ECT (Not ECN-Capable Transport))" size="1" pos="15" show="0" value="00">
      <field name="ip.dsfield.dscp" showname="0000 00.. = Differentiated Services Codepoint: Default (0x00)" size="1" pos="15" show="0x00" value="0" unmaskedvalue="00"/>
      <field name="ip.dsfield.ecn" showname=".... ..00 = Explicit Congestion Notification: Not-ECT (Not ECN-Capable Transport) (0x00)" size="1" pos="15" show="0x00" value="0" unmaskedvalue="00"/>
    </field>
    <field name="ip.len" showname="Total Length: 52" size="2" pos="16" show="52" value="0034"/>
    <field name="ip.id" showname="Identification: 0x0845 (2117)" size="2" pos="18" show="0x0845" value="0845"/>
    <field name="ip.flags" showname="Flags: 0x02 (Don&apos;t Fragment)" size="1" pos="20" show="0x02" value="40">
      <field name="ip.flags.rb" showname="0... .... = Reserved bit: Not set" size="1" pos="20" show="0" value="40"/>
      <field name="ip.flags.df" showname=".1.. .... = Don&apos;t fragment: Set" size="1" pos="20" show="1" value="40"/>
      <field name="ip.flags.mf" showname="..0. .... = More fragments: Not set" size="1" pos="20" show="0" value="40"/>
    </field>
    <field name="ip.frag_offset" showname="Fragment offset: 0" size="2" pos="20" show="0" value="4000"/>
    <field name="ip.ttl" showname="Time to live: 127" size="1" pos="22" show="127" value="7f"/>
    <field name="ip.proto" showname="Protocol: TCP (6)" size="1" pos="23" show="6" value="06"/>
    <field name="ip.checksum" showname="Header checksum: 0x6830 [correct]" size="2" pos="24" show="0x6830" value="6830">
      <field name="ip.checksum_good" showname="Good: True" size="2" pos="24" show="1" value="6830"/>
      <field name="ip.checksum_bad" showname="Bad: False" size="2" pos="24" show="0" value="6830"/>
    </field>
    <field name="ip.src" showname="Source: 192.168.5.21 (192.168.5.21)" size="4" pos="26" show="192.168.5.21" value="c0a80515"/>
    <field name="ip.addr" showname="Source or Destination Address: 192.168.5.21 (192.168.5.21)" hide="yes" size="4" pos="26" show="192.168.5.21" value="c0a80515"/>
    <field name="ip.src_host" showname="Source Host: 192.168.5.21" hide="yes" size="4" pos="26" show="192.168.5.21" value="c0a80515"/>
    <field name="ip.host" showname="Source or Destination Host: 192.168.5.21" hide="yes" size="4" pos="26" show="192.168.5.21" value="c0a80515"/>
    <field name="ip.dst" showname="Destination: 192.168.4.233 (192.168.4.233)" size="4" pos="30" show="192.168.4.233" value="c0a804e9"/>
    <field name="ip.addr" showname="Source or Destination Address: 192.168.4.233 (192.168.4.233)" hide="yes" size="4" pos="30" show="192.168.4.233" value="c0a804e9"/>
    <field name="ip.dst_host" showname="Destination Host: 192.168.4.233" hide="yes" size="4" pos="30" show="192.168.4.233" value="c0a804e9"/>
    <field name="ip.host" showname="Source or Destination Host: 192.168.4.233" hide="yes" size="4" pos="30" show="192.168.4.233" value="c0a804e9"/>
    <field name="" show="Source GeoIP: Unknown" size="4" pos="26" value="c0a80515"/>
    <field name="" show="Destination GeoIP: Unknown" size="4" pos="30" value="c0a804e9"/>
  </proto>
  <proto name="tcp" showname="Transmission Control Protocol, Src Port: 9032 (9032), Dst Port: 52887 (52887), Seq: 0, Ack: 1, Len: 0" size="32" pos="34">
    <field name="tcp.srcport" showname="Source port: 9032 (9032)" size="2" pos="34" show="9032" value="2348"/>
    <field name="tcp.dstport" showname="Destination port: 52887 (52887)" size="2" pos="36" show="52887" value="ce97"/>
    <field name="tcp.port" showname="Source or Destination Port: 9032" hide="yes" size="2" pos="34" show="9032" value="2348"/>
    <field name="tcp.port" showname="Source or Destination Port: 52887" hide="yes" size="2" pos="36" show="52887" value="ce97"/>
    <field name="tcp.stream" showname="Stream index: 0" size="0" pos="34" show="0"/>
    <field name="tcp.len" showname="TCP Segment Len: 0" hide="yes" size="1" pos="46" show="0" value="80"/>
    <field name="tcp.seq" showname="Sequence number: 0    (relative sequence number)" size="4" pos="38" show="0" value="c35b28ac"/>
    <field name="tcp.ack" showname="Acknowledgment number: 1    (relative ack number)" size="4" pos="42" show="1" value="682c58a2"/>
    <field name="tcp.hdr_len" showname="Header length: 32 bytes" size="1" pos="46" show="32" value="80"/>
    <field name="tcp.flags" showname="Flags: 0x012 (SYN, ACK)" size="2" pos="46" show="0x0012" value="12" unmaskedvalue="8012">
      <field name="tcp.flags.res" showname="000. .... .... = Reserved: Not set" size="1" pos="46" show="0" value="0" unmaskedvalue="80"/>
      <field name="tcp.flags.ns" showname="...0 .... .... = Nonce: Not set" size="1" pos="46" show="0" value="0" unmaskedvalue="80"/>
      <field name="tcp.flags.cwr" showname=".... 0... .... = Congestion Window Reduced (CWR): Not set" size="1" pos="47" show="0" value="0" unmaskedvalue="12"/>
      <field name="tcp.flags.ecn" showname=".... .0.. .... = ECN-Echo: Not set" size="1" pos="47" show="0" value="0" unmaskedvalue="12"/>
      <field name="tcp.flags.urg" showname=".... ..0. .... = Urgent: Not set" size="1" pos="47" show="0" value="0" unmaskedvalue="12"/>
      <field name="tcp.flags.ack" showname=".... ...1 .... = Acknowledgment: Set" size="1" pos="47" show="1" value="1" unmaskedvalue="12"/>
      <field name="tcp.flags.push" showname=".... .... 0... = Push: Not set" size="1" pos="47" show="0" value="0" unmaskedvalue="12"/>
      <field name="tcp.flags.reset" showname=".... .... .0.. = Reset: Not set" size="1" pos="47" show="0" value="0" unmaskedvalue="12"/>
      <field name="tcp.flags.syn" showname=".... .... ..1. = Syn: Set" size="1" pos="47" show="1" value="1" unmaskedvalue="12">
        <field name="expert" showname="Expert Info (Chat/Sequence): Connection establish acknowledge (SYN+ACK): server port 9032" size="0" pos="47">
          <field name="expert.message" showname="Message: Connection establish acknowledge (SYN+ACK): server port 9032" size="0" pos="0" show="Connection establish acknowledge (SYN+ACK): server port 9032"/>
          <field name="expert.severity" showname="Severity level: Chat" size="0" pos="0" show="Chat"/>
          <field name="expert.group" showname="Group: Sequence" size="0" pos="0" show="Sequence"/>
        </field>
      </field>
      <field name="tcp.flags.fin" showname=".... .... ...0 = Fin: Not set" size="1" pos="47" show="0" value="0" unmaskedvalue="12"/>
    </field>
    <field name="tcp.window_size_value" showname="Window size value: 8192" size="2" pos="48" show="8192" value="2000"/>
    <field name="tcp.window_size" showname="Calculated window size: 8192" size="2" pos="48" show="8192" value="2000"/>
    <field name="tcp.checksum" showname="Checksum: 0x24fb [validation disabled]" size="2" pos="50" show="0x24fb" value="24fb">
      <field name="tcp.checksum_good" showname="Good Checksum: False" size="2" pos="50" show="0" value="24fb"/>
      <field name="tcp.checksum_bad" showname="Bad Checksum: False" size="2" pos="50" show="0" value="24fb"/>
    </field>
    <field name="tcp.options" showname="Options: (12 bytes), Maximum segment size, No-Operation (NOP), Window scale, No-Operation (NOP), No-Operation (NOP), SACK permitted" size="12" pos="54" show="02:04:05:b4:01:03:03:08:01:01:04:02" value="020405b40103030801010402">
      <field name="tcp.options.mss" showname="Maximum segment size: 1460 bytes" size="4" pos="54" show="" value="">
        <field name="tcp.option_kind" showname="Kind: MSS size (2)" size="1" pos="54" show="2" value="02"/>
        <field name="tcp.option_len" showname="Length: 4" size="1" pos="55" show="4" value="04"/>
        <field name="tcp.options.mss_val" showname="MSS Value: 1460" size="2" pos="56" show="1460" value="05b4"/>
      </field>
      <field name="" show="No-Operation (NOP)" size="1" pos="58" value="01">
        <field name="ip.opt.type" showname="Type: 1" size="1" pos="58" show="1" value="01">
          <field name="ip.opt.type.copy" showname="0... .... = Copy on fragmentation: No" size="1" pos="58" show="0" value="0" unmaskedvalue="01"/>
          <field name="ip.opt.type.class" showname=".00. .... = Class: Control (0)" size="1" pos="58" show="0" value="0" unmaskedvalue="01"/>
          <field name="ip.opt.type.number" showname="...0 0001 = Number: No-Operation (NOP) (1)" size="1" pos="58" show="1" value="1" unmaskedvalue="01"/>
        </field>
      </field>
      <field name="" show="Window scale: 8 (multiply by 256)" size="3" pos="59" value="030308">
        <field name="tcp.option_kind" showname="Kind: Window Scale (3)" size="1" pos="59" show="3" value="03"/>
        <field name="tcp.option_len" showname="Length: 3" size="1" pos="60" show="3" value="03"/>
        <field name="tcp.options.wscale.shift" showname="Shift count: 8" size="1" pos="61" show="8" value="08"/>
        <field name="tcp.options.wscale.multiplier" showname="Multiplier: 256" size="1" pos="61" show="256" value="08"/>
      </field>
      <field name="" show="No-Operation (NOP)" size="1" pos="62" value="01">
        <field name="ip.opt.type" showname="Type: 1" size="1" pos="62" show="1" value="01">
          <field name="ip.opt.type.copy" showname="0... .... = Copy on fragmentation: No" size="1" pos="62" show="0" value="0" unmaskedvalue="01"/>
          <field name="ip.opt.type.class" showname=".00. .... = Class: Control (0)" size="1" pos="62" show="0" value="0" unmaskedvalue="01"/>
          <field name="ip.opt.type.number" showname="...0 0001 = Number: No-Operation (NOP) (1)" size="1" pos="62" show="1" value="1" unmaskedvalue="01"/>
        </field>
      </field>
      <field name="" show="No-Operation (NOP)" size="1" pos="63" value="01">
        <field name="ip.opt.type" showname="Type: 1" size="1" pos="63" show="1" value="01">
          <field name="ip.opt.type.copy" showname="0... .... = Copy on fragmentation: No" size="1" pos="63" show="0" value="0" unmaskedvalue="01"/>
          <field name="ip.opt.type.class" showname=".00. .... = Class: Control (0)" size="1" pos="63" show="0" value="0" unmaskedvalue="01"/>
          <field name="ip.opt.type.number" showname="...0 0001 = Number: No-Operation (NOP) (1)" size="1" pos="63" show="1" value="1" unmaskedvalue="01"/>
        </field>
      </field>
      <field name="tcp.options.sack_perm" showname="TCP SACK Permitted Option: True" size="2" pos="64" show="1" value="0402">
        <field name="tcp.option_kind" showname="Kind: SACK Permission (4)" size="1" pos="64" show="4" value="04"/>
        <field name="tcp.option_len" showname="Length: 2" size="1" pos="65" show="2" value="02"/>
      </field>
    </field>
    <field name="tcp.analysis" showname="SEQ/ACK analysis" size="0" pos="34" show="" value="">
      <field name="tcp.analysis.acks_frame" showname="This is an ACK to the segment in frame: 1" size="0" pos="34" show="1"/>
      <field name="tcp.analysis.ack_rtt" showname="The RTT to ACK the segment was: 0.002065000 seconds" size="0" pos="34" show="0.002065000"/>
    </field>
  </proto>
</packet>


<packet>
  <proto name="geninfo" pos="0" showname="General information" size="54">
    <field name="num" pos="0" show="3" showname="Number" value="3" size="54"/>
    <field name="len" pos="0" show="54" showname="Frame Length" value="36" size="54"/>
    <field name="caplen" pos="0" show="54" showname="Captured Length" value="36" size="54"/>
    <field name="timestamp" pos="0" show="Apr 25, 2013 14:39:28.634374000 Pacific Daylight Time" showname="Captured Time" value="1366925968.634374000" size="54"/>
  </proto>
  <proto name="frame" showname="Frame 3: 54 bytes on wire (432 bits), 54 bytes captured (432 bits)" size="54" pos="0">
    <field name="frame.dlt" showname="WTAP_ENCAP: 1" size="0" pos="0" show="1"/>
    <field name="frame.time" showname="Arrival Time: Apr 25, 2013 14:39:28.634374000 Pacific Daylight Time" size="0" pos="0" show="Apr 25, 2013 14:39:28.634374000"/>
    <field name="frame.offset_shift" showname="Time shift for this packet: 0.000000000 seconds" size="0" pos="0" show="0.000000000"/>
    <field name="frame.time_epoch" showname="Epoch Time: 1366925968.634374000 seconds" size="0" pos="0" show="1366925968.634374000"/>
    <field name="frame.time_delta" showname="Time delta from previous captured frame: 0.000090000 seconds" size="0" pos="0" show="0.000090000"/>
    <field name="frame.time_delta_displayed" showname="Time delta from previous displayed frame: 0.000090000 seconds" size="0" pos="0" show="0.000090000"/>
    <field name="frame.time_relative" showname="Time since reference or first frame: 0.002155000 seconds" size="0" pos="0" show="0.002155000"/>
    <field name="frame.number" showname="Frame Number: 3" size="0" pos="0" show="3"/>
    <field name="frame.len" showname="Frame Length: 54 bytes (432 bits)" size="0" pos="0" show="54"/>
    <field name="frame.cap_len" showname="Capture Length: 54 bytes (432 bits)" size="0" pos="0" show="54"/>
    <field name="frame.marked" showname="Frame is marked: False" size="0" pos="0" show="0"/>
    <field name="frame.ignored" showname="Frame is ignored: False" size="0" pos="0" show="0"/>
    <field name="frame.protocols" showname="Protocols in frame: eth:ip:tcp" size="0" pos="0" show="eth:ip:tcp"/>
  </proto>
  <proto name="eth" showname="Ethernet II, Src: Dell_65:9f:bf (5c:26:0a:65:9f:bf), Dst: Netscreen_ff:20:70 (00:10:db:ff:20:70)" size="14" pos="0">
    <field name="eth.dst" showname="Destination: Netscreen_ff:20:70 (00:10:db:ff:20:70)" size="6" pos="0" show="00:10:db:ff:20:70" value="0010dbff2070">
      <field name="eth.addr" showname="Address: Netscreen_ff:20:70 (00:10:db:ff:20:70)" size="6" pos="0" show="00:10:db:ff:20:70" value="0010dbff2070"/>
      <field name="eth.lg" showname=".... ..0. .... .... .... .... = LG bit: Globally unique address (factory default)" size="3" pos="0" show="0" value="0" unmaskedvalue="0010db"/>
      <field name="eth.ig" showname=".... ...0 .... .... .... .... = IG bit: Individual address (unicast)" size="3" pos="0" show="0" value="0" unmaskedvalue="0010db"/>
    </field>
    <field name="eth.src" showname="Source: Dell_65:9f:bf (5c:26:0a:65:9f:bf)" size="6" pos="6" show="5c:26:0a:65:9f:bf" value="5c260a659fbf">
      <field name="eth.addr" showname="Address: Dell_65:9f:bf (5c:26:0a:65:9f:bf)" size="6" pos="6" show="5c:26:0a:65:9f:bf" value="5c260a659fbf"/>
      <field name="eth.lg" showname=".... ..0. .... .... .... .... = LG bit: Globally unique address (factory default)" size="3" pos="6" show="0" value="0" unmaskedvalue="5c260a"/>
      <field name="eth.ig" showname=".... ...0 .... .... .... .... = IG bit: Individual address (unicast)" size="3" pos="6" show="0" value="0" unmaskedvalue="5c260a"/>
    </field>
    <field name="eth.type" showname="Type: IP (0x0800)" size="2" pos="12" show="0x0800" value="0800"/>
  </proto>
  <proto name="ip" showname="Internet Protocol Version 4, Src: 192.168.4.233 (192.168.4.233), Dst: 192.168.5.21 (192.168.5.21)" size="20" pos="14">
    <field name="ip.version" showname="Version: 4" size="1" pos="14" show="4" value="45"/>
    <field name="ip.hdr_len" showname="Header length: 20 bytes" size="1" pos="14" show="20" value="45"/>
    <field name="ip.dsfield" showname="Differentiated Services Field: 0x00 (DSCP 0x00: Default; ECN: 0x00: Not-ECT (Not ECN-Capable Transport))" size="1" pos="15" show="0" value="00">
      <field name="ip.dsfield.dscp" showname="0000 00.. = Differentiated Services Codepoint: Default (0x00)" size="1" pos="15" show="0x00" value="0" unmaskedvalue="00"/>
      <field name="ip.dsfield.ecn" showname=".... ..00 = Explicit Congestion Notification: Not-ECT (Not ECN-Capable Transport) (0x00)" size="1" pos="15" show="0x00" value="0" unmaskedvalue="00"/>
    </field>
    <field name="ip.len" showname="Total Length: 40" size="2" pos="16" show="40" value="0028"/>
    <field name="ip.id" showname="Identification: 0x68af (26799)" size="2" pos="18" show="0x68af" value="68af"/>
    <field name="ip.flags" showname="Flags: 0x02 (Don&apos;t Fragment)" size="1" pos="20" show="0x02" value="40">
      <field name="ip.flags.rb" showname="0... .... = Reserved bit: Not set" size="1" pos="20" show="0" value="40"/>
      <field name="ip.flags.df" showname=".1.. .... = Don&apos;t fragment: Set" size="1" pos="20" show="1" value="40"/>
      <field name="ip.flags.mf" showname="..0. .... = More fragments: Not set" size="1" pos="20" show="0" value="40"/>
    </field>
    <field name="ip.frag_offset" showname="Fragment offset: 0" size="2" pos="20" show="0" value="4000"/>
    <field name="ip.ttl" showname="Time to live: 128" size="1" pos="22" show="128" value="80"/>
    <field name="ip.proto" showname="Protocol: TCP (6)" size="1" pos="23" show="6" value="06"/>
    <field name="ip.checksum" showname="Header checksum: 0x06d2 [correct]" size="2" pos="24" show="0x06d2" value="06d2">
      <field name="ip.checksum_good" showname="Good: True" size="2" pos="24" show="1" value="06d2"/>
      <field name="ip.checksum_bad" showname="Bad: False" size="2" pos="24" show="0" value="06d2"/>
    </field>
    <field name="ip.src" showname="Source: 192.168.4.233 (192.168.4.233)" size="4" pos="26" show="192.168.4.233" value="c0a804e9"/>
    <field name="ip.addr" showname="Source or Destination Address: 192.168.4.233 (192.168.4.233)" hide="yes" size="4" pos="26" show="192.168.4.233" value="c0a804e9"/>
    <field name="ip.src_host" showname="Source Host: 192.168.4.233" hide="yes" size="4" pos="26" show="192.168.4.233" value="c0a804e9"/>
    <field name="ip.host" showname="Source or Destination Host: 192.168.4.233" hide="yes" size="4" pos="26" show="192.168.4.233" value="c0a804e9"/>
    <field name="ip.dst" showname="Destination: 192.168.5.21 (192.168.5.21)" size="4" pos="30" show="192.168.5.21" value="c0a80515"/>
    <field name="ip.addr" showname="Source or Destination Address: 192.168.5.21 (192.168.5.21)" hide="yes" size="4" pos="30" show="192.168.5.21" value="c0a80515"/>
    <field name="ip.dst_host" showname="Destination Host: 192.168.5.21" hide="yes" size="4" pos="30" show="192.168.5.21" value="c0a80515"/>
    <field name="ip.host" showname="Source or Destination Host: 192.168.5.21" hide="yes" size="4" pos="30" show="192.168.5.21" value="c0a80515"/>
    <field name="" show="Source GeoIP: Unknown" size="4" pos="26" value="c0a804e9"/>
    <field name="" show="Destination GeoIP: Unknown" size="4" pos="30" value="c0a80515"/>
  </proto>
  <proto name="tcp" showname="Transmission Control Protocol, Src Port: 52887 (52887), Dst Port: 9032 (9032), Seq: 1, Ack: 1, Len: 0" size="20" pos="34">
    <field name="tcp.srcport" showname="Source port: 52887 (52887)" size="2" pos="34" show="52887" value="ce97"/>
    <field name="tcp.dstport" showname="Destination port: 9032 (9032)" size="2" pos="36" show="9032" value="2348"/>
    <field name="tcp.port" showname="Source or Destination Port: 52887" hide="yes" size="2" pos="34" show="52887" value="ce97"/>
    <field name="tcp.port" showname="Source or Destination Port: 9032" hide="yes" size="2" pos="36" show="9032" value="2348"/>
    <field name="tcp.stream" showname="Stream index: 0" size="0" pos="34" show="0"/>
    <field name="tcp.len" showname="TCP Segment Len: 0" hide="yes" size="1" pos="46" show="0" value="50"/>
    <field name="tcp.seq" showname="Sequence number: 1    (relative sequence number)" size="4" pos="38" show="1" value="682c58a2"/>
    <field name="tcp.ack" showname="Acknowledgment number: 1    (relative ack number)" size="4" pos="42" show="1" value="c35b28ad"/>
    <field name="tcp.hdr_len" showname="Header length: 20 bytes" size="1" pos="46" show="20" value="50"/>
    <field name="tcp.flags" showname="Flags: 0x010 (ACK)" size="2" pos="46" show="0x0010" value="10" unmaskedvalue="5010">
      <field name="tcp.flags.res" showname="000. .... .... = Reserved: Not set" size="1" pos="46" show="0" value="0" unmaskedvalue="50"/>
      <field name="tcp.flags.ns" showname="...0 .... .... = Nonce: Not set" size="1" pos="46" show="0" value="0" unmaskedvalue="50"/>
      <field name="tcp.flags.cwr" showname=".... 0... .... = Congestion Window Reduced (CWR): Not set" size="1" pos="47" show="0" value="0" unmaskedvalue="10"/>
      <field name="tcp.flags.ecn" showname=".... .0.. .... = ECN-Echo: Not set" size="1" pos="47" show="0" value="0" unmaskedvalue="10"/>
